subreddit,selftext,title
physiotherapy,"I’m a personal trainer looking for an enthusiastic physiotherapy student to teach me some aspects of physiotherapy. I very much want to stay in my lane, but there is an area where physiotherapy and personal training overlaps, for example where a few tweaks could improve a person’s movement. This is what I want to learn more about, guided by someone. Paid gig. Please message if you someone who might be interested.",Physiotherapy tutor
physiotherapy,,"What is Physiotherapy, and how can a Physiotherapist help you 🤷‍♂️?"
physiotherapy,,Do you know how Remedial Massage is beneficial for you😃?
physiotherapy,Is there another sub that does give advice? I can't afford to see a therapist but want to keep working out so I need someone to give me some pointers on how to make my arm feel better.,Another sub?
physiotherapy,"Hi all, my partner is been working as PT in California for 3 years. Now we are thinking to move in Europe.
Which are the best countries to work as PT considering salary, work environment and language.
I know that UK, especially for the language, would be the best option, but I was wondering if there is in other countries, like for example Swiss, some american clinic or similar where they need english speakers and maybe PT graduated in US. Thanks",Best place to work as PT in Europe
physiotherapy,"Are you familiar with the expression? Maybe not, but you are definitely familiar with what it means and where it originated. 

A patient with a self limiting problem like a ""tennis elbow"" gets bored with his first physio because after a few weeks of treatment nothing much happens. He changes physios and after a month or so, again, not much improvement. He changes again and gets angry because of the ""incompetent"" therapists. Again, after a month or so, he sees a little improvement but not much. And again, here comes the next physio. We're about 6-7 months into treatment and things are improving a little. Maybe of natural causes, maybe it's the treatment. The patient gets bored again and, yes, here we go again, therapist number 6 enters the stage.  

Now, after nearly a year either all the preliminary work of all the previous physios bear fruit (or Mother Nature kicks in) and tataaa, improvement! Healing!

And who did it? Yes, obviously the Last Physio. 

This has some interesting consequences

1. The Last Physio could have done to that patient whatever he wanted, he would have improved anyway (as long as he did no harm). But the therapist and the patient now both believe this treatment is *The Treatment* for tenniselbow. The referring doctor may believe the same. OMG

2. The Last Physio gets a big ego boost. Because of that he will behave in a more confident way and this has a big positive influence on his patients. Super placebo!  

Sound familiar? Any thoughts?","The Last Physio Phenomenon, LPP"
physiotherapy,Hey guys I'm a 3rd year going on placement soon. I have to decide between outpatient spinal unit or paediatric home health. I'm getting mixed opinions on both so I wanted to ask what you guys would prefer and recommend,Community paeds or outpatient spinal unit?
physiotherapy,Happens at a few physio clinics I've worked at and volunteered at as well as on this sub. Why do we call people clients rather than patients? Are they not our patients? The outpatient clinics that use the term clients are also the ones that seem to be there for the money and not care too much about actually helping them get better. Am I missing something?,Why do physios call their patients clients?
physiotherapy,"Title kind of sums up my post

I’m just curious on what other PT’s did in terms of obtaining experience, either during their undergrad or after their undergrad, which helped them getting into their respective masters programs or simply knowing that this is the career they want to pursue

I currently live in the GTA (Toronto) and recently finished my undergraduate degree in Kinesiology, however I’m finding a hard time obtaining a job or even a volunteer position at physio clinics close to me. Most are either not accepting volunteers due to small clinics and social distancing protocols, or others are simply not willing to accept any new workers. Does anyone (preferably individuals living in Toronto) have any advice on where I should reach out to, to gaining more experience that will help me with my applications in the future? I plan on applying for MPT programs within the next year or two and want to have a strong application",[ADVICE/TIPS] Obtaining experience post-undergraduate student pursuing MPT
physiotherapy,"I have an anterior dislocation of my SC joint and it’s a bit protruded.
Who should I get it checked with?
A phyiso or a chiro?",Consultation
physiotherapy,"Hey Guys I recently got an offer from Australian University to study Physiotherapy. I am not sure if it is a rewarding job or whether I’ll have a relaxed life financially. Or if I will enjoy my job. 

May I ask the physios here what they think about their career and if it’s worth it or whether they’re happy about it",Are you happy with being a physiotherapist
physiotherapy,"I’m 3 weeks into my placement (Aus) and due to a mix of clinical and home circumstances I am finding it extremely difficult to cope with worsening anxiety. I see my psychologist to manage this, but the recent stressors are really taking a toll on me. I’m not sure if my supervisor wants to hear my troubles and how it will affect my performance, and the last thing I want is people associating stigma to these types of things. They are aware I’m battling with mental health issues, but don’t know that it has significantly worsened recently.",Should I discuss my declining mental health to my clinical supervisor?
physiotherapy,[removed],Is therapy scheduling a problem at your clinic?
physiotherapy,"First time squatting in awhile due to coming back from an inflamed disc injury so I was bracing quite firm to ensure I stayed tight through the squat. 
Final set of squats of 110kg(242lb) for 8 reps with a RPE of 7. Felt no pain. 

The following day my external oblique on the front side under my left bottom rib cage feels like it’s torn a muscle. Can’t blow my nose without wincing in pain. Day 5 now and it’s still bloody sore to move. 

Ever heard of this before? I’m not looking for medical advice just curious if anyone has heard of this happening before. 

Location: Australia",Sprained oblique from bracing?
physiotherapy,,cross post from r/RedSmileGroup :-)
physiotherapy,"Hey, i am 17M from new delhi india. I have been diagnosed with mild straightening in my lumbar lordosis , i have changed my sitting posture its much better now, but i have a lot of stiffness throughout the back and some pain in my lower back and there is also stiffness and some pain in back of my neck. My physical activity also got very reduced due the the whole diagnosis with the back thing i rested for 2 months straight as adviced. I wanna come back to exercise and sports and stuff . How can i do so , please help i am in a lot of discomfort.",lower spine and neck problem
physiotherapy,,"swelling and pain in the back of the leg (behind the knee), what could it be?"
physiotherapy,"Hi

My physio wrote this referral for a pain management consultant I’ve seen before. 

I know some of the muscles, but could someone explain the letter in plain English please or give me the general gist?

Male
Chronic pain
44
Caucasian
No other illnesses bar chronic pain and now this left shoulder issue. 


Dear Mr Xxxxxxx,
 
Thank you for taking the time to read my referral. Michael has been attending my clinic recently for management of ongoing Left shoulder/CSP pain and tension. Following your most recent injection therapy and Michael’s continual strengthening the lateral shoulder and Upper trap/ Sub-deltoid bursa pain have resolved significantly. Michael has however developed non mechanical pain in the chest wall. Upon assessment this pain is quite consistent in nature but diffuse in anatomical location. On palpation the pain appears to be mostly presenting around the Subclavius muscle and into the proximal insertion of the anterior scalene into the first rib in the subclavian groove and the origin of the SCM (medial portion of the clavicle). To date we have worked on soft tissue release of the subclavian/SCM/anterior and middle scalene and have continued to improve Deep Neck Flexor strength and general R/C &amp; scapula-humeral stability. The pectoral muscles do not appear to be indicated upon assessment and Michael has continued to maintain full active/passive ROM in the left shoulder with ongoing improvement in strength/stability.
 
Michael’s pain however is not improving to any great extent with manual/exercise therapy and continues to be quite irritable at night. Other than the consistency of the pain and the non-mechanical nature of the symptoms there are no red flags of note with no reported aggravating factors or peripheral referral to the shoulder or hand.
 
I would very much appreciate your expert opinion on Michael’s most recent symptoms and your assessment of the neural structures such as the accessory nerve to examine if this may be responsible for the continual discomfort that Michael is experiencing. If you have any queries, please feel free to contact me at any stage.
 
 
Many thanks,",Physio referral letter query
physiotherapy,"Information - I’m a 22 year old guy in the UK who’s just graduated uni studying illustration. Got a 2:1. Now obviously it’s completely detached from anything science related, but I’ve discovered that I’m not sure illustration is the right line for me as it’s too unpredictable. Perhaps would be better as a hobby. I’ve always been into the gym and muscles and the human body.

Now, I don’t have any lower qualifications to do with biology which is obviously an issue. As such I feel I’d need to build up further debt doing gcse’s, A levels, and a degree just to start working. Any advice would be hugely appreciated. I feel really lost.",Is it possible for me to become a physio?
physiotherapy,,Get ready to forget your body pain with modern technology.
physiotherapy,"I'm **recruiting UK patient facing healthcare staff** to take part in **research into values, wellbeing, and burnout.** I welcome you to take part and also to spread the word. The **survey takes 30 minutes**, but there's a **chance to win £100** for your time. Thank you in advance. 

**Please note** that the survey is easier/faster to complete on a laptop/desktop rather than mobile device. 

**Click the link** for further information and to take part!

[https://unioflincoln.eu.qualtrics.com/jfe/form/SV\_eOM9lhw0NQgYYdg](https://unioflincoln.eu.qualtrics.com/jfe/form/SV_eOM9lhw0NQgYYdg)","[Repost][Academic] Values, Wellbeing, and Burnout Survey (Patient Facing UK Healthcare Staff)"
physiotherapy,"I am constantly injured , my legs are always tired and sore. Its prevented me from running at all this summer , I bought new running shoes that fit great so it's not that , I'm 37 so is it just my age ? 
My diet is reasonably good, Im vegetarian and don't eat fast food , smoke or drink (occasionally the odd beer) 
So issues are tight hamstrings , quads , currently bad groin strain. 
I'm going to a physiotherapist tomorrow but you get 30 mins with them to talk about one issue before it starts getting very expensive 
Can anyone recommend a supplement , maybe yoga",Constant niggling injuries
physiotherapy,"Hi all! I am a working OT (predominantly Australia, but also S.E. Asia) who has for the past 11 years had issues with the AT that I prescribe my clients, and the system I am prescribing in. I keep reading the research that says the system is broken and get so frustrated. With that, I am doing research to add to this and try and change the system, for that I really need the help of the Allied Health community.

While I started thinking more about OT's, I also want to hear the thoughts of my PT colleagues as you prescribe as well.

If you have 10 minutes, I really want to know how you feel about AT in your roles. Please hit the link of the QR code for the survey. I really want to see this change, and I think this community does too so any feedback is greatly greatly appreciated!

[https://swinuw.au1.qualtrics.com/Q/DistributeSection?ContextSurveyID=SV\_bjbnA7R0yKOGQnk#:\~:text=and%20AT%3C/a%3E-,OT%27s%20and%20AT,-Qualtrics.com](https://swinuw.au1.qualtrics.com/Q/DistributeSection?ContextSurveyID=SV_bjbnA7R0yKOGQnk#:~:text=and%20AT%3C/a%3E-,OT%27s%20and%20AT,-Qualtrics.com)

&amp;#x200B;

https://preview.redd.it/vr31gm8o6cf71.jpg?width=1275&amp;format=pjpg&amp;auto=webp&amp;s=7518f039ef50dfebf0aeae421ddda3ba7bb61bbd",So what do you all think about assistive technologies?
physiotherapy,,Thoughts on this question
physiotherapy,"You all know these. 

""Yes but my knee (hip, back, shoulder, job...)"" ""Yes but I try to loose weight but"" ""Yes but my job"" ""Yes but my garden"" ""Yes but right now"" ""yes but you know"" ""Yes but whatever""

What do you do? For every effing educational step you take they have a f*cking ""yes but"". 

Sound familiar? What do you do?","How do you deal with ""yesbutters""?"
physiotherapy,,How to treat carpal tunnel syndrome part1. #shorts
physiotherapy,,Lowbackpain exercises for lumbar disc bulge (physiotherapy) #youtubemonetization
physiotherapy,,Exercises for osteoarthritis? #shorts
physiotherapy,"I am studying physiotherapy, but I have always had a big interest in business and law, I know there are courses in healthcare management that can be taken by healthcare professionals. But in the law field all that my searches got me was healthcare law, but I don’t know if that can only be taken by lawyers. If yes anyone knows anyway of working (or having some connection) in the healthcare and law area while being a healthcare professional ?",Can a physiotherapist work in the law field ?
physiotherapy,"Do you think you can see yourself spending a lifetime in the NHS? Do a lot of colleagues eventually go private or quit physio altogether due to burnout?

I’ve spoken to a lot of physios that love their jobs but they mainly happen to be working privately. The only negative physio I spoke to happened to be working for the NHS and that person decided to quit the career altogether (as a B7 working for the NHS for 10+ years). 

Basically want to hear from more NHS physios to compare their experiences / see if there are more balanced views for reassurance! 

If any NHS physios are open to me messaging with some questions, please let me know. :)",UK physios working in the NHS - do you plan on leaving?
physiotherapy,,8 Best tips to avoid back and neck pain while working from home
physiotherapy,"United Kingdom.

I’m a Canadian immigrant living in the UK.

I have a Bachelors of Arts degree from a Canadian university, but not many science credits.

I have been a carer/personal assistant for the last 6 years, heavily involved in a disabled sport. Both on a local and national level.

I am also a qualified personal trainer. I am very interested in the field of physiotherapy, and was wondering what are the best ways of getting into the field. 

If anyone could help point me in the right direction I’d really appreciate it.",Becoming a physiotherapist
physiotherapy," We are full time physical therapists in New Jersey that take pride in being able to help our patients with a wide variety of cases. We have the most experience and we can care for injuries from sprains, strains, orthopedic trauma to more complex surgical cases. I know it’s always a worry when you need treatment or rehabilitation, but you can trust the pros here at Elite Physio Camden.","Elite Physio Camden | Physical Therapist In Merchantville, NJ"
physiotherapy,"I'd love to hear your answers. One physio from my Kin practicum said that manual therapy is the *thing* that makes physios stand out.  
What are your opinions?","In your opinion, what distinguishes a Physiotherapist from Kinesiologists or personal trainers?"
physiotherapy,Physiotherapist-delivered behaviour change interventions improve physical activity levels.,Efficacy of interventions to increase physical activity for people with heart failure: a meta-analysis
physiotherapy,"I'm suffering from a form of chronic pelvic pain which I think came on through kegelling during sex and during lifting. I've been to many doctors, pelvic floor physios, and done online programs with no results.

I'm doing my own research into trying to fix this issue, and I'm wondering if anybody knows if your body ""learns"" behaviour and if it can be undone?

So if when I was in the gym lifting I'd always feel my pelvic floor contract as if it was to stabilise the weight, rather than using my core. This would happen for things like squats/deadlifts, but also for simple movements like curls or lateral raises.

My theory is that my body has learnt to contract the pelvic floor constantly, and that I need to ""unlearn"" this behaviour in order for me to recover. Does anyone know of any resources for me to read into a phenomena like this? (if one exists)","Can your body ""learn"" to keep muscles contracted for a prolonged period of time? (not medical advice)"
physiotherapy,"Hey im not sure if this is the right forum for my question but can any one point me to the right direction?

 I have a small problem with the achilles tendon area of my left side of body. It has a small pain during dorsiflexion and plantarflexion of my foot with cracking/pop sounds. I mostly noticed it during small movements such as if i was sitting my legs crossed and bouncing my foot or if i was kicking out the leg of my trouser which had rolled up so it didnt bother me much but recently i have been feeling it with no reason. Btw, i have tendonitis in my foot a few years ago and that was mostly in the arch area and only affected me during running so i wear insoles in my shoes.",Is this achilles tendonitis
physiotherapy,"So I will be volunteering at a sport event. It will be a training week for 120 rugby players (school) . This will be in 4 months from now.  The organiser need a physiotherapist for the event. A friend knows the organiser and have suggested me.

I have not had any placements or hospital experience yet. I will start with practicals in about 2 weeks ( covid and lockdown) at the uni gym for all my subjects. 
Is there any advice you have for me as a student physiotherapist to prepare?
I am not familiar with rugby ( as a female I do not play rugby)  and would like to be prepared.  I have not had exposure yet to sport injuries in general as a physio student and was in lockdown for a year and a half now since my program started. 

If you have advice for common injury types, general equipment that I need,  management of injuries like shoulder dislocations  and muscle injuries - anything that might help for preparation. 
I have a portable massage bed and wondered if these are needed at this sport event? 

So I know I am not yet competent as a clinician, I am a student and would like to learn. I plan to contact my  sport lectuter for advice and any protocols, also and ask fellow students to volunteer.",Good resources and preparations for sport volunteering?
physiotherapy,"Who’s better for swayback posture? A kinesiologist, a physiotherapist or a chiropractor? 
Or is there any other professional you recommend?",Swayback posture
physiotherapy,,Physio Circle
physiotherapy,[removed],I’m a female physical therapy student based in Australia. Need some advice on my tutor’s behaviour?
physiotherapy,,"Needing to ask a physiotherapist a rather sensitive and confidential question, could I please PM someone to talk? Thanks"
physiotherapy,"Currently a 5 year Physio in Australia and looking to buy into a franchise and open up a new clinic. 

Just wondering for those who have bought into a franchise, what are the initial costs (both buy in and fit out costs) and profit share? Is it worth it and what are you experiences with it so far? 

Keen to hear from international Physio franchises too. Currently comparing at all the big brand names in Australia.",Franchise owner costs
physiotherapy,"Hey, I was diagnosed with costocondritis and I feel pain in the chest when moving my thumb on my left hand, and weirdly when I close my left eye.

I've been going through myofascial release and it's been great.

But this eye thing is something I can't wrap my head around.

1) Is there some kind of software or video that shows the relationship between eye movement and pain near the sternum and the ribs?

2) What kind of professional should I go to in case the myofascial release doesn't work for that? 

Thanks!",Chest pain when the eye closes
physiotherapy,"Another rant incoming. I’m halfway through my first hospital placement (Aus cardio stream) and I have just received feedback from my clinical educators. I have very poor clinical reasoning skills, the theory is in my head, I just can’t pull it out. I have trouble reading through medical notes and piecing it together, I get flustered very easily. I feel very deflated about being a competent clinician and I don’t know what to do to improve this. Speaking from experience, what would you recommend me doing?",Poor clinical reasoning skills during placement
physiotherapy,,What does this Sub think about this kind of information still going around
physiotherapy,"How often do you find yourself having to get rid of myths and misinformation before you can move the patient forward?  
I do wonder how many generations it takes to get rid of a myhth - perhaps certain ones will never die off",What does this Sub think about this kind of information still going around
physiotherapy,[removed],Research opportunities in Canada
physiotherapy,"Hi all, 

I have recently been accepted to RGU's MSc Physiotherapy program starting in January 2022. Awaiting notice from GCU prior to making a decision on which university to attend. 

While doing my undergraduate degree in Kinesiology, I was accustomed to 20-25 hours/week of lectures, 20-30 hours/week study time, and maintained a part time job of 20 hours/week. 

Just trying to wrap my head around how intense and extensive MSc Physio programs are in the UK. Talking to my colleagues (I work in private practice as a Kin.), some have mentioned I will have free time on weekends and just have to buckle down during exams, others said to prepare to not have a life for two years. 

Do you feel maintaining a part time gig on the weekends (1-2 shifts in a service industry) would be possible with the time commitments of the program?

Thanks in advance,

C",Time commitment - MSc Physiotherapy in UK
physiotherapy,"The muscle in the middle and the bit attaching to the elbow are where the tears are.
Swelling is gone but it's very weak and I get sharp pain just by holding a cup out. 
I've started cross frictional massage today.

Is there anything else I should be doing?

7 days ago I couldn't move my arm at all.

Is another 7-14 days realistic to get back to activity?",Torn a muscle in forarm. 10 days in... Pls help
physiotherapy,"Ontario.I was fired from the big organization. Reason - I didn't fit in. 
I was the only person of colour in the workplace consisting of all white coworkers and patients. 
My coworkers complained about me a lot. I understand that I would have done mistakes, but it happens at workplace by everyone. 
I tolerated a lot, thinking I am a new staff. So, it's going to take time to adjust  the culture. However, lots of complains, systemic racism lead to mental stress. I am glad they fired me.i was starting to have mental breakdown. 
However, now I don't want to bring that negativity at my new job. I am searching for job in multicultural environment. 

What should I answer when job interviewer ask "" why did you left previous job?""",What to say in new job interview when you were fired.
physiotherapy,"I’m based in London and I rode a bike I wasn’t that used to pretty hard for 3 full days with friends and since then my knees, despite resting them and not riding for a couple of weeks, have not been the same since.

I also sort of twisted my knee the other day playing football and am still walking with a slight limp.

Do I need to talk to a physiotherapist? And can someone recommend one in London? Or should I go to my GP?","I’ve been getting increasing issues with my knees, who should I talk to?"
physiotherapy,"A patient who twisted her little finger 2 months ago , she did an x ray there was no fracture. 
Shed had pain in adduction ( no longer ), and she has pain in actively extending her  distal phalanx ( which she still has till now)
When passively or actively moving the distal phalanx in flexion she has pain . 

She had a blue discoloration on her dorsal aspect of middle phalanx that started to go away 2 weeks ago. 
The swelling still exist till now .

MRI will be expensive for her. 
My thoughts is that she has a severe strained muscle
What do u think ?","I am a physiotherapist a patient referred to me with swelling in the little finger for 2 months now,your thoughts?"
physiotherapy,[removed],Knee cracking - pls help!
physiotherapy,"Canada. Today I had job interview. I was asked. How would you resolve conflict between PT and experiened 4 PTAs ( 15 years experienced)? 
( Senario- in physio department 1 PT and 4 PTAS . Conflict regarding overlapping of roles and responsibilities. )

I answered.
First I would try to resolve with team meeting. 
Secondly, I will try to tolerate if there is some hate emotion. As we work in team, ups and down will happen.
Thirdly, however, if hate is increasing in team, I would talk to manager to review on roles and responsibilities  of PTAs and PTs to avoid conflict in future. 

Please share your thought what would you answer?.",Question asked in job interview
