subreddit,selftext,title
physiotherapy,"



So I can’t really remember why and how, probably because I grew so much during these last years my inside of the hamstring hurts. It used to hurt on both right and left, but now only left hurts. 


Not so long time  ago it used to hurt a lot when kicking the ball or stretching it too much. Now it’s better

Yet now, especially when I do leg curls it hurts, and sometimes a lot. Today, I did glute ham raise, and it hurt really much. 

What can I do? Pictures:

https://imgur.com/a/QYhrEaO

Please link me to another subreddits.",Inside of the knee/ hamstring has been hurting for over 2 years
physiotherapy,"Not asking for medical advice.

We had a discussion among colleagues about cervical problems and beards. And men. 

One side claims that men who shave move their head in many different positions and thus maintain mobility which was a good thing. 

The other side put forward that some of these positions are so ridiculous that after many years of shaving they could be harmful. Thus bearded men would show up less frequently with Cx problems in a physio practice.

To be honest, I never treated a man with a long beard with Cx problems, but who am I.

 
Truth be told there was some very nice wine involved. 

Any ideas?",Men with beards. What about cervical problems?
physiotherapy,[removed],Msc Physiotherapy (pre-registration) jan 2022 intake questionsssssss
physiotherapy,"So I've completed about 60% of my clinical placements at an Australian uni. Unfortunately, I was forced to take a prolonged absence due to a significant decline in mental health caused by uni and placement. The break was ultimately necessary to get myself back to a functional level.

I've been out of the game for about 18 months, during which I have not touched a single thing physio related. 
I  unwisely ejected the entire physio curriculum from my head, putting me in a bit of a predicament.

I'm tentatively considering making a return to my degree, however, I simply feel I have forgotten so much content during this lay-off, that I simply would not be in a position to pass the clinicals. I basically only recall MSk content, acute and neuro are pretty much zero and they are my remaining placements.

The other alternative and one that I'm considering would be to graduate now with a health science degree, but I'm not sure whether there is much value in that. 

Has anyone ever been in a similar position or able to provide any suggestions?",Returning to clinical placement after prolonged absence.
physiotherapy,"I don't want a medical advice, I just want to know different methods.

What did you experience is the best method for knee pain, especially an inflammation at the Quadriceps tendon approach.

I already tried stretching, taping and shock wave therapy, everything without success.

(Germany)",what did you experience is the best method for knee pain (inflammation)
physiotherapy,"18 years old, male, Austria. I do not smoke, I don't drink alcohol or so. I do not eat milk-products, gluten and sugar. I do a lot of skateboarding, except for the last about 2 years.

&amp;#x200B;

**What it's about:** Almost 2 years ago my left knee pain started. Unfortunately, I did not react quickly enough and thought it would go away on its own. A little more than half a year ago I went to a physiotherapist and other doctors, which all brought nothing. Among other thnings I tried stretchting and taping, but no results. Then I had an MRI.

The 6th doctor who looked at the MRI found an **inflammation** at the quadriceps tendon insertion. This led me to shock wave therapy, which didn't help either.

I don't know what else I can do now. I want to finally get back into sports.

**The pain occurs:** With load, if I go for example in the knees, as with squads. But also when I have it hanging in the air and then just stretch out. The pain is sharp.

**Where:** Above the left kneecap, slightly out to the left.

What options do I have now to finally get rid of the pain and inflammation? Maybe it's not the inflammation that's the problem, or the doctor is wrong about this and the problem lies elsewhere.

What could be the problem and what options should I consider now tho finally solve my problem?",chronic knee pain for 2 years
physiotherapy,"NOT A MEDICAL ADVICE , i just want to know the difference between them . Who can effectively treat headaches prolly caused my muscles in neck or head .I have to choose between the both Because im low on budget and can afford only one .","what is better for headaches , a physiotherapist or a chiropractor?"
physiotherapy,"Is it been 2 months since the injury and it is still significantly swelled.
It had blue discoloration on the area of pain it now started to disappear.
She  can do the movement actively but the end range of the stretch has pain .

She didn’t do MRI.
Is it a grade 3 or it is just Severe strain.
Any recommendations for what to do",Strained little finger is swelling for 2 months ?
physiotherapy,"I’m in Australia and my physio does the same kind of sports and has the same type of interests as me.  Would it be regarded as strange to be social media friends and go cycling or run together? I’m talking about a purely plutonic friendship. We get on well during physio sessions, but I don’t want to invite this person along for say a group ride if it would place them in a professionally difficult position to be hanging out with a patient.  Any thoughts or advice are welcome.",Is it professionally frowned upon for a physiotherapist and their patient to be friends?
physiotherapy,[removed],درد تاندون آشیل
physiotherapy,"I recently discovered that my left shoulder/lat seems pinned and difficult to release while my right though rotated forward is free and easy (my pelvis and abs can ""let go""  
I discovered that pulling my left wrist up very slightly can immediately release the left side/lat and wrists down/forward clamps up under my arms.  
Why is this and is it normal?",Wrists back releasing lat dorsi
physiotherapy,"I live in a country where the cars are on the right and the driver is on the left. My left arm does nothing when I'm driving and my right arm does all the work at home ma and all the work when I'm driving because it's changing gear a lot, it's always active. My left shoulder has degenerated in my 40s, and I'm pretty sure that if I was driving on the right side and changing gears with my left arm, it would be a lot stronger inside. I would be interested if there was some data about shoulder injuries in the UK vs France or in Europe vs America, to see if people keep their left arms fit for longer by using it to change gears in the car.",Do left side driving countries experience more shoulder problems?
physiotherapy,"I'm looking to be a physio, not expecting a 99 ATAR so planning to do a health science or sports science undergrad, then physio masters. My options for the master's are UTS, USYD, MQ, and the options for the undergrad are UTS, USYD, MQ, WSU, UNSW. But I'm not sure which undergrad degrees would make me eligible for which masters. If anyone could advise me on which bachelor's correlate to which masters at other unis that would be highly appreciated.",Where to study (Aus)
physiotherapy,I've just failed a placement. They were saying I was unprofessional and,Will it ever get any easier?
physiotherapy,"My location: UK

Hi all, first time poster and soon to be a mature Physiotherapy student (September start).

I had spoken to a few physios before deciding to enter the profession and a surprising amount of them had what could be described as a portfolio career. They had their main job as a hands on clinical physio, but backed this up with other work, such as academic teaching or something completely different like bar work and administration.

My question is, is this fairly popular in the physio world and if so what other jobs do you have?",Portfolio career
physiotherapy,"Sorry, I know this subreddit isn't for medical advice, its just gone 7am here. I didn't know who else to ask.","Um, help? Anyone?Just as I woke up I stretched and felt (and heard) a rather large crunch and I now have quite a sharp pain in my neck at posterolateral C1-C2. I can't turn my head right to look forward and am stuck looking slightly off to the left."
physiotherapy,"Anyone work for the health authority and can tell me how much they pay each month for benefits?

I'm a PT in Vancouver BC and want a good benefit package, though don't want to have to work at the hospital (ie. $37-45/hr) to get good coverage. 

Those of you who are independent contractors, where do you get your benefits if you have them?","Extended group benefits in Vancouver, BC"
physiotherapy,"Hi everyone..maybe this post will be allowed...basically i'm doing quite a lot of stretching and physio to help knee pain..my hamstrings are pretty tight and when i do the 90 90 test..i obviously can not have the leg straight missing about 20°... the only thing i want to ask if is somebody knows how long it might take to manage to have the leg completely straight? im 29 years old and i stretch 5 minutes each day.  
thank you!",90 90 hamstring stretch test not a medical advice
physiotherapy,"Fast forward from my previous reddit post, I’ve just finished my first week of my first hospital placement (Aus). I’ve learnt so many cool things, but at the same time there’s A LOT of stuff to learn about and skills to master. I’m feeling overwhelmed with expectations, which is impacting on my performance.  

My anxiety stems from safety and not believing I’m safe enough to be around my patients. And if I don’t feel safe around them then I don’t feel confident treating them. I had 3 panic attacks just today thinking I somehow unintentionally put my patient at risk (which may or may not be true). 

Another thing fuelling my anxiety is the work environment. Everyone is so cold!! I would greet them but they’d just give me a cold shoulder. I get it I’m just a student and completely understand you have a busy schedule and I won’t be here for long, but I’m a person, is it too much of an ask just to acknowledge my presence? These things stress me out a lot and it’s not pleasant having that afterthought when seeing patients or chatting with my supervisor.",Anxiety during placement. Feeling ignored and invisible
physiotherapy,"Not looking for medical advice, just wondering if this is something physios can treat and what type of physiotherapist I should go to.

I (f23 in Canada) believe I have what it called ""trigger finger"" which affects the middle finger on my left hand. I started noticing it when I began rock climbing years ago, but it appears to have gotten worse after this season of tree planting and now with the manual labour in my current job. I started wearing a brace at night but it's still stiff in the morning and pops throughout the day. 

Can physios help treat this condition? If so, what type of physiotherapist should I look for?","Can physio help treat ""trigger finger""?"
physiotherapy,,Best Spine Treatment in Zirakpur | 10 years experience Physio in Zirakpur
physiotherapy,"For those who have bought into an existing practice to be a partner, how did the structure of the deal work? Any specific or ballpark numbers for cost. 

Also, any thoughts on buying into a practice vs. starting your own?",Buying into a practice vs. starting your own
physiotherapy,"(Not a physiotherapist) but interested in this question. Do you have any articles, books, or studies that can help me learn more about this question or your own personal experience? Thank you.",What are the techniques/therapies used to get someone with dementia to increase their function/mobility after hip fracture surgery?
physiotherapy,"Hello, I am entering my last semester of undergrad as a Kinesiology major and have found it incredibly difficult to find clinical experience in inpatient settings. All I have is about 60 hours logged so far at an outpatient facility and feel incredibly behind compared to most of the people I intern with. 

I've been pitching myself for the past two years now and have had no luck elsewhere. If any of you work with students like myself, what has stood out to you in past applicants? And if you've successfully found experiences as a student, what do you think aided you in doing so?  
I'm taking a year in between undergrad and PT applications, so I'm hoping to log way more hours at my current clinic (As I absolutely love this place, and the people who I work with and learn alongside are all amazing) this semester but would like to start looking for new opportunities for the springtime.. 

Any advice or words of encouragement are appreciated! I hope anyone in a similar situation is able to get help as well and be presented with the opportunity to expand their skills soon!","How to ""sell"" myself for internships (Undergraduate)"
physiotherapy,"My mom tells everyone about her arthritis all the time, claims disability for it, etc etc 

Yet she works out, as she has for years, like three times a day doing very intense looking circuits with burpees and push ups and all that kind of craic

Well aware I could be a huge asshole here, I just wanted to know for sure cause she lies about a lot of stuff",Can someone with severe arthritis work out three times a day?
physiotherapy," Sorry in Advance for the long post.

TL;DR: Been dicked around by medical practitioners regarding my wife's muscle/body imbalances that are causing upper back, shoulder, and hip pain from a long sedentary lifestyle. Looking for a strategy to better communicate with them relevant information to actually get a diagnosis/treatment plan.

Hello First and foremost I am not looking for medical advice. I am looking for advice on how to find and communicate with a physiotherapist so they can give in person medical advice. A certain approach, keywords or something because all they seem to want to do is drag out the appointments and not even talk about the issue.

My wife and I are 28 and live in Canada, British Columbia on Vancouver Island. She is 5’ 1” at 120lbs.

This all started when she got stress fractures in both her shins from doing a few kickboxing classes, she went to her GP and all they told her is to do low impact for a month and didn't recommend us to a physio. A month later they weren't any better so we went again and pretty much got the same response as last time just saying ""it takes longer with some people"". We decided to go to a Physio without a recommendation and the first one we went to just did acupuncture and ultrasound to ""speed healing"". When we asked for an exercise prescription they just kind of dodged it several times.

Frustrated we tried another place where the physio gave her an exercise prescription and briefly inspected her saying she was tight in places that she shouldn't be and when asked if there was a hip imbalance he said yes but apparently “you are just born that way there is nothing you can do” which we know for a fact she wasn’t born that way, regardless the next step for the physio was to have my wife’s feet and gait measured and those graphs were all kinds of up and down with the worst being her right foot arch is collapsed which again we were told “there is no way to fix that but orthotics can help”, so to deal with this we got the custom orthotics but also began to do some research on our own.

This research lead us to some exercises for strengthening the muscles in the foot arch and I can confirm that it has been fixing the “unfixable” arch in her foot in addition to finding out that my wife has “Anterior Pelvic Tilt” which was putting extra strain on her shins making them heal really slow or not at all. We managed to fix  it after about 2 months of doing exercises which again we found online but we knew there was more wrong with her posture and alignment so we tried pushing for an x-ray to maybe see and confirm if there would be a supposed leg length discrepancy or if it is just posture, to which we got a response of “That’s too much radiation to put you through for this”.

Again frustrated with what we were being told and not really given any proper diagnosis we tried 2 other physios that continued the trend of not really paying attention to what we were saying, coming up with half assed exercises that they point us to a video with and don’t even help her get the form right which she can’t even get right because of her imbalances.

Finally we decided to try a chiropractor and they actually bothered to measure her tilt, showing it to be a few degrees tilted at the hips and shoulders and managed to get her some temporary relief in her back and shoulders, but again that is only temporary.

From our own research at this point (Again not from a practitioner of any kind) we pieced together that she may have “Knee Valgus” on her right leg as it bends inward, “Lateral Pelvic Tilt” with her left hip tilted higher than her right, and a “Rotated Pelvis” with her left side more forward than her right which is causing all sorts of pain in her hips, groin, upper back, and most importantly underneath her shoulder blades leading her to having poor quality of life, feelings of despair and panic attacks as no one seems to be able to help her.

My overall impression is that either these people don't know what they are doing or just trying to turn my wife into a forever customer by just applying a ""bandaid"" on the issue and not addressing the underlying cause, however my hope is that I just am not saying the magic words that properly describe the issue and get them to actually understand what I am asking of them.

I assumed that it was supposed to work like this: 

The GP hears your issue, recommends you to a physiotherapist, the physiotherapist gets your relevant medical history and does a physical examination, measures your range, checks for imbalances, maybe gets an x-ray to confirm the exact degrees of tilt, displacement or if there was an actual discrepancy with leg length. After that a treatment plan is made to strengthen and/or stretch muscles to slowly get things back in line with hands on guidance to do the exercises properly and with good form even if it requires recommending to a personal trainer with a reschedule appointment every few weeks to check progress and readjust the exercise program, but to be honest I don’t know I’m just a grocery clerk and this is my assumption.

At this point all we are doing is scouring articles and youtube for exercises that can strengthen the weak muscles on one side and relax the tight muscles on another but we are nowhere near medically knowledgeable and it’s just panicked trial and error and we are really desperate. 

Conclusion:

Really sorry for the long winded post I didn’t know what information would be relevant so i just put the whole story here, I just want to know if this is at all normal and hoping that there is just specific terms or way I need to approach a physiotherapist to get some proper treatment, it has been ruining my wife’s life she can’t be active without any pain and at this age that’s a tragedy. My wife has not had any broken bones or serious injuries that could have caused these things to be unfixable, we believe that it is from years of a sedentary lifestyle since a child to young adult crossing her legs a lot and leaning to one side and over time for hours at a time at home/work and it just really screwed her postural balance, but this should be theoretically possible to fix fairly easily just with a lot of time and dedication of doing the right exercises and not encouraging bad posture and sedentary life.",Advice On How To Better Communicate With A Physiotherapist (Not Medical Advice)
physiotherapy,"Hello, I about to start studying physiotherapy and I want to start off with some books to read about general and basic subjects in physiotherapy. Any books for beginners recommended? maybe about human anatomy or physiology? Thanks ahead.",good books for beginners
physiotherapy,,"neck tendon is always tight, can someone help me address this issue properly?"
physiotherapy,"From canada. 

What do you do when your profession is not appreciated by patients and coworkers?",What do you do?
physiotherapy,"So I've already asked a question about Bob &amp; Brad, but I realised that hey, this subreddit could also help me a lot with my general approach to weightlifting.

I want to make sure I can weightlift successfully for many, many years (the rest of my life if possible: I'm 21 now) to come. I enjoy it, it improves my mental health, and has many other benefits. 

I am also acutely aware of the risks involved with weightlifting - namely, connective tissue injuries and wear-&amp;-tear. I want to avoid these as much as possible. 

Since I'm barely a month into weightlifting (though I did have a 4 month period when I was 17 where I did it, which ended in right wrist tendonitis), I want to set good habits now. For now, I'm struggling with **potential** areas of injury - namely, my unstable shoulder, my left knee (with twinges at the patellar tendon), my left elbow (a result, I think, of my unstable shoulder and weak left wrist), and finally my right wrist, which has been unstable and weak since my injury.

Right now, I'm mainly worried about how to approach the first few months of training, which are characterised by large increases in strength, muscle and stress/load on the tendons (while I know that tendons in particular are slow to adapt to greater loads)

Any advice on how I should approach my weightlifting for longevity, safety and good results?",(Kinda) Follow-up to previous post: Best practice to avoid injury in weightlifting for long-term training
physiotherapy,"Hi everyone!

I'm someone who has recently restarted going to the gym and weightlifting, and I know how important it is to train safely and to make sure my tendons strengthen alongside the muscle. I've historically had wrist problems, and recently I have started to have some knee, shoulder and elbow pain.

I'm doing exercises to sort these all out, and generally I base these exercises all on the advice of Bob &amp; Brad on Youtube.

Obviously, I'm not a physiotherapist, so I can't judge how well they know their stuff. Can anyone on this reddit confirm (or not) that Bob &amp; Brad are legit?

Many thanks in advance",Are Bob &amp; Brad on Youtube legit?
physiotherapy,"Hey guys,

I will be carrying out a research and I need a Pegboard + Rings as well as an UULEX Chart. I was going to make the peg board myself but wanted to know if it can be purchased from somewhere at a reasonable price. Also if anyone has a printable document of the UULEX Chart please send it here. I live in the UAE so maybe online website would suit. Any kind of help will be appreciated! :D",Peg Board + Rings and UULEX Chart
physiotherapy,"So I’ll be going on my first ever hospital placement next week (Aus) and I have no idea what to expect. I want it to be as much of a learning opportunity as possible but I’m worried in general just because I feel like I have no experience at all. 

As clinicians, what would you expect students to be able to do? What things do you see students do and makes you cringe? Any tips from your perspective would be greatly appreciated!",Things you wish students should know better during clinics/placements
physiotherapy,"I am experiencing cremaster retraction and cramps for couple of months. I had testicular retraction last couple of yours during sex and swimming but it was disturbing rather than painful and not long lasting. 

It is happening many hours now during some occasions and it limited my exercises. 

I think it was triggered after a long walk and situps. I have visited an expensive physiotherapist but they mostly focused to pelvic muscles and it didn't help a lot.

I will appreciate if somehow can suggest something more helpful. 

I saw below page and it resembles a lot what I experience but I don't know what exercises I should do to resolve the problem.

&amp;#x200B;

[https://pelvicpainrehab.com/male-pelvic-pain/2140/case-male-pelvic-pain-painful-sex/](https://pelvicpainrehab.com/male-pelvic-pain/2140/case-male-pelvic-pain-painful-sex/)",Cremasteric Cramp and Testicular Retraction
physiotherapy,"Hi,

Are there any Italian physiotherapists here? I'm wondering how easy it is (assuming you speak Italian and can work in Italy) to transfer your physio degree from another country to Italy. Thanks.",Italian physiotherapists?
physiotherapy,"Hi all,

Hope you're well. 

If one has a muscle tear on one side of the abdominus area which has a sharp pain especially when coughing and sneezing. Would it be okey to swim as excersize as long as it doesnt cause further pain? Or will this hinder the healing process?",Swimming with muscle tear
physiotherapy,[Get 21 programs](https://iformsupport.dk/gratis-traeningsprogrammer/),Get 21 free programs made by physiotherapist
