subreddit,selftext,title
physiotherapy,"i am a second year physio student in the UK.

i’m writing a critical essay where i have to make up a case study and use research articles to find the best treatment for a my patient. i chose my patient to have parkinson’s disease. i now have to decide which treatment i should prescribe this patient. what factors should i consider for my clinical reasoning? 

thank you",what factors would you consider when choosing one treatment over the other?
physiotherapy,,"Where my chest meets my armpit, I can feel small bumps if I push down. Are these fibres, tissue, lymph nodes? Is this normal?"
physiotherapy,"So I was neglected and ignored as a child, hence why these things have only just been picked up.

So a couple of years ago, I saw a physiotherapist for the first time for a dry needling procedure to release painful trigger points all over my back (I have GAD). It worked very well. 

However, as soon as I walked in the room, the PT told me “you have low muscle tone”. I thought they meant I didn’t have much muscle (true), but they explained that they meant my muscles were “loose”, i.e. had lower resting tension than usual. I’ve always been horrible at sport, lean on everything, slump, lean while sitting, etc. 

They said it was still within the “normal” range, albeit right at the lower end, and that in my case it’s probably just genetic (my father and all of my siblings have it too).

I was talking before I was walking as a child (spoke early, didn’t walk until I was almost 18 months old).

I definitely do not have EDS, I’m rather inflexible and my skin is definitely not stretchy (it’s hard to grab it to try and stretch it), although both of my elbows hyperextend.
I do not have autism, after watching family videos of me as a toddler/young child and not having any autism-specific traits, although I was just diagnosed with ADHD, at the age of 22 (F).

Interestingly, all of my siblings and both of my parents fit the criteria for ADHD, but only one sibling, my youngest, fits the criteria for autism (she was very clearly different as an toddler/young child from the rest of us, and her autism is extremely high functioning).

So I was prescribed 10 mg methylphenidate 2 x daily. It fixed my low muscle tone. It also releases the muscles in my back which felt like a hard rock. I can feel my vertebrae in my lower back now. But my limbs, core muscles are “tighter” and I tire less, can use my strength with way less effort. I do things and expect to tire soon, but don’t. I can stand up for extended periods without feeling the need to lean on anything.

This effect wears off as the methylphenidate wears off. Other people have commented that I hold my body differently and look less “floppy” when I take it.

I just really want to understand WHY this could be happening.Is it dopamine? Noradrenaline? What could I be lacking that my muscles need to regulate their tension?",Low muscle tone - stimulant medication “fixes” it while it’s in effect?
physiotherapy,"Hello all!

I was wondering if anyone here has worked as a PT for the Canadian Armed Forces or knows anything about being a Physiotherapist Officer?  A couple of things I would like to know :

Would you recommend working in the military? 

How is the work load compared to being an ordinary PT?

Are there many chances to travel?

Thanks in advance!! Looking for any answers :)",Military Physiotherapy Questions!
physiotherapy,"Has anyone got any experience from any of the 4 Scottish Universities that offer the MSc Physiotherapy (pre-reg) programme? QMU was looking like my first choice but I've heard there isn't a lot of hands on practice so just wondering if anybody has done this course and how they found it or if anyone has an insight on the courses at Napier, RGU or GCU?",MSc Pre-registration Physiotherapy Scottish Universities
physiotherapy,"Greedings from Greece , after 5 years of Uni and couple of Courses and many different concepts, I came to the conclusion that its meaningless spending money in seminars that cost 100-1000 when you can enroll in a master. So i would love to hear your opinions on which is the best University to enroll for Physiotherapy Master.( I know that every master is different in every Uni, but i would love to hear there best ones out there). I was thinking about manual therapy - chiropractic, mainly in europe.",Best Master for a Physiotherapist ?
physiotherapy,"What was the credentialing experience like, how long did it take, difficulties encountered, etc?",Can anybody trained in the US speak on their experience moving to Canada?
physiotherapy,They say sitting is the new smoking.  How does bad posture from sitting affect activation of the core.  It seems very common for people to feel a burning in their hip flexors when trying to do certain exercises.,"How does bad posture affect core activation in exercises like planks, leg raises, dead bugs etc. I'm in Ontario, Canada."
