subreddit,selftext,title
physiotherapy,"I heard clinical component is not required for PCE anymore….
Now what?
Look for what each province requires to be licensed…. am i right?

But when i try to look for it, its not well described or updated.
For instance, when i look for how to become licensed in ONTARIO, it says i still need to pass Clinical components of PCE.

Can anybody help me what to do after passing Written component of PCE in Ontario? (And other provinces, if you could share…)

Are there any challenges further than PCE or written exam, now? After clinical part is now gone?

I feel like im very lost and confused of the entire process of “getting licensed”

Id really appreciate any help…!!!!",Ontario (canada) or other province license requirement ?
physiotherapy,"Hi everyone, I play soccer recreationaly and and I strained my quad recently. I did an US and would really apreciate some help interpreting it.

I'll be translating it from portuguese so sry if it sounds confusing: 
""lesion of the indirect tendon of the rectus femoris muscle with extensive parcial tear extending to the proximal miotendinous junction and tendinous retraction 31mm from the enthesis. There's perifascial blood relatively circumbscribed, suggesting organizing hematoma 6x39x50mm big""

Would apreciate if someone could explain exactly what happened if its pretty bad and, if anyone knows, typical return to play times and if conservative treatment is usually the option

Thank you",Help understanding Ultrassound
physiotherapy,"I've been a gangly boy all my life and BJJ is taking a bit of a toll now from my poor postural habits. 

When I try strengthening exercises for posture I always seem to irritate my rock-like traps and make them tighter. Any ideas on how to build the back strength without too much irriatation?",Any advice on strengthening knotted hypermobile shoulders?
physiotherapy,"Hey, i would like to ask you for your recommendation what would you do in my case. I have a scoliosis and shorter leg. I am wearing a heel in my shoes (CM) which should stable my curve. My curve is not that bad (under 20 degrees). I would like to slowly get rid of the heel. I was going to PT which told me to not exercise my muscles and to exercise on reliefing hardness that it helps in our path on getting rid of heel and feeling better my own body and fixing disbalance (we were doing method in which I was laying on my back with legs on a cylindrical fitball, trying to lay on both sides of a back evenly, feeling rotations in body, using them). nfortunately he wad too expensive so after some time I stopped visiting him. My questions are:

1.  what method would recommend for fixing shorter leg

2. Do you have any recommendation for generally good exercise?

3.. Should i stop trying get rid of heel? 

4. What do you think about not exercising muscles to be hard? (plank, push-ups, pull-ups..). Using akternative exercise for feeling rotation and flows in the body, fixing center of a gravity in the body in laying positions, yoga, etc.

5. Could massage, chiro or some other alternatives help?

Thank you!",shorter leg and scoliosis (20yo)
physiotherapy,,Poor Service
physiotherapy,"Hello! I am looking for some comparisons between UofT and McMaster physio, hopefully from some people who attended the programs or know things about them :)

I would be moving from Atlantic Canada, and I'm not sure which program would be best to set me up for success, the most enjoyable, the least costly in the long run, etc. If anyone can offer any insight to that decision, please feel free to comment!",Physiotherapy schools in Canada comparisons?
physiotherapy,[removed],Shoulder Pain treatment in Gurgaon | Physiotherapy for Shoulder Pain
physiotherapy,"Hello, I am a PT student from the Philippines. Does anyone have a copy of the review books by Eugene C. Rembe?",Board review material
physiotherapy,Any PT students studying in SIT Singapore? Im looking to get SIT notes to familiarise with SG’s teaching as I am returning from UQ PT to study in SIT instead! Would greatly appreciate the help I can get! :),SIT PT notes
physiotherapy,"Have included my different placements and what skills I gained under each. Put down earlier work experience. Experience in different journal systems and exercise banks. 

Also included language skills, drivers license.

Going to write a short profile on my goals.

Is there something else I should add/alter something existing?

Thanks in advance!",Graduating this semester and writing my CV now. Any tips on what it should include?
physiotherapy,"Hi! I just wanted to ask here about how inpatient physios in Canada typically work 

I’m Canadian but trained in the UK and decided to stay and work as a physio here for the last year. 

I’m started the whole (awful) CAPR process to come back to Canada now and just wondering about different practice environments as I’m most interested in working within a hospital, rehab facility or in the community. 

Do you typically use any large moving and handling equipment other than body hoists like the Stedy or stand-aid?  
Are forearm crutches a thing at all? 
Are gait belts used in Canada? (we don’t use here) 

Also sort of unrelated- but would anyone know how the “physiotherapy residents” (ie we’ve completed the written PCE and can work provisionally) fit into hospital or community physio? Everyone I know in my situation is working in a private msk clinic and I’m feeling anxious as I really want to move home but I don’t want to do MSK physio and I’m worried that my inpatient rehab experience here might be quite different and how I would get a job. 

Thanks for your help :)",Inpatient rehab in Canada - equipment and handling
physiotherapy,Undergrad here returning for an MSc Physiotherapy (Ireland). Excited and nervous and would welcome any advice on how best to prepare for the next two years!,What advice would you give your younger self before you started studying physiotherapy?
physiotherapy,"Fitness advice not medical advice; Forgive me if this is breaking the rules I hope it isn’t! 

I (32 m) have acromeo clavicular osteoarthritis (where my collar bone meets my shoulder) in my left shoulder, had it years and it’s not going anywhere. Anyway I’m getting out of shape as I’ve had to give up manual work (was a tree surgeon 11 years, hence the shoulder) but I can’t do push-ups or lift weights because it sets the shoulder off big time.. is there an exercise I could do to build my pecks back up without aggravating my shoulder?",Alternative exercise
physiotherapy,"I am currently out in practical training / internship. Got this chronic pain patient with a wide array of challenges starting after post-op ankle trauma in left leg + shoulder joint replacement. Comorbidities are COPD, hypertension and osteoarthritis in the left foot.

These main issues are over 1 year old, and their reasons for being in the clinic is related to chronic pain and limitations in walking. They have trained ROM and mobility consistently up until now, so my plan is to work functional with motions they can us everyday.

Well...During our starting talk the patient describes numbing sensations starting about 2 months ago. The areas affected corresponds with the ulnar nerve (elbow to fingers) AND superficial peroneal (lateral, just prox. from the knee -&gt; lateral foot). Both issues shoew on patient's left side.

Can anyone here help in diagnosing or discuss a possible hypothesis?

Is their a place where these two nerves interact that I am not seeing? 

Any thoughts on the nerve issue in particular is very welcome.",Patient with left sided neuropathy in ulnaris AND superficial peroneal
physiotherapy,[removed],Neck Pain treatment in Gurgaon | Physiotherapy for Neck Pain
physiotherapy,"Hi,

Please let me know if this posting is not allowed and I will take it down.

I am currently looking for physiotherapists to join our team in Auckland, New Zealand. If anyone is interested, please comment or message me. We can offer NZ residency support if you want to migrate to NZ and I think it will be quite easy as Physiotherapists are listed in the Long term skills shortage list in NZ.

Thanks!",Physiotherapists Looking for work in New Zealand
physiotherapy,"Hi physios, I am part of a science team that is running an international study on what it is like to provide physiotherapy to people who have neurological conditions. If this is something you are interested in (don't have to currently provide therapy to people with neuro conditions), please feel free to share your views via a 5-10 minute survey:  https://eaecu.au1.qualtrics.com/jfe/form/SV\_3JfKCX0wsBmXbp4 

We've already had 150+ plus physios, mainly from Australia, India, and New Zealand. We'd love to hear from more from different countries so please consider helping out if you can. We would be happy to share the findings including your colleagues' views on these topics, at the end of the study.",Your thoughts on neuro
physiotherapy,"Hey!! I am coming for advice about PT school in Canada. I am currently completing my bachelor's degree in Kinesiology in the US specifically Texas. I plan on applying to 2 schools in Canada, McMaster, and UBC for their physiotherapy program. My university in the US does not have the +/- grading system, ex: a 91% is an A and a 99% is an A, and GPA is on a 4.0 scale. This puts me at a disadvantage because for many classes I ended with an 88-89 and it was considered a B rather than a B+ bringing down my overall GPA. Also, I see that the Canadian GPA scale is different in terms of percentages. I had a few questions;

1. When PT schools calculate GPA do they use their own scales with my percentages? or do they use my letter grades? If they use my letter grades do they consider +/- or only what is written on my transcript? 
2. Do PT schools consider the fact that my school does not do +/-?
3. Are percentage grades included in final transcripts or is it only letter grades?
4. I know not many PT schools in Canada accept international students however for Mcmaster and UBC the case is different. Does anyone know the % of international students accepted into their PT programs?

Lastly, I would love to hear any advice from international students who applied to PT programs in Canada.

Thank you!",Wanting to apply to PT schools in Canada after completing my bachelors in the US. Questions and advice
physiotherapy,[removed],Hip Pain treatment in Gurgaon | Physiotherapy for Hip Pain
physiotherapy,,Advanced Physical Therapy Treatment in Delhi | Best Physiotherapist in Delhi
physiotherapy,"Hi there,

We have created a listing website [https://clinicrated.com/](https://clinicrated.com/) where you can add you clinics. If you need more information just let me know we will help you.

Thanks",Add you clinic
physiotherapy,"I'm currently completing a module on creative thinking that requires me to come up with a solution after understanding the problems faced by different professions. My topic focuses on physiotherapists who are working in the community settings. I would like to gather some insights on the problems faced by this profession. If you would be so kind, could you share your experience? Thank you","Physios working in the community setting, what problems do you face in your profession?"
physiotherapy,[removed],Low Back Pain treatment in Gurgaon - DynaFisio +91-8929294516
physiotherapy,"I'm a physiotherapy student having completed my placement and soon to graduate next year (Australia).

PFJ syndrome is by far the most frustrating thing to treat in my opinion, largely because it's so complex, the obvious treatments don't always work and those that *do* work don't entirely make sense.

Case in point, glute max strengthening; why does it work? I understand that for things like sit-to-stands or climbing stairs, having stronger hip extension lessens the requirement for active knee extension = less quads activity = less PFJ pressure.

However most people with PFJ pain (depending on the mechanism) have pain simply with walking. EMG studies and a bit of common sense shows that the glute max isn't involved in walking unless you take large, aggressive strides - yet the treatment *usually* works.

**tl;dl** a powerful glute max is only required for a few sparse actions across any given day but strengthening it can often improve pain at low-intensity tasks - why?",Why do patients with PFJ syndrome respond to glute max strengthening even though very few tasks require high glute max power
physiotherapy,"I was looking cor yumeiho therapists, but haven't found any.",Do you know any yumeiho therapists in Vancouver BC area?
physiotherapy,"Hello, im an bulgarian physiotherapy student and at the beginning i was thinking to go study kinesiotherapy in another uneversity after i graduate next year from my collage (like specialization) but a few months ago a friend of mine introduced me to one of his friends who is physiotherapist and this guy told that it's not worthy to do this and instead to go and take some courses for pnf, Schroth, Bobath etc. So now im curious some people aay it's better to go for the specialization some say otherwise  and im thinking to go for specialization and then to start taking courses. So what do you think abou it and waht will you suggeat me ?",What ahould i do after i graduate (Bulgaria)
physiotherapy,Just looking for a study buddy. Thanks!,Is anybody here studying for the July canadian PCE exam?
physiotherapy,,Suggestion regarding my Right Shoulder’s Injury
physiotherapy,,https://www.reddit.com/r/orthotropics/comments/ul0voc/i_need_a_suggestion_for_a_quick_recovery_to_my/?utm_source=share&amp;utm_medium=ios_app&amp;utm_name=iossmf
physiotherapy,"Hey,

I just finished volunteering at a physiotherapy clinic and I'm about to start volunteering at a different clinic. I was wondering if I need to get the physiotherapist to sign something to confirm the number of hours I completed for the physiotherapy program applications or if it's something I just fill in on my own. I know I need to get a reference from the physiotherapist but I'm unsure about how I'm supposed to show verification of the hours I've completed.",Volunteering for Physiotherapy Applications (CANADA)
physiotherapy,"Hello everyone,

Hope your are all doing well!

Currently I am working on a project which focuses on providing artificial inteligence supervision and systematic monitoring of healing progress for patients at home. As far as I am aware, at least a small part of physiotherapy is related with prescribing exercises for futher rehabilitation at home.

In my collected knowledge after minor incidents or surgeries patients are evaluated and released home to rehabilitate on their own, mainly given a verbal ir written advice on what to do further. Ideally, appointments after several weeks are scheduled to track healing progress, however, not in every case.

That is why I am interested finding out whether physiotherapy specialist see the need for further supervision of their patients. Maybe it is an over exaggeration of problem that do not exist?

Any other thought on a subject would also be beneficial.

Thanks for your time reading this! 😊

—

A Computer Science student from the UK, not related with physiotherapy.",AI supervision during rehabilitation at home- is there a need?
physiotherapy,"I've been a physiotherapist since 2013 and have continued to update my knowledge with various metanalysis and good quality research.   
I constantly struggle justifying my practice when other physiotherapists try to use spinal cracking/massage/electrotherapy/taping as a big part of their practice. Patients get bought out to passive techniques and gaining their trust and diverting treatment towards exercises becomes a challenge.  Does anyone else feel the same way?",Do I have an exercise bias?
physiotherapy,,Physiotherapy and MBA (UK/Canada)
physiotherapy,"tl;dr: Which school/method of manual therapy have you learned or are you working with? Can you recommend it or would you prefer a different one?

Getting close to finishing PT school I'm starting to look for further education. Manual Therapy always intrigued me shadowing different mentors throughout the years. Starting my research I've come to find that there are way more schools than I thought and information comparing them is extremely rare. Of course this is because they each got different approaches and as far as I know not a lot of PTs will spend their money and time on multiple trainings but maybe some of you are more experienced and can offer their advice.

My personal findings thus far were that next to the classics like Kaltenborn, McKenzie, Sachse or Maitland there are some interesting new concepts. Are  reasons to prefer the more traditional methods? 

Thanks for your help :)

Location: Germany",Which Manual Therapy method/school are you working with?
physiotherapy,"I have been reached out by an employer offering me a position in a private clinic in London. He could offer an annual salary or work on a commission. The first option is safer while the second is more profitable (with some risks). Also, I should let you know that I will work while on visa sponsorship.

I do not have previous experience working on commission and I would highly appreciate your thoughts on that. Is it worth it or should  I stick to the basic salary?",Working on commission or salary as senior MSK in the UK.
physiotherapy,[removed],"CHRONIC BACK PAIN – Symptoms, Causes &amp; Treatment"
physiotherapy,"I am to build a rehab centre for kids with special needs. It will also facilitate neurological and physiological research ground. 
I’m after a professional who can invest a little time to help me out with the business plan and more.",Anyone from the UK?
physiotherapy,"I've graduated and been working as a physio at a small private musc clinic for a year now but I'd like to move on to different clinic though still within the field of private musc. 

Would it be worthwhile keeping my student placements on my resume, or just take them off as they aren't necessary applicable for private practice? They were mainly hospital based across different fields (musc, neuro, cardio etc)",Worth including student placements in resume?
physiotherapy,"I am very grateful to be accepted into a very competitive physio program in Canada. That being said, I have been working in social services and am very fulfilled by working with more marginalized people, particularly those afflicted with addictions. 
I have noticed some chronic pain/opioid clinic physical therapist positions but they seem few and far between. I d love anatomy and physiology and in an ideal world I’d be able to use it in the context I work now. 
All that to ask if anyone has any experience/insight into whether physical therapy for addiction related issues is feasible? Particularly in Canada?
Thanks in advance!",Addictions physical therapy?
physiotherapy,"Hello everybody, does anyone study Master MSK at Leuven university? I found this cheap international university and it seems good, but I would really like to have a feedback from someone who is studying (or studied) there. 
Thanks for your help!","Master in Physiotherapy And Rehabilitation MSK, KU LEUVEN UNIVERSITY"
physiotherapy,I've been doing a research on a shoulder related topic and I'm unable to get a free pdf anywhere of the book 'EXAMINATION OF THE SHOULDER: A COMPLETE GUIDE' by Edward G and McFarland. I just want to refer a particular chapter... A set of 10-15 pages. Ebook on Amazon costs 10k which I simply cannot afford since I'm a student. Please help me out.,Need a textbook pdf for research purpose but it's too expensive
physiotherapy,,"Hi everyone, I’ve got this scenario and im confused a bit, there’s a clue at the end says the patient has diabetes and hypothyroidism and i need to assess his shoulder but I don’t know how could this clue help me choosing wt test."
physiotherapy,"As a PT student (Australia), I am curious about many different things ranging from classic Physiotherapy pain science and rehabilitation to neuroscience, psychology and general health. Every day I talk to people asking what they think a private PT does, and the answer/expectations are always very similar: assessment, diagnosis, treatment, exercises, see you one week later, repeat.

As a PT student, I think I can help people more than just recovering from pain. What's stopping PT's from looking at someone's health as a whole? (I know many do, but the community generally \[N=25\] has a strict idea of our role, and venturing outside of this appears taboo). We did this heaps on clinical hospital placements, always checking blood pressure, reading charts and learning about how different medications might affect someone's ability to mobilise.

What is the reason that people can't come in and see PT's for a general health check up or basic health assessment? i.e. blood pressure check, whole body strength testing, cardiovascular fitness testing, assessing markers for longevity (whatever that means, not sure yet), quick mental health check in, etc. It seems that many people see personal trainers for this type of ""non-GP"" information. Why can't that be us? Or is it us? Idk!

Why can't people see PT's as the gateway to improved health overall, where patients come in asking ""how can I challenge my self-limiting beliefs?"", ""How can I begin developing good habits?"", ""How can I invest in my own health?"", ""what's the best way for me to begin exercising?""

I understand that some of this might just be a dream and seem outside of a PT's scope, but I can't help but think PT's could facilitate gen-pop's entry to overall health and exercise. And also not only taking people **in pain** to performance, but people **without** **pain** into performance/health.

Would love some opinions, as of course I am not yet in the industry, so there could be many problems here.

Cheers",Physiotherapy - rebrand? Just a thought.
physiotherapy,"Hello all, I'm just starting out on my physiotherapy placement! I'm a pretty slow learner and I know that the profession I'm in involves a lot of thinking on your feet and is a very fast-paced environment. So I'm thinking that I will definitely go through a lot of hardships in the coming weeks. 

Does anybody have any physiotherapy placement tips on

\-  how to take down notes said by your supervisor and remembering them

\-  reflecting 

\- time management skills (like how does one try to read up and absorb new information when your already so tired at the end of the day?)

&amp;#x200B;

Thank you !!",Physiotherapy placement Tips
physiotherapy,"Hey, I'm going to start applying for Canadian physiotherapy programs in October and had some questions...

1. Is it better to apply in October compared to December-January?
2. If I apply in October can I reapply in December-January?
3. How many hours should I try to get before applying? The only reference I have is from UBC which requires 70 hours for each clinic I shadow at.",Applying to Physiotherapy Programs in Canada (QUESTIONS)
physiotherapy,Which interventions/methods/techniques are generally used to treat a M.S patient that is experiencing a lot of general fatigue,Multiple Sclerosis
physiotherapy,"Looking for advice, if someone can point me in the right way I'd appreciate any input.

Very specifically, ACL injuries in female martial artists.

It's for a friend but I wanted to help them out without them asking.

Cheers in advance.

UK","Books, thesis and papers"
physiotherapy,,do people find physiotherapy actually works for them?.I'd be interested in hearing what someone's problem was and if it was resolved.
physiotherapy,"Hi, I'm starting my new job as physiotherapy assistant this month, and I'll be working in a hospital. The few people I've met so far have been really kind, and at first i was super excited but now I'm so scared 

I've only had 1 job before - working with disabled young people as a summer job - I'm 22, just finished uni (doing psychology, so not even medical related), I feel underqualified, like I'm going to mess everything up, and I shouldn't be working in a hospital, like I'm not smart enough. I'm worried I won't be able to handle the responsibilities or something! I'm going to get training for a bit before starting the job properly but I'm just really nervous. I keep imagining messing up and everyone being frustrated with me or getting mad at me, or getting myself fired:/ 

I have dyslexia which affects my ability to retain information properly and effects my memory and processing speed, and I always got told off for ""not listening"" at school, even though I was, I just had a hard time processing it and remembering instructions, especially if I couldn't write it down to reference it - what if this happens at the job? I told them about this and they were really understanding, I know I'm probably overreacting and catastrophising but it's just because I don't want to mess it up, especially for the patients 

Sorry for rambling, idk anyone else who works in hospitals or in this kind of job who I can ask for advice

How long did it take u to settle in? Is it terrifying at first? Do you pick it up quickly/get used to it? What happens if you mess up? 

Thank you:)",anxious about beginning new job
physiotherapy,"Location: Canada
Hi everyone I was wondering whether Physiotherapy schools only look at your gpa during the last 2 years of your undergrad or all 4 years of undergrad?",Physio Schooo
