subreddit,selftext,title
physiotherapy,[removed],Knee pain treatment in Gurgaon | Physiotherapy for knee pain
physiotherapy,"Hello I am a newly qualified physio in a static MSK role for 3 months. Question to the physios in uk currently working in MSK outpatients 

Does your admin time get better throughout the years whilst balancing a full clinic?

I am getting it done but find it challenging writing letters to GP within 2 weeks and enquiries to advance physios for conditions that require urgent ?imaging. Caseload wise I am getting the hang of seeing follow ups for 20 mins and 40 mins for initial ax. 

Any tips in streamlining admin time during work hours without cutting corners as I’m well aware of the importance of accurate documentation.",MSK outpatients UK based - administrative time &amp; writing clinic letters
physiotherapy,"Im early 20s F, seeing a new client tomorrow for a home visit for the first time. He has 2 dogs and lives by himself. He’s requested massage therapy and I haven’t been given a plinth by the company. I never usually massage any of my clients and a lot of them are in the paeds population. This client is in his late 30s (M) and has schizophrenia, narcissistic personality disorder, depression, anxiety, has had episodes of being violent etc. 

Admin has cleared him via safety and I would be providing massage therapy. 

My company is new and I don’t quite have referrals yet to meet my KPIs (I’m about half way). So I can’t be picky with who I see. 

What should I do?",New grad physio uncomfortable seeing a new client tomorrow?
physiotherapy,"Trying to cut a long story short but I am pretty sure at my first appt with a physio he was telling me I have FND (mental Illness). 

I was referred after a neuro told me my brain lesions weren’t causing my symptoms and the brain lesions are an incidental finding. 

Is it usual for a physio to tell you you’re mentally ill instead of the neuro? 
The physio was saying that the brain can make parts of the body numb by thinking about it and it can make parts of the body swell and change colour? I’ve come out feeling like a fruit loop and I’m embarrassed what the physio must think of me.",How do physio’s feel about FND?
physiotherapy,What are some barriers to exercise for patients who are living with Parkinson’s Disease? And how would a physiotherapist help address these? What skills would be involved?,"I have a question, could you help? I’d greatly appreciate any input 🙂 (UK)"
physiotherapy,What are some barriers to exercise for patients who are living with Parkinson’s Disease? And how would a physiotherapist help address these? What skills would be involved?,"I have a question, could you help? I’d greatly appreciate any input 🙂"
physiotherapy,,Anyone knows where I can find animation clip showing a human body and then zooms into the ankle.
physiotherapy,"I have just completed a foundation year in health studies that leads directly on to year 1 physiotherapy. 

I have spent some time learning origin and insertions of a good few muscles through flashcards.

I was wondering if anybody had any advice on things to read up on or practice before hand, or just general advice would be greatly appreciated!

Thanks!",Pre Year 1 physiotherapy - UK
physiotherapy,,Any resource on dynamic standing balance exercises and how do you guys modify exercises on the spot quickly?
physiotherapy,"So I recently had keyhole surgery due to recurring right shoulder dislocations. It’s been 6 months since and everything is going fine.

I decide to go on a bike ride and fell off and the handlebars pushed out my left shoulder, but to the front this time. About 5 mins later it did it again.

After visiting the hospital, I have it in a sling at the moment. I know I’ll regain all movement and strength in a couple of weeks.

But I’m borderline depressed about how it will continue to dislocate and any given moment if the motion of shoulder is in a similar position. 

X-rays show that the bones are fine. 

Is it worth exploring further by paying for private MRI/MRI Arthogram scans or is it possible that the tendons etc could tighten up over time to give me my life back?",Shoulder dislocations in both shoulders
physiotherapy,"Hello all. I’ve just completed the 1st year of Uni. I want to keep on top of anatomy but was hoping for something a low key, hitting the text books over summer seems like a drag. Is there’s was a ‘muscle-a-day’ or equivalent app, calendar, something out there I could access - any ideas advice gratefully received",Muscle a day
physiotherapy,"Hey all so I'm thinking about studying physiotherapy and wanted some advice from physios especially in Australia. 

1. What are the practical differences between Master's of physiotherapy at USYD and Doctor of physiotherapy at UoM? Is one better than the other? Which would you recommend?
2. I also potentially want to work overseas as a physiotherapist one day - in the U.S, Canada, or the UK. Is one qualification more suited for going overseas? i.e. the master's vs doctor of physiotherapy?

Thanks in advance, appreciate any help.",Studying physiotherapy in Australia
physiotherapy,"I have been a professional dancer for coming up to 5 years now, I trained religiously before luckily landing myself a job also. I’ve always been interested in medicine, the body, and how it works. For people who have studied physiotherapy and physiology, how did you find it all, and what do you find that knowledge brings to you now?

I think I need to move to a different stage of my life, I’ve been dancing since I can remember and want to know more about why we get injured, how the body is so intricately connected and how we can rehabilitate. Any opinions and experiences are welcomed! I find it all very interesting.",Studying physiotherapy in my mid-twenties.
physiotherapy,"Hey, I'm a highschool student in AUS who has recently become interested in PT. I've been searching about PT for a few hours now and am curious if I'm able to become one without going through university. Any advice is welcomed.

Thanksss :) T-T",Physiotherapy without going through uni?
physiotherapy,,What do you think this is?
physiotherapy,"I'm testing the waters on switching my academic career to physio (currently 3rd year business student in Canada), and my first step so far is getting a volunteer position at a clinic over the summer. 

I just finished my first day, went great, just helped out the aides, but being exposed to the environment was very insightful. Anyways, beyond just mindlessly plugging away and sweeping floors for a couple dozen hours, what are some ways of making the most out of the opportunity? 

On the top of my head: talking to the therapists/owners and learning more about the profession, tips on getting into school etc., leveraging volunteer experience into a paid aide position. I'm sure there is a lot that I'm missing, so any tips on the matter would be appreciated.",How to maximize the most out of volunteering position
physiotherapy,"Private practice physio here.

For all senior/long-term and new grad therapists across all expertises. 

**What are some of the biggest challenges you commonly face/what is a resource of any kind you would like to help make your practice/study/work-life balance easier?**

I am hoping to create a digital tool/resource that can address your challenges in the future. So I'd love to hear some of the problems you face on the daily.

Thanks!",A resource/tool that would make work easier.
physiotherapy," Does anyone have access (account unlocked) to the ""muscle and motion"" app?",muscle and motion app
physiotherapy,Would I be able to get onto a physiotherapy BSc program if I have a degree without the appropriate A-levels?,Getting into UK physiotherapy BSc
physiotherapy,"Hello, 
 
I am currently living in Lithuania and working as a sports physiotherapist for almost 2 years, been struggling here for a while with this job and salary, and in Lithuania physiotherapists are not so popular and known as what they are actually capable of doing.

Planning to leave to work in the UK as soon as possible, but knowing the time that HCPC form takes doesn't make it easy , because it might take up to 6 months- 1year

Maybe someone had similar thoughts as starting your path in the UK as a physiotherapist assistant while you get your HCPC, was it hard to get? Do u easily get a visa with that? Or should I wait till I get an HCPC license to move?

Thanks to everyone who will share their thoughts and experiences :)","Leaving sports physiotherapist job in eu, for physiotherapist assistant in the uk"
physiotherapy,,Cost of Massage therapy in Ottawa Physiotherapy Clinic?
physiotherapy,,Cost of Massage therapy in Ottawa Physiotherapy Clinic?
physiotherapy,"Hi everyone, 

Firstly, I have searched for an answer to my queries here and have not found a full set of answers. I am from the UK, but currently in Malaysia, and I'd like to specifically ask my questions to any UK practitioners, simply because I trust the NHS and the evidence-based medicine they practise (I am less interested in complementary or alternative medicine (I am 99% sure that DN is alternative medicine, but not even sure!?)). 

I am from the UK and living in Malaysia because I am a teacher in an international school. I have an injury in my calf muscle and am seeing a physiotherapist for the first time. As far as I can tell they are practising Western Medicine. I am a Biology teacher and everything being explained regarding muscle knots and an injury through overuse/ chronic lack of enough Oxygen makes sense from my A-level level of knowledge. 

He's done some great deep tissue massage that was really satisfyingly painful and I felt improvement after the first session. He also gave stretches etc. In the second session (Tuesday just gone) he did dry needling. It was very painful and the needles were very deep in my muscles and the whole sensation and experience made me feel physically sick. I struggled to walk after and am still limping. He explained to me that the needles break down trigger points and said that this is practised in Western countries. 

My question is: would you as a UK based physiotherapist provide this treatment? I know the evidence is scant but I'd really appreciate the insight into what is happening in the UK. As said, it's the first time I've seen a physiotherapist. Is this normal treatment in the UK? Is it worth the nauseating pain?

Thanks for the insight",A question to UK based physiotherapists about dry needling
physiotherapy,"Context: Aus new grad physio in private practice

Basically my new grad job hasn't lived up to my expectations and those that were agreed upon when I was interviewing for the role. Brief outline of the issues:
1. There's been no mentoring
2. No PD
3. My 1hr a week of documentation time is routinely booked over to fit in last minute patients
4. My caseload is close to 50% home health/aged care, which I was neither informed about when interviewing nor have any interest in doing 
5. Management is hostile when any concerns are raised 
6. IT infrastructure and facilities are of a third world standard
7. On multiple occasions demands have been made to perform additional work outside regular hours without being paid

There have been numerous other small issues not with mentioning. But basically I'm at a point where resentment has set in and I'm dreading going to work. I know my position at this place is no longer tenable and I need to move on for my own wellbeing but I'm hesitating.. I'm concerned what potential employers might think about my loyalty or resilience if I change jobs so soon. I guess I'm also concerned about confrontation if my employer found out. 

What I'd like is a push/encouragement to make the move or advice about how to manage this situation.

I'm also open to any dissenting views from those who think I should persist and if so, why.",Thoughts on quitting new grad job within first 6 months??
physiotherapy,"Hi

Does anyone have a protocols that they use to gauge how 'good' someone's 'core' is?

I know these are very subjective things, that's why used the "" but I was look for some measurable tests to bring into my practice. 

I guess the measurements should depend on the goals but I was first just thinking about healthy living for adults of different ages.

Its just nice to prompt the question, how do we measure stability?

Any thoughts?",Measuring Core Stability
physiotherapy,"I got an ischemic cva pt.
The stroke occured 3 years ago ,they had 4 months of physio and moved into and old age home at the age of 51.
The pt. refuses to more the L upper limb due to pain. 
The pt. has developed contractures in the left hand .
The patient has regressed to an extreme extent over the last 3 years.
The pain in the arm according to the paint is a 10/10 on the VAS pain scale. 
The pain occurs when any movement happens in the shoulder and elbow joint but , tapping brushing and so on does not illicit any pain.
The patient sits with the R arm supporting the L arm constantly , rendering the R arm almost useless. The L arm sits in 80 degrees flexion adducted against the chest with no shoulder flexion.

The question is , would you move the L upper limb to prevent further contractures and a frozen shoulder or do you just treat the Hemi leg and let the arm be ?

If you treat the arm you are moving a limb that has 10/10 pain , but if you don't move it , the pt. Will develop contractures , maybe a frozen shoulder and the subluxation post cva could develop into a full dislocation.",Neuro Pt. question.
physiotherapy,,"When examining a patient with suspicion of a non-neurological cause, what (if any) neurological screening test do you perform?"
physiotherapy,"Hi all, 

(Sorry if this has been asked before but I couldn't find it)

Just wondering what are the ""best"" masters courses currently? 

Best meaning:
-Shorter course
-Cheap
-Easy to apply to
-Good reputation (course or university)

I currently have a BSc in Sports Rehab and Athletic Therapy that I gained in Ireland but all the Irish masters are ridiculously expensive. 

If there is anyone who could provide input and maybe even some previous experience of masters courses I'd love to hear it! 
Looking to do a master's in the next year or two if it's suitable.",Physiotherapy Masters courses?
physiotherapy,"Hi all! I’ll get straight to the point. I am a high school student currently preparing her high school baccalaureate exams in France (but I’m studying in an English school). For the past two years or so I had been vaguely interested in Physiotherapy and decided that I would apply to bachelor programs in physiotherapy. Now being an English speaker and having an international background I liked the idea of getting my degree in the Netherlands, because it is affordable, offers education in English but also closer to my home country. So I applied and got accepted into each of the universities proposing a physiotherapy bachelor. 

However, this year I decided to do much more research on physiotherapy as a profession and found that I as having really bad cold feet about doing this degree. This is mainly because the degree program that I applied to is:
1) a vocational degree so it is very specialized and I am afraid that it has little scope of change should I not like it 
2) taught from a very small university, and I can’t even practice in the Netherlands with this degree because I don’t speak Dutch
3) I am terribly afraid of committing 4 years of my life to a degree that is so specific right out of highschool.

What I do like however is the whole aspect of travelling and meeting new people but I also want to have a degree that I’m fully comfortable with. 

So my other option is to do the medical exams of France in French (which is okay because it is my mother tongue )
This means doing a preparatory class for one year after I graduate high-school in order to pass the medschool exam for France and potentially study medicine for a minimum of nine years. 
This is good because it’s giving me a chance to try for other health professions and maybe test my aptitude for medicine (who knows maybe I’ll actually like it) 
It’s more broad than the focused professional training of physiotherapy for example. 
However this choice is also super uncertain, as everything depends on one’s ranking on the competitive exams and if your ranking isn’t good enough, you do not qualify for medschool (so now you’re back to square one) 
So I now find myself in an awful dilemma: which study choice is better for me? 
I really need some form of advice to help me out, my mind is saturating at this point.. thank you so much",Choosing to study physiotherapy or medicine?
physiotherapy,"Hello all!

Has anyone ( or knows of anyone) that finished their masters in PT in Canada and moved to a different country to practice PT, such as the UK, Australia, NZ, Netherlands, etc? I'm very curious to know if anyone has done that and is able to share how they made it happen? Is it even possible to know about job offerings/postings from abroad? Do you need to move to the country first, THEN job hunt for physio? Can you just apply for a work visa only and work for about a year or 2? 

Any information is greatly appreciated!!!",Work opportunities abroad with Canadian masters
physiotherapy,"Hey guys, I’ve been doing an access course this year in health and sciences and have been offered a place at uni for September in the UK. I’m 28M and just curious to what numbers of “mature students” to expect typically on a physio course. I went to an applicant day in Manchester for just physio offer holders and I met/saw very few people who looked much older than 19. If you’re currently studying physio at a uni how many people on your course aren’t straight from school as such? Cheers",Physiotherapy - Mature student
physiotherapy,"Advice on how to stick it out

Hello everyone. I’m currently coming to the end of my first year of a physiotherapy degree in the UK and I’m pretty certain it’s not for me. If I could, I would transfer to another degree and even have one in mind but unfortunately that’s not possible as I have already used my ‘gift year’ from Student Finance and would have to fund a year myself (which I can’t afford to do). Therefore, in order to have something to show for my time at university my only option is to stick it out with physio. I don’t hate the course, it’s just not for me. Any advice on how to grind out the next two years?",Degree guidance needed
physiotherapy,"Hi everyone! I'm (19F) a med student in London. I'm an international student and just recently found out that 'transferring' degrees (more like working back home) would be near impossible. So with a lot of thinking and talking with my counsellors, doctors, and family, I've decided to do physiotherapy instead. 

I'm really happy with physiotherapy and have done interviews and SOME work experience prior, as I was interested in the field before getting into medicine. I managed to secure a spot in one University, however the reputation isn't that 'high' as my current University. 

I was just wondering if in general reputation matters for this degree, most of my friends told me I was making a bad choice cause reputation is really important. I'm confident in my choice but felt myself waver cause all of these people were telling me different things. 

Thank you for reading and thank you for your wisdom :)",does uni ranking matter?
physiotherapy,"Hello everyone. I’m currently coming to the end of my first year of a physiotherapy degree and I’m pretty certain it’s not for me. If I could, I would transfer to another degree and even have one in mind but unfortunately that’s not possible as I have already used my ‘gift year’ from Student Finance and would have to fund a year myself (which I can’t afford to do). Therefore, in order to have something to show for my time at university my only option is to stick it out with physio. I don’t hate the course, it’s just not for me. Any advice on how to grind out the next two years?",Advice on how to stick it out
physiotherapy,[removed],Elbow pain treatment in Gurgaon | Physiotherapy for Elbow pain
physiotherapy,"Hi everyone, I am an SIT student, just started my uni clinical attachment at an acute hospital in SG. I find it quite difficult to keep up as it is fast paced since its quite a big hospital with many cases. I usually take more time to recall certain knowledge so the pressure is there when I have many patients scheduled for the day. Anyone has any advice to cope with this?",Advice for clinicals
physiotherapy,"Hi everyone, I really need advice, and I'll try to keep this short. 

I'm currently in my 3rd (going into 4th) year of undergrad in Ontario and I plan on applying to PT schools here in Ontario. The problem I'm facing is, that I've only recently decided to pursue PT after volunteering last summer at a pediatric physiotherapy clinic. Since I've discovered what I want to do so late in my undergrad (at least I feel it's late), I'm afraid this will put me at a disadvantage when applying. Thankfully my gpa for required courses and subgpa are quite strong right now, the area I'm lacking in is volunteering in physiotherapy specifically (which I have arrangements to do but they don't start until June and August). My dream school would be UofT as my partner attends medical school there, so any info about the admission process experiences there would be very appreciated. 

I don't know anyone in PT school or anyone else applying, so any advice on my situation + info about your personal experiences and the process are HIGHLY appreciated. Thank you all so much",Advice for a Newcomer in PT
physiotherapy,"I'm a student physiotherapist (Malaysia) graduating soon and I'm looking to work in Australia after I graduate.

My country is not part of the list of countries where I can go for a faster route of assessment to be eligible to work there. So there are actually quite a lot of questions and doubts.

If anyone has when through the standard assessment pathway or knows a good part of it, please reach out to me. I'm mainly concern about the time frame and visa situation.",Need advise on migrating to Australia as a physio.
physiotherapy,,Mystery Muscle Guessing game
physiotherapy,,"What is your best response to patients who have a ""high pain tolerance""?"
physiotherapy,"I was wondering if anyone has any advice or insight. 

I currently have a fallen arch on my left foot. Tore meniscus (mid-tear) a year and a half ago. Left glute activation (firing) requires a lot of effort. When I do hip exercises, left hip is very stiff. I have to currently manually flex my left glute and leg, to get my left foot to not arch. I noticed now and throughout past 3-5 years, my left foot grip is not that strong, and used to shift a little more to the left. I want to return to play soccer and run properly with confidence. 

Context - I had a meniscus mid tear about a year and a half ago. I used to play soccer few times a month. Regular men's pick up leagues. For the past 3-5 years I'd say I'd always have pain when playing soccer, but somehow goes away after playing for like 15 minutes (but I think this was because I had flat feet then, I did not realize I had flat feet then).  Also, planning to join a league in 3 weeks, competitive (once a week games), but not super competitive, as to what I am used to.

Due to the tear, I couldn't lift my left leg much when running, so I rested it and did not do alot of physical activity, worked out though on and off. I started going to drop in soccer with some friends, recreational games. 

I played a few men league games, friend called me up. I felt fine during the games, most probably due to deep stretching for lower body (hips, calves, etc). Also, using my knee brace, where I have straps that lock my knee in.

Also, I try flex my arch as much as possible, and notice I get way more sore now when walking and some pain. I feel l need some sort of custom soles. I also walk in sandals now at home, they provide me so much relief.

I will visit some professionals soon for further advice, it's that I do not have coverage at the moment as I contracting and actively looking for private insurance in Toronto, Canada.

Any advice, or anyone experience anything similar would be appreciated. 

&amp;#x200B;

Thank you!","Leg strengthening - Weak Hip, Fallen Arch, Glute Firing -Soles"
physiotherapy,"I’m going for a career change and physiotherapy is currently highest on the list. Second is programming or something computer related. I’m naturally interested in the human body, how it functions and find myself reading about the nervous system, muscles etc. during my spare time. I am also very interested in psychology, probably since I have suffered and looked for answers myself. I thought about clinical psychology, but that road is too long for me and I also want to use my hands and body more. I played soccer in high school/college, but a knee injury (ACL) put an end to that career path. In my current job (office job) I often miss working with actual people, but also have days where I wish I could just work without talking to anyone. But I think this is more about the environment at my workplace and that I have suffered from depression for some years (have started treatment). I’m naturally more extroverted, but I have some introverted needs that needs to be met as well. From everything I’ve read and heard so far, physiotherapy seems like a solid choice. But I’m curious to know or to hear any negative aspects about the job. So, what do you dislike about being a physiotherapist? Feel free to throw in some positives as well if you feel like it 🙏",Physiotherapist’s of Reddit. What do you dislike about your job?
