subreddit,selftext,title
physiotherapy,"hello!

i am applying to physio pre-reg msc’s in the uk and i am struggling with my personal statement. i (from the usa but am a usa/uk dual citizen) have hundreds of shadow hours in outpatient (private practice) settings and only 20 hours of shadowing in hospital, should i focus more on my inpatient setting experience? i know the healthcare system is different between usa/uk and i want to be careful on how i work it

additionally, i am a group exercise instructor and personal trainer and have been since I was 16, i want to include this because i feel like this would set me apart because of the skills it has given me that could transfer into physio but i am hesitant to mention it because i’ve seen people say to avoid mentioning sports physio and i dont want it to come out wrong, would anyone here have any advice? should i leave it out or briefly mention it? i would really appreciate it! thank you",personal statement question
physiotherapy,"I'm learning about musculokeletal anatomy and kinesiology about the foot and wondered how therapists assess if a fallen arch is as a result of purely structural vs functional or muscle weakness factors. What are the special tests to differentially diagnose one over the other?

I've tried searching on google to no avail. Thanks for your help.",How to assess structural vs functional joint/muscle dysfunction?
physiotherapy,"[Physiotherapy](https://www.beverlyphysiotherapy.com/) is sometimes referred to as ""physical therapy."" It is the treatment of disease, injury, deformity, or disability with the goal of improving the overall quality of life for the patient. Physiotherapists employ a variety of techniques, including exercise, hands-on techniques (such as manual therapy, dry needling, and trigger point therapy), patient education, and a variety of other approaches.",What is called physiotherapy?
physiotherapy,"I'm from Ireland and have been treating a client for a number of years, He recently had a diagnosis of middle ear myoclonus and has questions regards the procedure and recovery. This condition involves spasming of the middle ear muscles causing extreme sounds. 

Basically, surgery was performed by a well regarded surgeon where the Stapedius was lasered in full and the Tensor Tympani cut with a sickle knife and the tendon fibre ends cauterized with a laser to prevent re attachment! 

The goal of this surgery is to not have tendon recovery, which is quite unique, but understandable. 

The question is what will happen to the separate tendon ends over time if they are not allowed heal. Will the collagen bundles break down to nothing and will the ends die off, and if so what time period. I ask this as he can still feel spasming after severance and still experiences a humming/buzzing noise. 

This is not medical advice, but just looking for simple opinions/answers as middle ear tendons are new areas to me and the idea of 'preventing' re attachment is quite interesting. 

Thanks in advance.",Unique Question from Client regarding Tendons and repair/death
physiotherapy,"Hello all. I'm a recent graduate for physiotherapy have not practiced for a while now, I'm feeling a little rusty. I was wondering if anyone could help by throwing some msk case study senarios? Many thanks",Thinking cap
physiotherapy,"Hello,  


I just got my registration from UK. I am planning to look for jobs in the UK soon and I would love to hear your ideas about where to start, what should I look for etc... Any websites to search for jobs and information about the job market would be very helpful.

For other international physios; how long does visa processes take approximately? How hard it is to find jobs in there? What was your Band when you got registered for the first time?  


Thanks for your time.","Just registered in UK, what is next?"
physiotherapy,"Hey there,

So my friends and I are doing an assignment where we have to identify a problem in healthcare and come up with an idea to develop a new or modify an existing business/product/service within the health sector. All we can think of is a chair that turns into a bed to eliminate hoisting.

It has to provide a solution or challenge in healthcare and or add to the wellbeing of the community.

Any ideas from those more experienced? What are problems you face every day?",Entrepeneurship x Physiotherapy x Healthcare
physiotherapy,"

Hello everyone, I'm new here I am currently taking my bachelor's degree in Physiotherapy and I would like it if you could advise me on which field or specialty( E.g. neurology, musculoskeletal, sports, elderly, cardiopulmonary) do you believe is a growing one?

I am currently living in Greece and I would like to work abroad, which country/city do you think is a good place to begin a physiotherapy career, that would enable me to have financial stability and greater career options?

Any advice will be greatly appreciated!",Emerging Physiotherapist
physiotherapy,What are the best ways to relieve DOMS? Without waiting 3-5 days to recover.,Delayed Onset Muscle Soreness
physiotherapy,"I have possible early tenosynovitis as confirmed from the ultrasound report.

Been having chronic foot pain in one foot for past 6 months.

Physiotherapist did not do any therapy on me, just pulled my foot to “ fix a tendon” told me to buy some orthotics and that it will heal itself by summer.

Thats like 3-4 months.

Again no therapy performed, did not really explain why i am having this pain, gave no exercises.

What is orthotics going to do anyways? I walk in my home wearing slippers, dont really go out that much because we are in a lockdown, so not sure why Physiotherapists just tell us to buy orthotics and send us home.

Did i get ripped off?",Feel like I got ripped off by physiotherapist
physiotherapy,"Been having chronic pain in one foot for 6 months+.

Doctor referred to physio after ordering ultra sound report.


The ultra reports findings stated possible early tenosynovitis of the peroneal tendons.

Thickening of deltoid ligament could indicate strain/sprain.

Small amount of fluid surrounding peroneal tendons could indicate tenosynovitis.

Possible strain/sprain of  deltoid ligament.


Basically i have pain every-time i first take a few steps when im walking after rest. 

There is also constant heaviness/ tension/stiffness/pressure feeling in / around the foot and ankle


Anyways the physio examines me and then tells me he will pull my foot to fix the tendon.

He does that and sends me home.

I observe the initial pain is decreasing which is good but my foot still feels heavy/ pressured.

I now had total of 3 appointments in a span of a month and he cant really explain what is going on with my foot. I have already spent $300. 

He wont do any physio on me  which i find odd. No therapy/ exercises “ just give it time till the summer and should be back to 100%” 

How? He wont explain.

In my last appointment he suggested $60 orthotics and sent me home. I dont understand why he wont use Physiotherapy to treat me? I walk in home all day since because of lockdown I can’t  really go out so i dont wear shoes. What good is the orthotics going to do to me?
I feel like he does not know what he is doing or what exactly the problem with my foot is, just suggested some orthotics and called it a day.


I feel like i have been ripped off.",Did my physio rip me off?
physiotherapy,"Common complaints include heel lift during toe-side snowboarding, lack of full range in squats, heel lift in yoga poses like downward dog, legs flare out during walks, and general difficulty running forefoot strike.  There are stretches that prepare ankles for more range but is there any recommendations for longer term improvement?",Are there any lasting ways to improve a patient’s dorsiflexion?
physiotherapy,"I am quite weak. If I strain too much, I will faint. Is physiotherapy not a good choice? Thank you",Are all areas of physiotherapy physically taxing on the body?
physiotherapy,"I'm from Croatia and I have Canadian citizenship.
I've finished 3 year Pt program and have 2 year experiance working in sport (national, regional leagues and national team), private establishments and abroad (Europe). 

I know about Carp and probably will try to submit to licence but it would be great if anybody had any experience or has any knowledge about credentialing European educated Pts.

Thanks guys. 😊",Is European bachelors degree in Physiotherapy worth anything on Canada??
physiotherapy,"I’m in my second year in university and I don’t have any volunteer or extra curricular hours. I have worked part time non stop since high school, if that counts for anything. I plan on getting some hours during the summer but since I only have one summer left to get my hours before I apply year 3, I want to at least have the experience they value the most. I am holding a strong 3.99 GPA but I don’t want to put all my eggs in one basket (my grades) because I have a lot of social anxiety and feel I won’t do well in the interview, so I figure I should at least have volunteer hours. 

Do they value community work, healthcare, or physio clinic experience more? Is community work volunteer experience kind of useless without PT volunteering/shadowing?",Best Kind of Experience for MPT Application in Canada
physiotherapy,I am 22 M from India.I completed my bachelor's in Physiotherapy in my country in 2021.My wish is to go to Canada for pursuing a PG Diploma course relating to Physiotherapy so I can get 2yrs+3yrs Visa of Canada.So I have lot of questions regarding this entire plan.Can someone show me some resources for the same,Career advice
physiotherapy,"Im looking for physios advice relating to the financial aspects of the field
I am a M23yo working as an acoustic engineer in Sydney. I have been working in this role for 1.5 years now (weird story but it started as work experience while i completed my bachelor of science). I quickly realised that the pay was quite generous, I started on 50k per year and received pay rises approximately every 6 months, the last one being September last year where I was raised to 80k (before tax and super). 

I have always desired a career in health and physio seems to fit my strengths and interests as well as having a good work-life balance. I have been accepted into the doctor of physiology masters degree at Macquarie university starting mid this year. However, after researching salaries for physios and comparing it to what I am earning now/possibly earning in the future, it is hard to commit to 3 more years of uni, only to come out the other end to earn less. Also considering what my salary could be like at my work in 3 years time.

Although I definitely dont hate it, I know that acoustic engineering is far from where I would like to spend most of my working years, although my current mindset is quite money motivated. 

I guess my questions are:
1. From a physios perspective, is a career in this field worth swapping from a job with a higher salary and going back to uni?
2. I understand it is possible, but how difficult/likely is it to reach 100k and above in this field?
3. Any advice for a person in my position?

Thanks","Currently earning 80k per year as an engineer and considering starting a masters degree in physio, is it worth changing careers?"
physiotherapy,"Hi, does anyone have a ballpark on HCPC international registration wait times at the moment? I’ve heard 6 months plus. Mailed my paperwork on Friday and hoping to commence work in October.",HCPC international registration wait times
physiotherapy,"For the past 2 months I have had pain in my upper back after sneezing hard. I've been stretching for a while now and some times I put a motorcycle helmet under my back to stretch better, what could have happened? I'm going to see a chiropractor soon",Back pain after sneezing hard
physiotherapy,"Hi all, 

Im now a 2nd year student in aus and attended a short 1 day placement at a hospital and I noticed that you pretty much spend the whole day inside. 

I do feel like that will be a dealbreaker with me especially, if I spend most of the daylight hours inside in a hospital. I am hoping to work in the hospitals when I graduate too. 

My question is, how much time does a physio spend outdoors during working hours? If not much, does it impact your day to day alot? Also do you always wear masks indoors even pre pandemic? That also made my clarity alot worse indoors.",Do you spend much time working outdoors as a physio?
physiotherapy,"Hey guys! I’m currently wanting to transfer into a Bachelor of Physiotherapy at either at these unis from another uni, and have applied through VTAC. I was wondering if anyone knows what my chances of getting in would be with a current WAM of 89.3? I’m a bit scared because I applied late and I’m not sure if my current marks are high enough!

I would also love to hear about your experience with either unis, I.e. contact hours, culture, workload, etc.! I have La Trobe as my first preference due to location (I live in the west) but the Monash culture seems so much nicer! 

Thank you &lt;3","Transferring into B. Physiotherapy at La Trobe and Monash, Australia"
physiotherapy,"Hi everyone,

Bit of background, I have been working as a dietitian for a year now (graduated 2020) with master nutrition and dietetics. Unfortunately, the career is not stable and there seems to be a lack of progression in the private sector. Fortunately, though I have a bachelor's in exercise and sports science so I can do a master's of physio if I wanted to. 

People are telling me that doing exercise physiology would better complement my dietetics work rather than physio. 

Would anyone have advice with regards to going from dietitian to physio? or would it be better to do Exercise physiology and combine that with my dietitian work, so I can provide both exercise and nutrition advice. 

&amp;#x200B;

Any help would be heaps appreciated!","A dietitian wanting to become a physio, any advice? (Australia)"
physiotherapy,"Hey everyone!! This year, I’m 17 and will be going into my first year of Physiotherapy in Melbourne, Australia. I just wanted to ask to those who in the their later years of their respective physiotherapy courses or even graduates and currently practising , preferably in Australia but international is fine. What things did you wish you knew earlier and did differently going into your first year? Moreover, what advice would you have for a new 1st year student like myself to excel in this field.

Many thanks,

Rozmaaate",1st year physio in Australia
physiotherapy,I did a BSc in psychology at monash but i want to switch to physio. I did basic bio units and neuropsych and bipsych units whilst in uni but dont have any experience in anatomy and physiology. Is there a course i can do as a postgraduate to start studying to become a physio? I saw the pre-reg masters but im not sure if its suitable for a psych degree holder. Does anyone know of any courses i could do as im trying not go back into undergrad which will take 3/4 years again.,Physiotherapy australia
physiotherapy,,Physical Therapists in Listowel | Physiotherapy | Listowel Physiotherapy
physiotherapy,Would physio be helpful for RSI of the wrist?,Repetitive strain injury
physiotherapy,,https://tpr-pain-relief-nirvana-for.kckb.st/reyartee
physiotherapy,"Hi guys,

If anyone here has applied for  MSc Physiotherapy (Pre-reg) in the UK in the past or is currently applying. Do you know when they send out decisions regarding applications? I applied back in November and I haven't heard since",UK MSc Physiotherapy (Pre-reg)
physiotherapy,"Hello, I'm looking for masters program in physiotherapy and I'm quite confused as both programs seem good enough for me and I'm eligible for both

UQ - 18 month program - higher fees - competitive gpa 
UNISA - 12 month program- less fees - first come first serve

I'm from India and I wish to work abroad, and as per my knowledge, a 2 year program is said to be better than a 1 year program. Can any alumini from the university help me out?",University of Queensland vs University of South Australia
physiotherapy,"Bit of context here: grade 2 hamstring tear, 5 weeks in, done heaps of loading and we’re reaching the end of plyometric phase. Before we incorporate running/sprinting, is there a way to use the air runner treadmill as a low impact progression into running?",Is there a place for assault air runner during hamstring rehab?
physiotherapy,"(Please note that I'm asking if this **could** happen, every patient is different etc, etc,)

A lot of what I've been taught and read about treating ITB syndrome is somewhat anecdotal or moderate-quality evidence at best.

One thing that never seems to get brought up is the possibility that **weak quads could contribute to a symptomatically tight ITB.** The emphasis is always on glutes and core and quads are ONLY brought up under the presumption that they're tight.

I've never liked this idea of having tunnel-vision towards one particular muscle or demonising another and so it's frustrating when nobody has even tried to assess if quad weakness is involved. Consider this:

* The ITBH helps maintain lateral knee stability. If the quads are weak the knees will buckle slightly during weight-bearing. When the knee buckles, it's more likely to do so by rotating inward due to the centre of gravity being  medial to the knee. This pulls on the ITB and over time would irritate it.

It's just a hypothesis but I can't find any research or even expert opinion acknowledging it.

Does anybody have any experience with this? Critiques? Maybe some good studies to read?

All help is appreciated :)",Could weak (*not* tight) quads contribute to tight ITB issues?
physiotherapy,[removed],Knee+ Offers New Recovery Option with Innovative Approach to At-home Light Therapy
physiotherapy,,How to relieve stress with online therapy sessions?
physiotherapy,"One of my friends works as a dentist and the job requires always being bent and hunched over for 8 hours a day. He goes to a physio but the physio has given some exercises to strengthen the upper back and does some hands on and sends him on his way. Can a well strengthened neck and back with microbreaks really help avoid pain that's usually always there? He has been doing his exercises but still feels pain during and after work. Is this just always going to be there as long as he works as a dentist? All the physio says is to book as needed. 

*Mods if this is viewed as asking for medical advice I am sorry and will delete the post*",Career involving being hunched over. Can exercises and stretches really reduce pain?
physiotherapy,"
Hello, I have recently just completely my undergrad and would like some insight if getting a masters in physical therapy would be worth the investment in canada (approx. 30k). I live in Alberta to give some context.","Canadian physiotherapists, how much do you make?"
physiotherapy,"I am nearing the end of my Physiotherapy Bcs degree and am panicking at the thought of going into work full-time. I love Physiotherapy and I have such a strong passion for it - I aim to complete my rotations before deciding where to specialise in. However, I am struggling with the thought of working straight after I graduate. There are students who are already applying! For some reason I feel guilty but then as I’m 22 I do want to spend some time enjoying my youth. 
I understand it would be very difficult to get a part-time band 5 post as many require full-time. Does anyone have any kind of advice they could give me? What would be best? Working full time straight away? Taking a mini break? Finding a part-time vacancy?",Working straight after qualifying UK
physiotherapy,I’m a Canadian university student currently in the process of applying to UQ and USYD Physiotherapy. My gpa is 3.5 which is not good enough for Canadian schools so I decided to go abroad (also always wanted to live in Australia!) does anyone else have experience applying to these schools? I know UQ is rolling admission but how long does it usually take or took you guys to get your offers? Anyone else out there currently in these programs or also planning on applying?,Physiotherapy in Australia as an international student
physiotherapy,"We are two fourth year international physiotherapy students (Netherlands), graduating in June. Currently we are searching our 6th internship, which we would like to be sports related, starting from March in any European country. Unfortunately we have not found a placement yet, even after 50+ letters.   


We would like any kind of advice. How or where to find a placement like that? Does anyone have any teams to recommend?",In need of advice about sports related internship possibilities in Europe
physiotherapy,,addiction treatment center in Saudi Arabia
physiotherapy,"I have a patient (21y old male) with history of weight lifting. MRI reports suggested a disc herniated- l3l4. The patient has no radiating symptoms in the leg and the pain is just present on the lumbar region.
He has severe iliocoastalis lumborum spasm and tenderness is present. The patient isn't comfortable with dry needling and even MFR with light pressure is quite painful.
Yesterday after light MFR, and providing a hot pack, the muscles started paining acutely and was subsided with ice massage. He feels better in extension positions and wears a lumbosacral belt.
PS - He is not on medications now but did take a few a week back for the pain


Can you provide your physiotherapy advice for the same?",Patient help
physiotherapy,"I am a university student and I don't have any kind of experience apart from my part time jobs I have flown around since high school. I have a 4.0 GPA and I have full confidence (without trying to sound like that person) I can maintain it for my last year of school. My only concern is that I may be competing with people who have my GPA, that didn't have to work through school, and were able to participate in community involvement. I'm hoping I can be prioritized over people with lower GPAs but with more volunteer work considering I had professional employment. 

&amp;#x200B;

Let me know your experiences, any appreciated!",Have Any Physiotherapists Been Admitted to A MPT Program Strictly Based on GPA? No Volunteer / Community Work / PT Experience?
physiotherapy,"Hello all. As mentioned, I’m looking for a fully licensed physiotherapist in Canada who has been internationally educated. I am thinking about doing my masters out of the country and have some questions regarding the credentialing process. Thanks!",Looking for an internationally educated physiotherapist who is licensed in Canada.
physiotherapy,"Hi I went to a physiotherapist on Friday because my back starting hurting after I spent a lot of time shoveling. The therapist diagnosed me with mechanical low back pain and said I had to attend a minimal of 2 times a week for 8 weeks and that after 8 weeks I would likely just need 1 time a week for 2 weeks to make sure everything in my back was normal. 

I was happy with the service but seeing a therapist that frequently would be very expensive as I have no insurance and I’m paying out of pocket. Also, the therapist said the average appointment time would be about 15 mins in addition to an IFC that would decrease my pain (I’m sceptical about that machine), so it seems pretty expensive given the short time slot.

I’ve never been to a physiotherapist before, so is normal and consider the appropriate care? Or should I look else where?",Is it normal to see a physiotherapist twice a week for 8 week due to low back pain?
physiotherapy,"Hi all, I'm currently thinking about a career change and one of the options I'm looking at is to change to physio.

Any advice to someone wanting a career change? What do you like and dislike about being a physio? How's work - life balance?

I'm located in Australia.

Thanks so much!",Any advice for someone wanting a career change?
physiotherapy,WA private practice physio here. We have a company meeting this week to discuss how we are going to deal with the borders opening. I’d love to hear how you are all fairing. What sorts of policies and procedures have you implemented? What’s working and what isn’t? What questions should I ask?,"Australian Physiotherapists, how are you going?"
physiotherapy,"hello everyone,

I have a query about retracting the scapula while doing y raises (trap 3 exercise). I have scapular dyskinesia type 2 (winged scapula) and i'm undergoing physiotherapy for that. One of the exercises prescribed to me is y raises but in sort of a kneeling position, kinda like how this guy does it

[https://www.youtube.com/watch?v=qLLJWmHlYZQ](https://www.youtube.com/watch?v=qLLJWmHlYZQ) ,

while this guy (and almost everyone on internet, be it fitness forums or other physios or youtube channels) suggest you retract your scapula before doing this exercise, my physio is saying let it remain neutral and it'll retract as i raise my hand along with the motion. What is the general opinion of this sub?

note : i come from a country where the quality of physiotherapy available to a layman is not very good (i must add with this particular physio, i am seeing some positive results though) and i have been burnt by a physio before due to him not correcting my form on my corrective exercises and as a result there being no improvement in my condition for 6 months.",Query about form during trap 3 exercise
