subreddit,selftext,title
physiotherapy,,Meine Physiotherapeuten vor ihrer Chefin… und wie sie vor mir ist 😈
physiotherapy,,Once your in a PT graduate program. Is it passs or fail?
physiotherapy,"I am currently studying my bachelors in the Netherlands, but plan to return to the UK to complete my final year (3x 400 hour internships)

I am struggling! 
Many private clinics are not set up to, and maybe just don’t want to. 
I tried looking on the NHS apprenticeship and job vacancy websites, but I could not find 1 internship opportunity. 

Am I looking in the wrong place? Can you give me any pointers? 
Any help would be appreciated",UK physios - how the heck do you get internships??
physiotherapy,"My patient is a 50y old male and I have been treating him since 3 days - MFR, Tens, Isometrics and stretches, cryo pack. Although he has a temporary pain relief with decreased symptoms, he is unable to extend his neck and complains of a point pain on cervical spine while extending. Ehat should I do?
(Couldn't undergo investigations because he is claustrophobic) 

Another patient of mine has shoulder instability and slept on a hard pillow and has radiating pain since 5 days. His pain has decreased although during passive stretches, he complains of pain. I have performed compression/distraction and spurlings test but they're negative. I have started with mild isometrics and even resistive exercises for shoulder RC with theraband but he seems to have pain at end of the set. Any thoughts or suggestions on both?",Cervical Neck Pain
physiotherapy,"I have had both my yoga teacher and PE point out my elbows over rotate. I have never noticed and thought that 
inner elbow ache after exercise was normal. One also suggested my ankles my be similar as I have a history of nasty sprains from simply walking wrong. What can I do?",Over rotating elbows hurt after exercise
physiotherapy,"I went into university (kinesiology) thinking that this would lead me to become a physical therapist. I am currently in my first year and many of the people I have met have told me the same. I realize that this is an extremely competitive occupation, and with my low work ethic, I am unsure if it will be possible for me to become one in the long run. My first semester I got an A- in every class. I felt that this was around the best I could do with the amount of work I would want to put in. If I continued like this, with the occasional volunteering and working, would I have a substantial chance at becoming a physiotherapist?

I have considered switching majors or taking a gap year because kinesiology doesn't seem to be well respected or lead to many jobs outside of physio.

As you can probably tell, I haven't talked to many people about career advice. Physio is something I'm sure I would love doing, but with the way I am right now, I don't know how good my chances are at becoming one. Any advice or stories I would be very grateful to hear.",Should I continue this pathway?
physiotherapy,"I'm a Physiotherapist and planning on buying focused shockwave therapy machine. But I'm confused between shockwave and laser therapy.
Which can serve all my purposes and have diverse benefits.",Shockwave therapy or laser therapy for patients
physiotherapy,"Hi everyone sorry if I'm not posting in a proper form, it's my first time making a reddit account. I needed some opinions or guidance. Who has gotten any offers for 2022 sem 2 intake for the Masters of Physiotherapy course at Swinburne, and those who have what sort of GPA or WAM did you have in your final year? I know the minimum required is 70% I just wanted to know what sort of score is required to get an offer.",Swinburne Masters Course
physiotherapy,"I have a dream, and am at a crossroads in deciding on a career. BEFORE I seriously jump in with both feet feet physiotherapy (which yes, I would be passionate about), I need to say: That dream is to become a successful and financially free entrepreneur and investor, making a positive difference in the world.

That said, I need some reality checks... Give it to me straight, what - from your industry experience and knowledge - makes the below goal either realistic or unrealistic? Thanks all in advance. 🙏 

Imagine the career route:

• Study and get qualified
• Gain experience 
• Start a clinic and transition to self-employment
• Focus on marketing and content creation via YouTube, Podcasts, and a Website, and specialise in a niche (such as Sports Physiotherapy)
• Hire other PT's to reduce business' dependence on your presence / hourly services
• Also outsource content creation administration and ""grime"" work
• Take the CEO role and expand, opening other clinics, hiring more, or even offering mobile services with more employees to increase reach and client base
• Now, I own a growing (one day big) business, and can focus on the bigger picture. The business doesn't NEED me - the managers and employed staff handle the running of the business, and I guide it and make sure the cash flow is positive. Thus, financial freedom has been achieved from the business income and from wise investments (property, crypto, funds, etc.)...

Hard work and learning are no-brainers here. It's a competitive and changing world, but seemingly it's also one demanding more physio's.

So, have you ever seen the entrepreneurial physio route work? Have you attempted it? Any suggestions?

Hopefully someone is willing to help a young soul out. This isn't my only idea, but it's not the worst either haha. 🙂",Physio Entrepreneurs - Is the Dream Realistic?
physiotherapy,"
Hey guys- looking for some advice from anyone UK based.

I'm looking into getting a massage gun and was wondering if anyone had any recommendations?

I heard good stuff about Pulseroll, Recovapro and Myomaster

As well as the obvious US brands like Theragun and Hyperice.

Apparently there are some really good lesser known brands like the three listed above that are just as good if not better than the big names.

Had it reccomeded to help with my glute medial tendenopothy, tight hamstrings and tight ITB.

Would appreciate any tips/advice :) 

Thanks 

George",Massage gun recs UK
physiotherapy," Just curious about Clinical Management Platforms out there used widely across Physical Therapy Practices. Want to know if any of you are using any Platforms developed exclusively for Physical Therapy? If not, what is the most used Platform and why? Thank you.",Clinical Management Platform exclusive for Physical Therapy
physiotherapy,"I'm a second year physiotherapy student from the UK and have a group practical exam coming up in a few weeks where we have to create our own group exercise class for our chosen patient population.  We have chosen Parkinson's disease and my role in the group is to create and lead the cooldown.  I also have to create a one page document justification sheet as to why I have chosen certain exercises and why we need to cooldown etc.  I cannot seem to find much literature on PD specific cool down exercises or just anything really on cooldown for PD, and my lecturer did say that my evidence would have to be more general but now I'm struggling on creating the cooldown for this exercises class.  What sort of exercises/stretches would be appropriate for a cooldown in a group exercise class for patients with PD? (and then I will add progressions and regressions as necessary.)",Student physio practical exam help (UK) - PD group exercise class
physiotherapy,"Hi everyone, a little background on myself, some general life story spiel and perspective on my situation in the first 2 paragraphs; if you're not interested skip to the third paragraph for the meat of my question!

&amp;#x200B;

 I'm 24, finished year 12 however didn't get an ATAR because I didn't complete the required number of units for one, I took the bare minimum amount of classes in year 11/12 and picked stupid subjects like history and retail studies instead of math and science. Unfortunately as an immature kid with no father figure around and no discipline from my mum I slacked hard and took the path of least resistance. I was the kind of student who got reports every year along the lines of ""Bright/Intelligent but talks too much/needs to focus more..."" I live in an immense amount of regret and shame from my incompetence at school and have yearned desperately to rectify that in adulthood.

&amp;#x200B;

I had no idea what I wanted to do for work when I graduated so I just followed the easy money and went into warehouse work not long after graduating and spent the last 6 or so years doing that. About 2 years in I busted my back up quite badly doing manual labour and went to see a private practice physiotherapy clinic about it for a few months. This is when I realised I may of found my calling for life, I loved going there, I loved the vibe of the clinic, I thought that the people there had such an awesome job. I absorbed all the knowledge they imparted on me in my recovery plan and still incorporate a lot of their stretches and exercises in my daily routine. It led me to look into the ""how"" and ""why"" of exercising, stretching and injury management/prevention and develop an interest in science backed practice. I'm a very active and health conscious individual outside of work, practically live in the gym. The staff in that clinic seemed like \*my\* people if that makes sense, obviously a lot better educated then me at that! Unfortunately due to low self esteem and guilt over my terrible academic performance I didn't look into this career change until last year, however the thought of doing physio never left my mind over all this time which I believe is important.

&amp;#x200B;

 I decided to take a risk this year and quit my full time warehouse job to pursue my dream of becoming a physio. These are the steps in my pathway;

 1. TAFE - doing a Certificate IV in Allied Health Assistance with Physiotherapy specialisation. My idea is through doing this certificate, I gain relevant industry experience and ideally ongoing part time or casual employment as a physiotherapy assistant to pay the bills through uni. I also hope that this will make me more attractive to hire as a physiotherapist assistant in the first place then a bachelor of physio student fresh out of school with no work experience as the TAFE certificate comes with 3 weeks of work placement with NSW health which leads to ongoing employment for most students post study.

&amp;#x200B;

2. Uni - I will then do the Western Sydney University integrated diploma to bachelor of health science degree as it's my local Uni and has no ATAR requirement. I aim to get excellent grades to allow me to perform an internal transfer to the bachelor of physiotherapy in my second year. If I do not achieve the required grades to transfer in my bachelor's I will complete my bachelor of health science with clinical sciences as my major which will allow me to do a postgraduate masters of physiotherapy. 

&amp;#x200B;

Is this realistic for someone who did not get an ATAR? I realise that the bachelors of physiotherapy has one of the highest ATAR requirements out of all bachelor degrees in Australia but this is the \*only\* career in life I have ever had any passion and drive to chase. If it's impossible to become a physio without an ATAR I would appreciate being suggested some alternate career avenues that scratch the same itch or the best way to re-do my ATAR and get it high enough to do physiotherapy. I want to go to university and receive a proper education.

Thank you so much for reading my wall of text and for any pertinent information, encouragement and or constructive criticism/feedback you can offer. You guys rock and I'm very appreciative for the life changing work you did on fixing my back and getting me to take my overall health more seriously.","Question for Aussie physios, Is this a realistic pathway for someone with no ATAR to become a physio?"
physiotherapy,"My GPA was not competitive to receive an offer in the offer rounds at University of Sydney. 

What are my chances of getting in based off academic ranking? USYD have told me that the course has not filled up yet.",Australia- USYD masters of physio 2022 application.
physiotherapy,"Hello, does anyone understand what’s likely to change with the NDIS in the near future in relation to physio?",Changes to the NDIS (Australia)
physiotherapy,"Last year I began running, but as I slipped on a icey road while running (without falling) something happened in my patella tendon where it hurt every time I walked downhill. The pain hasn’t been bothering me to the point where I have seemed help, it’s just kind of been there.

But.. Then I was at the gym 1.5 weeks ago approximately, and I wanted to test out the individual strength in each leg as I have imbalances due to bulging disc in my lower back, and my physio recommended that I tried testing out the difference in my muscle strength in leg press.

So, I did that. I have done 150-170kg for reps before (with both legs) and have trained for a long time consistently, so I thought 70kg would be challenging but possible. However, as tested my weak leg (and bad knee side) it was like something snapped and hurt instantly. 

Since then, I have had pain moving around the patella cap. This is in my left leg btw. It started at the bottom right, then the pain was at the left top a couple of days after, and finally today it is at the bottom right and top right. 

I can’t find anything on Google, but I would like to find some rehab exercises to try out while waiting for physio referral, but I would like to have a direction as to what might be wrong before doing some exercises that might cause more harm than good.

Can anybody help?",Does anybody have any idea what my knee pain might indicate?
physiotherapy,".. Is sooo hard! I'm exhausted.. I'm a new physiotherapist and loving my field of work - helping people get their life back with less pain.

But.. I have a patient every half hour/hour depending on the case. No time in between. A self-paid 30 min break during the day, where in my country - Denmark - it's the norm to have a paid break. The schedule is not the best, and different everyday which is hard for me.. I can live with it (e.g only 12 hours between a shift 1 day/week). I use 1,5 hours driving every day in tight traffic (45 min each way). Other small details I'm not pleased with - expecting to be there 20 min before opening hour two days/week to turn on light and stuff, without pay. I don't dare to complain yet before the ""trial period"" ends. And the other employees doesn't see it as an issue.
The pay is not great at all. But that's how it is as a physio here, even though the study is hard.
The colleagues seems nice enough 😅


Also: Im late to the work-party. I'm 28. I have anxiety and depression (like all the other millennials). Had EDs for 12+ years. I can't work full time due to mental health - I work 34 hours/week. Would prefer 25-30 hours/week but economically it won't work out. But it's not bad enough to get any help from government.


Does it get better with time? Do you get used to the work? I'm having a small break down today. I'm just so overwhelmed.


(I know the we generally have it good here in Denmark/Scandinavia, so some people will read my post and be like: Wtf. What are you complaining about?)",Getting your first job..
physiotherapy,"I’m stressing out a bit because I really wanted to do a Bachelor of Physiotherapy but was rejected in the February round 1 offer at La Trobe and Monash, and I’m not sure if it’s because they’ve already met quota or if it’s due to my marks (I’m averaging 89 WAM in my current course at a Vic Uni). I will apply for the February round 2 and 3, and hope for the best. 

I received an offer to study Health Sciences at La Trobe but I’m not sure what the best course of action to take from here - whether to study this and transfer in second year, or complete the degree with a HD average and do the masters. I want to keep my HECS as low as possible, as I am a mature aged student and have studied in the past. I also really need to stay in Melbourne because I’m taking care of family.

Any advice would be much appreciated..","Advice on what to do (Melbourne, Australia)"
physiotherapy,"Hey, I already posted this in r/advice, but I thought, maybe I will find some experts here.","Vocational training: I can't decide, shall I become a physiotherapist, or an occupational therapist? (Germany)"
physiotherapy,"Hello, I am guessing people here know a thing or two about ultrasound, I just have one doubt in my mind - I am currently seeing a physiotherapist cos I got my knee injury and she uses ultrasound therapy, which is totally fine. But sometimes she holds the device at one place and it starts hurting a bit and then she moves it. So, I was curious about - is it hurting because of my injury or would it hurt every body part, regardless of it being injured or not? So, let's say, my elbow is healthy, if she uses that device on my elbow and holds it there for as long as she holds at my injured area, would the elbow start hunting just like my knee does?",Curiosity regarding Ultrasound therapy.
physiotherapy,"Hello!

I am a physiotherapy student from Norway in the process of writing my bachelor thesis.   
I have chosen to compare high frequency/volume with low frequency/volume in patients with subacromial pain (shoulder impingement). As of now I have only found 1 study that explicitly tries to research this:  

* Østerås, H., Torstensen, T. A., Haugerud, L., &amp; Østerås, B. S. (2009). *Dose–response effects of graded therapeutic exercises in patients with long-standing subacromial pain. Advances in Physiotherapy*

I have found other studies which has a high volume and high frequency, such as:

* Holmgren, T., Bjornsson Hallgren, H., Oberg, B., Adolfsson, L., &amp; Johansson, K. (2012). *Effect of specific exercise strategy on need for surgery in patients with subacromial impingement syndrome* 

While this trial has high load and high frequency (with good results), the focus on this study is comparing specific movements with unspecific movements. As both protocol has a high frequency. 

Both of these studies are included in a systemic review from 2020 by C. Littlewood and friends:

*  Malliaras, P., Johnston, R., Street, G., Littlewood, C., Bennell, K., Haines, T., &amp; Buchbinder, R. (2020). *The efficacy of higher versus lower dose exercise in rotator cuff tendinopathy: A systematic review of randomised controlled trials* 

And while it concludes with a mix of uncertainty and positivity, it states that more research is needed. 

However I am having difficulties find more literature on the subject. I was wondering if anyone knew of any studies that examines this problem? Also, if anyone got a lot of clinical experience trying different approaches I would also be interested in hearing your personal experiences.

From my personal experience as personal trainer for many years. I theories that low-intensity with high frequency is more optimal for desensitization of the pain receptors, but that it also requires more compliance.",Is exercises therapy with higher dosage/frequency better to relieve subacromial pain than low-dosage/frequency?
physiotherapy,"If someone has really strong glutes and hamstrings but weak hip flexors and adductors can this muscle imbalance lead to hip problems,especially snapping hip syndrome?

what are some exercises for the hip area to keep them healthy(except for glute bridges)?",Can muscle imbalances in the hip area cause snapping hip syndrome?
physiotherapy,"hi all

Physiotherapy student from South Africa here. I'm just wondering what is the difference between arterial blood pressure and normal blood pressure. 

Thanks in advance !",Arterial BP Vs Normal BP. What's the difference
physiotherapy,"I want to study about X ray and MRI 
Which book should I purchase for best understanding form basic to advance",Radiology book
physiotherapy,"[https://youtu.be/497xselI\_g8](https://youtu.be/497xselI_g8)

I graduated last year and learned as much as I could about finances. Here is the start of my financial freedom journey! Would appreciate the like and sub to get my content out to more people. Thanks!",Canadian Physiotherapy Salary $$$ - How Much I Made My 1st Year
physiotherapy,"Hi, hope everyone is well and safe!

I am a Canadian university student graduating with my undergraduate degree this April. I have been looking for international physiotherapy MSC options as my grades are not competitive enough for Canadian universities (around 80% average). 

I was hoping to receive some advice from anyone who has taken their MSC in Hong Kong, more specifically Hong Kong Polytechnic University. I realize that it is highly unlikely to find individuals on r/physiotherapy with experience in HK but anything information would be highly appreciated.

Here are some of the things I am curious about studying physiotherapy MSC in Hong Kong

1. Language (Speaking Mandarin, Cantonese, and English)
2. Clinical Education Hours
3. Hong Kong physiotherapy MSC curriculum vs schools in other countries
4. Grade average for admission
5. Working and licensing as a physiotherapist in outside countries after graduation for HK (Canada and Australia)

Thank you for the help!",Physiotherapy MSC in Hong Kong (Hong Kong Polytechnic University)
physiotherapy,"studying physiotherapy for using it with different approach.

im 28, from very young age im lifting weights, using only barbell and plates. and believe this kind of work can impact patients in a good way.

my questions is, doing the degree will teach me the physiotherapy treatment, there is people that did the degree and then uses theyre own approach to treatment, or combined the treatments, and didnt follow the known guidelines treatments they been acquired in physiotherapy school? 

im sure the knowledge i will acquired there will benefit me(anatomy,biology), i just dont have experience with the treatments methods applied there-on myself.",Physiotherapy with different approach
physiotherapy,"In university as well as in clinical practice (in Australia at least), we were taught that gait aids play an important role in preventing falls. During my clinics, it is standard protocol that we always place the patient's gait aid within reach. However, there is substantial evidence suggesting that older people who use gait aids actually has a higher falls risk than those who don't. 

So if we prescribe a gait aid to someone who we deem is high falls risk, wouldn't we inadvertently put them at an even higher risk? I understand the reasoning behind it (increase BOS, stability etc.), but the evidence doesn't seem to support it at all, so why give it in the first place? There's even evidence to support the hypothesis that using a gait aid impedes compensatory movements and increases task complexity (particularly relevant to those who are cognitively impaired). 

[https://pubmed.ncbi.nlm.nih.gov/15196524/#:\~:text=Results%20supported%20the%20hypothesis%20that,11%25%20of%20stepping%20reactions](https://pubmed.ncbi.nlm.nih.gov/15196524/#:~:text=Results%20supported%20the%20hypothesis%20that,11%25%20of%20stepping%20reactions)).

[https://www.ncbi.nlm.nih.gov/pmc/articles/PMC6464113/](https://www.ncbi.nlm.nih.gov/pmc/articles/PMC6464113/)

[https://eprints.whiterose.ac.uk/145061/1/Hunter\_JAD2019\_novice%20canes%20in%20AD\_accepted.pdf](https://eprints.whiterose.ac.uk/145061/1/Hunter_JAD2019_novice%20canes%20in%20AD_accepted.pdf)

That's not to say gait aids are useless though, I think they definitely have their place (e.g. offloading weight, endurance purposes), but to prescribe someone a gait aid on the basis of preventing falls seems to go against the evidence. I'm only a student though, so my reasoning could be wrong. Very keen to hear everyone's thoughts on this!",Prescribing gait aids to prevent falls in older patients
physiotherapy,"I am in Australia and chasing a new carrer change for myself. I am an electrical engineer and have been in the industry for quite a long time. I now feel quite distressed about my job and want to do something related to health field, which I have been thinking of working in. I already got offers from some universities in Australia, but being an age 42 makes me hesitate a bit to persue my new uni study. 
Please share your experiences for me and your thoughts are greatly appreciated.

Thank you.",Studying physiotherapy as a mature age student.
physiotherapy,"I (F31, Canada) had a physio appointment today, all was good, he applied some KT tape to my neck / shoulders (I have rotator cuff tendonitis in both shoulders, I was told years ago). About two hours later, as I was shopping with a friend, not doing anything too strenuous, I was hit with intense, unbearable pain that almost made me want to be sick or cry out. It was out of nowhere, and only on the left side (though my shoulder pain is equal typically, and it's always a dull ache/weakness rather than actual pain). 

&amp;#x200B;

As soon as I took the tape off, the pain immediately went away. I looked up everywhere online but can't really find anything to explain this. Could anyone shed insight on what could have caused this?",Extreme pain after KT tape application to neck/shoulders?
