subreddit,selftext,title
physiotherapy,"Hi everyone! 
I‘m looking into buying new shoes for work, and I would love to work in Barefootshoes because I love the flexibility and freedom for my toes. Outside of work I wear Vivobarefoot shoes, but I have found that these don‘t work for me at work. My feet would hurt a lot at the end of the day (a very hard floor).
Does anyone have different suggestions for barefootshoes or tips? 
Kind regards!",Barefoot shoes as a physio in rehab intensive care unit (Germany)
physiotherapy,"Probably 18 years ago I was in a scuffle and me and the other fella went to the ground hard.  I went down right on my elbow.  It was swollen and hurt but like any dumb 19 year old, I ignored it.  My elbow point feels jagged and there are a few balls and what feels like a tendon maybe.  

It took a year or two but at some point I touched it down mundanely on the right spot and:. PAIN 

For years a certain pressure made it hurt and it'll stay hurting for a day or less usually.  Last week I was leaning on it in bed and I guess that tendon rolled over the jagged stuff and it is killing me like I've put it down on something full time.  I also reached up to tie my hair and it clicked over that jagged part and it hurts like an open wound.  

Is this a common and treatable problem?  Would physio be applicable or would a good guess be: more in the realm of surgery?  Can someone describe to me what might be happening in this chicken wing?

I'll go to the dr eventually, I'm just 5000kms from home for work for a couple months.  

Thanks in advance✌️",Left my elbow in Winnipeg.
physiotherapy,Do any of you have experience with clients who get muscle pain (not soreness) after minimal exertion? Any suggestions if warming up and NSAIDs don't help? I'm defining soreness as something that only hurts if you move a particular way and pain in this case as something that doesn't respond to the max OTC dose.,Clients prone to painful muscles?
physiotherapy,"I'm from India and really looking forward to do masters in sports physiotherapy. I'm pretty confused regarding what should i look for in a university as everything seems pretty convincing. 
I was looking for Australian universities- University of South Australia or Curtin but I'm confused in what should I select.

I'm even confused about the country I'm selecting. Please help.",Help! Australian Physios
physiotherapy,"I have a patient who is 10 weeks post fifth metatarsal fracture. They started PT about 3 weeks ago, originally in a CAM Walking Boot and then able two weeks in sneakers from going non - weight bearing. Since starting PT, their inner ankle has been causing such pain and discomfort.

 Could it be possible there is a torn ligament or further damage from transitioning from Boot to sneakers so quickly by her podiatrist?",Would you suggest an MRI or X-ray for this patient?
physiotherapy,,Home - Listowel Physiotherapy
physiotherapy,"Hey! I thought I’d ask here because I know runners sometimes have foot problems.

Last week i stupidly did a hiit class at home in just my socks on a mat. This particular 10 minute class had a lot of jogging etc 

Since then I’ve had pain in my heels when walking. It’s OK with cushioned trainers but work shoes were impossible to walk in without limping. Some general pain in knee sometimes and on my heel and ankles.

Lesson learned but will this heal itself in a couple of weeks? It’s doing my head in not being able to exercise much or be 100% comfortable moving.",Injured my feet exercising 10 minutes in just socks on a mat
physiotherapy,I’m a Canadian student. Planning on writing in July. Thanks!,Is a pce prep course worth it?
physiotherapy,[https://www.alliancept.org/announcement/capr-discontinues-clinical-component/](https://www.alliancept.org/announcement/capr-discontinues-clinical-component/),Canadian Alliance of Physiotherapy Regulators (CAPR) abandoning the Practical component of the licensing exam (PCE)
physiotherapy,"If you earned a physical therapy certification in the US and wanted to move to the UK, would you need to redo schooling or just take their equivalent of a board exam to be able to legally work there ?",US to the UK
physiotherapy,"I’m thinking of switching from Industry Accountancy (Chartered/Qualified management accounts) to Physiotherapy. 

Has anyone got any experience in this? And can anyone advise on how difficult it is to become a physio? I’m not afraid to put in the hard work as I’ve done 8+ years study while working full time to become an accountant.",Career Change (UK)
physiotherapy,"Hey,

Sorry if this has been posted before. I'm new to this subreddit. I have an appointment with a physio to discuss my suspected winged scapula which I think is due to my poor posture and lack of muscle.

I also have uneven chest muscles which I want to raise. My left pec is considerably larger since I started to work out a few months.

How do I best prepare for this appointment? What questions do I need to ask and what should I expect?

Would it also be helpful of I share my workout plan with them?

Many thanks in advance.",First time visiting a Physio
physiotherapy,"What are some good websites, apps for android or books (ebooks or physical) that have good anatomy information with latin and english names? I'm a physiotherapy student and I love hoarding information that I can go through when I got free time.

Thank you!","Resources for anatomy (muscles, bones, nerves) in Latin and in English?"
physiotherapy,I’m in the UK and thinking about doing a pre-Reg physiotherapy MSc.  Are there significant differences in the quality of courses between universities? Do employers care which university you graduated from?,Pre-Reg MSc
physiotherapy,"Hi, I'm applying to master's programs in physiotherapy in Canada and I scored poorly on the Casper (a social skills/judgment test) with no chance to retake it. The test is weighed at 30-40% of your application. I had a 3.6 GPA (~3.8 sub-GPA) in undergrad and good references. Do I have any chance at getting in to a program? I will not hear back until April/May and I have other career paths available to me that are waiting for an answer.",Scored in the bottom quartile on the Casper (Canada)
physiotherapy,,Hi! I’m asking on behalf of a friend. Has anyone here done a Physiotherapy program in a different country and then pursued it in Canada as well? What was the process like?
physiotherapy,"Hi everybody, 
Just want to ask on wearing high cut or high top shoes such as “converse high top or even high cut basketball shoes”. 

It is true that any so-called “support,” by taking over the natural role of muscle and connective tissue, will weaken your foot and ankle and this can, over time, lead to injuries. 

Arch support will weaken the foot muscles and prevent them from naturally absorbing shocks while walking or running. A tight and overbuilt high-top will do the same to your ankle. 

Over time, your ankle will become weaker and be subject to ankle sprains, which can be hard to heal.

Anybody got any opinion on that?",Wearing high cut shoes can cause reduced ankle mobility and strength
physiotherapy,"Hi, 
Just want to check with you guys what other methods are you guys performing to assess dynamic sitting balance and dynamic standing balance for patients. Below are some of the things I do.

Dynamic sitting balance
1. Marching on the spot in sitting without UL supporting 
2. Reaching in multiple directions while sitting: Forward , sideways and picking up objects from the floor.

Dynamic standing balance 
1. Marching on the spot in without UL support 
2. Reaching in multiple directions in standing : Forward , sideways and picking up objects from the floor.",Assessing dynamic sitting balance and dynamic standing balance
physiotherapy,"Hello. Has anyone tried to get his Physiotherapy licence from a European country acknowledged in the US?

I will be able to access a green card but I need to get my qualification accepted to work there.

Best wishes",Physiotherapy Bachelor acknowledgment in USA.
physiotherapy,Would physiotherapy be appropriate for wrist pain? My son is 16 and has been complaining about pain in his wrists…I think it’s all the gaming and sitting at the computer that’s caused this.,Physio for wrist pain?
physiotherapy,"Hi! I am an international student and I am considering to apply for the MPT programs in Melbourne as the tuition fee for both universities are much cheaper compare to that in Sydney.

Which University do you think is better? (In terms of reputation/ teaching quality/ students satisfaction/ placement opportunities)

I would love to hear from current or former students in the program, as well as physios currently practicing in Australia who took a similar route.

But any suggestions would be very much appreciated!",Master of Physiotherapy in Swinburne and La trobe ?
physiotherapy,"Hi, asking for a friend. 

She has bachelor's in Physiotherapy(in India) and got distinctions in most of the main subjects. Now she is planning to go for master's. She has no idea how to move forward. Any advice would be appreciated. 

Like which country would be best, from our research we found out that UK and Canada are good options, Australia and NZ are sort of expensive. Also, what's the admission criteria in broad terms. Is there an exam or something like that? and how do we get scholarships?

I am from completely other background so I have no clue about this.

Thanks",Masters in Physiotherapy
physiotherapy,,What’s you favourite and least favourite area of physiotherapy you have worked in and why?
physiotherapy,"Eg: Cupping therapy, accupressure, accupuncture etc. Dry needling.",Should I practice alternative therapies along with physiotherapy or not?
