subreddit,selftext,title
Chiropractic,"Advice for NBCE part 4? I heard they took out the radiology portion, so it's only the osce now. Any courses, reviews, or resources you guys recommend to pass? What should I mainly focus on reviewing and practicing? 

For the diagnosis portion, do they mostly test MSK conditions, or are all diseases are fair game, and we could have a scenario where the patient's diagnosis is appendicitis? lol 

Any advice will be extremely helpful, thank you so much!",Advice for NBCE Part 4
Chiropractic,"Does adjustments help your gentials? I have had lower back pain for the longest time and just not well being feeling good. I would have pain in my legs and sometimes a pain in my testicle on one side. Randomly once in a while I can orgasm, but most of the time after ejaculation, I feel nothing. 

After each of my first couple adjustment I have had the best orgasms and thicker semen weirdly enough. Whenever I have pain again it goes back to what I didn’t feel but not as bad anymore. I’m just curious because it feels good to feel good","Weird question after going to the chiropractor for the first times, but"
Chiropractic,,Sleeping like a bat but right side up = the ultimate spinal decompression?
Chiropractic,"I'm a stomach sleeper, which I'm trying to change to become a side sleeper. Can a chiro recommend the best pillow for my neck?",Pillow recommendation
Chiropractic,Hope this is ok to post. I’m hoping someone might have a solid recommendation for a pillow for neck pain. I have neck pain and stiffness when waking up (also causes pulsatile tinnitus). I am mostly a side sleeper and sometimes sleep on my back. What is the best style of pillow for neck issues?,Looking for a recommendation on the best pillow for neck pain and stiffness
Chiropractic,"Hi everyone! 

I'm applying to the DC program at NUHS and I’m having my phone interview soon. I was wondering if anyone has any insights or advice for the interview process and preparation for admissions. 

Hope you all are staying safe and healthy during these times.",Phone Interview at NUHS
Chiropractic,"Whenever a thread comes up about stroke, the repeated line is how rare stroke is and how there isn't a shown causal relationship between chiropractic and stroke. However, I know a lot of chiropractors who specifically mention stroke on their informed consent form (albeit with a line about how rare the occurrence is).

If stroke is this rare and not related, is it important to directly call it out? Do you also list out ever possible side effect like a list of bullet points, even the extremely rare ones that may not have a proven causal relationship with chiropractic? Will chiropractors mention stroke solely because of cultural reasons, and if so does that perpetuate the issue, or is there a good reason to mention stroke?

Curious to hear some thoughts!",Do you explicitly mention stroke in your Informed Consent?
Chiropractic,"I do manual labor for a living and recently injured my lower back. The next few days I could barely hold myself up-right and needed my SO to help me shuttle around our apartment.

I’ve always had bad posture growing up and am 30 in May and looking to fix it.  Would the best course of action to be contact a chiropractor or a physical therapist?",Chiropractor or PT?
Chiropractic,"If a chiropractic student comes to your office once, or wants to come once a week, do you charge them the same as others or how do you usually approach it?",Do you charge students for adjustments?
Chiropractic,Who do you all use for your website and SEO optimization? We are currently with ChiroMatrix and have significantly slipped in search ratings in our town. Would love to hear who we should potentially switch to?,Website/SEO Company?
