subreddit,selftext,title
Chiropractic,"I need help from anyone who is potentially knowledgeable on this topic. 4-5 years ago, I went to a chiropractor and paid for a certain number of visits. (Tapered over time but used all but 1). I went again today to a new location with glowing reviews, and they mentioned our next visit with be going over my X-rays, etc and we will talk about treatment and financing. I really don’t want to finance anything… and I have insurance. Is this a normal this for chiropractic? This is the 2nd time out of 5-6 chiropractors in my life that mention financing and I don’t want to be in more debt. Please help!￼ I know with chiropractic it isn’t a 1 visit fix, so I assume maybe that’s why? I can’t tell if it’s predatory or not or it is just reality of getting the help I need with my back.",Question about payments
Chiropractic,"I have Blue Cross PPO and am allotted 12 chiropractor sessions in 2022.  Due to some weird pain issues, I ended up flying through 8 of them in Jan 2022. Now, I am likely to need more than 4 sessions to heal my condition.  



My chiropractor and I both know we can file a request/appeal to extend the Chiropractor allottment. However, the Chiropractor has never been successful.  Believe the Chiropractor is an immigrant so may be new to this world of insurance.


Does someone have a list of info to include?


Thanks!",How do I/my chiropractor explain to my Insurance Provider to extend Chiro coverage?
Chiropractic,"Hey! My Chiro is sketchy about giving me an itemized bill. When I asked for one they said they'd give it to my insurance company. When given a receipt, it is a normal ""you paid 120.38 on x/x/xx"". I have yet to see an itemized bill in the flesh, on my end, and it feels weird to me.   


I've asked around and not one person has said that I shouldn't be able to get one directly from the Chiro office. Is this normal? Is this a red flag of billing discrepancies?",Chiropractor and Billing
Chiropractic,,Is there some evidence that chiropractic procedures can help with tachycardias?
Chiropractic,"Understood i can't get medical advice here, but hearing your similar experiences might help. 

I've always heard skepticism about chiropractor but since my husband got a big recommendation and treatment was progressing well, i thought I'd try myself.

I have a dowagers hump with minor pain only once in a while but increasing during terrible pandemic work desk situation. I just completed a week of treatment and the last 3 days have been unbearable. The doctor's theory is that i changed my pillow set up (according to his advice when i had asked him how you're supposed to use a pillow). I basically like a lot of pillows for neck support but went cold turkey on very little pillow but roll it up to fit in the neck nook.

I take 600 mg ibuprofen and can't function. I'm improving but not quickly enough. I'm regretting starting the treatment but feel stuck to keep trying. 

Has anyone else been in similar situations? What was your story?","My 1st week treatment, now feeling unlivable"
Chiropractic,,Chiropractic Center &amp; Recover Spine Movement Denton
Chiropractic,,Chiropractic Spinal Adjustment Increases the Cortical Drive to the Lower Limb Muscle in Chronic Stroke Patients
Chiropractic,"I went to a new chiropractor who i had never been to before. In the medical history form there were a bunch of options of things to check, i checked all of the ones that applied including something to the affect of pelvic pain/pain with sex. It was one of a bunch of boxes, in a separate area i specified that i was there for treatment for neck pain. The chiropractor and medical assistant came in and looked over the paperwork, he asked me about pelvic pain and i told him i have endometriosis and was working with another practitioner to remedy that. He told me chiropractic can help. I explicitly told him that i wasn’t interested in that at this point, that i was only looking to get a kink in my neck out. After that the assistant left, he laid on the table, and he started adjusting my neck and back. Without asking any questions or asking for my permission, out of nowhere he unzipped my pants, and put his hands in my underwear and started feeling around. While he was doing this, he started asking me specific questions about what it feels like when i have sex. I also feel like he got necessarily close at this point as he was asking the questions. Completely frozen i just answered quickly and waited for it to be over, left as quickly as i could and felt so sick and violated. Is there a legitimate reason for any of that? And even so, is there any sort of ethics as far as someone else being in the room, asking permission, asking for consent before hand, etc?",Is this illegal? Against a chiropractor code of ethics? Looking for opinions from chiropractors.
Chiropractic,,"Hi, anyone know why when I workout or do anything that costs me some heavy breathing I get a sharp pain under my right rib? It’s been happening for about a decade. It feels like my rib it poking at my lung but idk. Most times it’s not bad but sometimes I can’t even continue"
Chiropractic,i work in a restaurant. i carry a lot of weight on my shoulders and it wears my back out. i have hurt for over a year. since last january. this post i won’t detail everything... i’m here to ask question???? so chiro told me my left leg is shorter.. never had an issue with this . never noticed. is it possible he is wrong and i can be adjusted to put my leg back in correct position?,"seen chiropractors, orthopedic, rheumatologist. nothing, i’m 23"
Chiropractic,"Any Canadians going to or finished Chiro school in the US.  Currently 30 years old and taking some pre requisites to apply to Logan or Palmer.  My dream has always been to open my own chiropractic clinic.   I have applied to CMCC and as many people know it’s super competitive.  My focus has shifted to the US as a result.

I know the tuition for the US is way more expensive.  The debt to income ratio does scare me.  Would you redo it? Is the return on investment worth it? I heard mixed reviews. 

I work in a promising job as a IBEW union electrician apprentice with what’s going to be great pay and benefits but my heart is not in it.  I keep second guessing whether I should stay or leave and keep pursuing my dream.   The uncertainty does scare me.  

Those of you from Canada who have went to the US for school and came back to practice, any input would be appreciated.",Any Canadians go to school in the US? Primarily Logan or Palmer. Would you do it all again?
Chiropractic,,Chiropractic Care &amp; Recover Spine Movement Denton
Chiropractic,"i want to preface this by saying i am in my early 20s and have had lower back and hip pain for the past 2-3 years. Over the past month, the pain has become so excruciating that i finally decided to pull the trigger on getting help. They took x rays at the first visit and had me come back to go over what the x rays depicted. They explained that i would need 90 days of treatment (2 apts per week) and insurance would only cover $200-300. They basically gave me the option of either paying in full over $1000 or doing monthly payments of $400. They said they don’t do visit by visit payments. I feel really discouraged because i have been in so much pain and i just can’t go through with this for financial reasons. They also made some pretty condescending remarks which just put me off from them as a whole. My parents want me to go to the MD to get a diagnosis. I would appreciate anyone’s advice if you have personally experienced something like this or if you have any recommendations on where i should go from here.","had my first appointment, not sure what to think… seems like the office was just trying to get money from me"
Chiropractic,"So within the last 5-6 visits seeing my chiropractor, I've been noticing he reaches under my shirt and brings his hand wayyy up my back while doing certain adjustments, and it makes me really uncomfortable. He's never done this before while doing these specific adjustments, so I don't know why he would suddenly start now and why he'd do it without warning me first.

The first time it happened, I was kinda shocked and didn't say anything. When it happened again at my next visit, I said ""Can you do that OVER my shirt?"" and he did, and then he started making small talk as if nothing had just happened. 

In the following two visits nothing weird happened, and I thought that it was over with, but today I went back in and he did it AGAIN, except he only did it on one side, then didn't on the other side (he was doing a lumbar spine manipulation and I was lying on one side, then I would flip over and he would do the other side). He again did it without warning, and he acted like nothing had happened. 

So I find myself psychoanalyzing the situation and combing through the finer details to figure out if these are innocuous mistakes, or intentional, and I'm just really tired of it all.  I've been seeing this chiropractor for 4 years now, and he's given me the best treatment I've ever had, he's one of the best chiropractors in my area, so I'm really trying hard not to just leave. But I'm sick of this and idk why he's just started doing it out of nowhere. To me it reads like he's pushing my boundaries to see what he can get away with, and feels comfortable he can do it now only after I've been under his care for so long. 

There's also a physical therapist in the same office who I see regularly, so I'm considering just cancelling my appointments with him in the future and only seeing her.  But I don't know what I should do. I don't know if I'm overreacting, or if he's going to try to push my boundaries even further as time goes on. The more I think about it the more I want to just quit and find a new physician. 

Is this normal?  Any help at all would be greatly appreciated! I think I'm also going to post this to another ask sub. Thanks in advance.",Is my chiropractor grooming or groping me? Or is this normal treatment?
Chiropractic,"My doctor has come to the conclusion that I have an infection in my si joint which has prevented it from “sticking together”. I have painful lymph nodes all over my body and my buttocks, thighs, knees feel dull achey and sharp stinging pains. I had surgery for a ruptured ovarian cyst back in august. I had 150ml of blood suctioned out. Right after that surgery I had chills, fever and felt sick and intense pains in my abdomen. My ob was confused and said he didn’t know why that was happening. Ever since then I’ve had si joint issues. Last month I started having intestinal issues as well. 
How do we diagnose a chronic infection? My white blood count was high but not very high. How can this be treated?
I’m just very concerned and anxious.",How are chronic si joint infections treated?
Chiropractic,"At the outset, I want to clarify that I read the rules and am not soliciting diagnostic feedback for my condition(s), but I do not have unlimited funds and would like some advice on whether chiropractic therapy would potentially be beneficial to me or a waste of time and money.  


In the interest of brevity, here are my symptoms, from least to most debilitating:

&amp;#x200B;

1. Occasional pain behind my left eye, occurring 1-2 times a day and lasting maybe 2-3 seconds.
2. A pervasive feeling of tingling/tightness in the back of my head.
3. Tension headaches that jump around randomly, sometimes like a vice at my temples, sometimes like a band around my head, sometimes mimicking the symptoms of sinusitis.
4. A constant feeling of mild drunkenness/lightheadedness. This is somewhat difficult to explain, but it is the feeling you get when you just start drinking and the buzz kicks in. Everything just feels ""off"", if that makes sense. The worse this symptom gets, the more difficult it becomes to concentrate on high-level mental tasks.

This has been going on since May of 2021, though it did not occur to me until the past month or so that it might be a cervical issue (caused by bad posture, I am guessing), perhaps in the suboccipital muscles. Symptoms are practically nonexistent right after waking up, but start to kick in after about 20 minutes and generally become less severe in the late evening. Neck movement such as craning seems to exacerbate symptoms.

Does this sound like a suite of symptoms that a chiropractor could help me with? If so, what type of chiropractor?

Thank you for your time.",Looking for advice on whether to seek chiropractic care
Chiropractic,"The right side of my neck has been in constant pain since I woke up today. I went to bed feeling perfectly fine and now I can barley turn to look right. Is there anything that could help? Also, what would be the best sleeping position for neck pain in the right neck area?",How can I stop my neck pain?
Chiropractic,I just had an analysis done by a chiro and I just would like some other opinions from people who can read these.  In the end the chiro recommended that I do 24 sessions over the next 17 weeks.  I appreciate any input from other professionals.,Opinions on posture report
Chiropractic,,Chiropractic Center &amp; Recover Spine Movement Denton
Chiropractic,,Chiropractic Care &amp; Healing Back Pain Denton
Chiropractic,"So my chiropractor wants me to go every two weeks, and it’s hard to afford, but when I don’t go I notice a drastic difference in how I feel, back and neck are tense and there’s like a burning sensation on the right side of my neck currently. I went today no help. Usually takes a few sessions. 

I feel pretty unwell, I assume it’s mostly coming from neck tension let me know thoughts.",Can neck tension/ needing an adjustment make you feel almost sick?
Chiropractic,Get an mri? I’m def not going back to the same chiro.. what are my options? Thanks.,"Chiropractor fixed my back pain on first first, but now my neck feels strange, soreness around base and left spot in neck. Also slight tingling sensation left side of neck to head kinda comes and goes. Taking aspirin as a preventative for potential stroke from tear. What should I do now?"
Chiropractic,"I’ve had tailbone pain since march 2020 I’m 90% sure the reason was due to me doing sit ups on a really hard floor, I’ve been to PT, chiropractor, I’ve even had a pain psychologist and nothing helps, my mri and X-rays show nothing but when I directly touch my tailbone it hurts a lot and I can’t sit down on hard surfaces, if I squeeze my butt cheeks idk if it’s my tailbone but it cracks too,I’ve had naproxen prescribe and it didn’t do anything .  this has been on of the worst thing I’ve been through and it’s so frustrating, how do I get treatment if no one knows what wrong with me.",Someone please help
Chiropractic,,What’s this called and is it fixable?
Chiropractic,"So a couple weeks back I started experiencing a numbing sensation in my left arm and shoulder. 

My parents encouraged me to visit our family chiropractor. He was convinced that my spine and back muscles were misaligned which was suppressing a nerve. 

He did his thing on my back and encouraged me to come back twice a week for 2-3 weeks to see where we were at. 

Let me tell you, the positive effects of the first adjustment were felt almost immediately. I got home and noticed that my right leg “felt longer”. I was evenly distributing weight on both sides again. I also experienced a rush of blood to my extremities as proper blood flow returned. My toes were beet red and warm after having been ice cold for a week. 

To provide a little context - I had dislocated my right patella back in the Fall. I was in a knee brace for a while and did 6 weeks of PT which in hindsight probably wasn’t enough. So I’d been compensating ever since. 

This in combination with sitting around while working from home / playing video games a lot due to the cold weather and Covid were also big factors in misalignment I’m sure. 

So, sorry for the novel, but I wanted to provide some background info. 

Anyway, back to the question at hand. 

So, I had my first appointment of week 2 yesterday. Today I feel a bit dehydrated and a little dizzy. I’m drinking lots of water but I’m still feeling it. 

In your experience, is this pretty normal? I’m sure my body is working overtime to get my previously compressed nerve back to work, get my previously under-utilized back and leg muscles back in shape, etc. I’ve been sore in general which my Chiro told me would happen. 

What do you guys think? Reason for concern? Or no big deal. 

It’s probably worth adding that I’ve been experiencing anxiety throughout this process and it has impacted my sleep. Though this has improved.",Is it normal to feel a bit dizzy and dehydrated the day after a chiropractic adjustment?
Chiropractic,"Hi all - I'm here for advice as a patient/newcomer to chiro. I hope this post isn't redundant, but I checked the FAQs pinned post and didn't get all the answers I needed. I also did some searches, but Reddit's search function is spotty at best.  At any rate, apologies if I'm being a broken record.

I am trying to find an evidence-based chiropractor for my posture-induced neck and lower back pain and have no idea where to start. I'm on a student insurance plan, which limits my options somewhat. I'm considering chiro as an option, since it's more hands-on than PT regarding manipulation, and I believe I need that for immediate pain relief. However, it's also important to me that whatever treatment plan I'm on provides me tools for addressing the problem and improving it myself: since my pain seems to be extremely connected to my posture, that would mean learning tools for improving my posture at home so I can hopefully have a more healthy body going forward, especially since my career path requires lengthy hours in libraries and at the desk doing research and writing.

Are there any questions I should ask or red flags I should be looking out for while looking for a chiropractor?  I don't mind a holistic approach - I have studied cultures with a strong tradition of holistic medicine and I am not as much of a skeptic as some redditors with regards to whole-body medicine as a result. However, I also live in a very hippy-dippy area of the country where there's a lot of quackery practiced, so I'm trying to avoid the practitioners who believe chiro is a cure-all, or are anti-vax, etc.  I'm also trying to avoid getting stuck in a cycle where I need to keep going back for adjustments over and over again. 

There is only one chiropractor in my metropolitan area who is on the list of ""forward-thinking chiropractors"" linked in the sticky, and that office is far from my home and workplace. However, I live in a huge metropolitan area, so I imagine that there must be other EB chiropractors around here who are simply not listed on the registry.  Any advice you can offer would be appreciated!","Newcomer ISO evidence-based care: questions to ask, positive traits, and potential red flags?"
Chiropractic,"Hey guys, Are you suffering from back pain, either acute or chronic?  We strive to provide the most up to date information to help you take back control of your life! Share experiences, exercises, tips, journeys. A place to vent about the frustration of living with back pain. Help make backpain awareness a better learning environment to help you finally become pain free after what may have been years! 

I put together a Facebook group for those of us who suffer from back pain. The goal is to share tips and tricks that work for each other. I hope you all join - it's completely free and will help spread awareness :)

&amp;#x200B;

[Join here](https://fb.me/g/5b5TCQcA0/qWhag4Iw)",Help Us Spread Awareness About Backpain
Chiropractic,"Hello,
I am a psychology student conducting a research study for my dissertation to understand the relationship between pain self-management and overall wellbeing in patients with Myotonic Dystrophy and in patients with pain.
All personal information will be anonymous and you can withdraw at any point.
The study is an online questionnaire to measure how important you think self-management of pain is and how confident you are in doing so, followed by a questionnaire asking how you have felt in the last two weeks.  It will take about 15-20 minutes to finish the study. 
Please feel free to contact meeting for any questions, Thank you!
[Survey Link](https://nclpsych.eu.qualtrics.com/jfe/form/SV_3ZXxlIZVxy5VeEC)",Understanding relationship between pain self-management and overall wellbeing.
Chiropractic,,Chiropractic Center &amp; Spine Adjustment Denton
Chiropractic,"I've made it no secret that I am on the vitalistic side of things. One criticism that I see a lot is vitalistic docs believe in bone out of place. The thing is, I hang out with a lot of like-minded docs (across the country, seminars and get togethers that are 300+ in attendance) and not one talks or thinks in terms of bone out of place. We discuss joints that are under stress or restricted, but not that it is ""out of place"".

Is the criticism simply just based on here-say or a bias from limited interactions? Is continuing the criticism valid, or is it similar to how the medical establishment criticizes chiropractors for stroke?

I can see old docs at the start of chiropractic using bone out of place. Back then you feel a tight muscle bundle, adjust it, and it goes away. It would certainly seem like a bone was out of place. There are even Green book stories about railroad tracks being off center and needing to be tapped back in line. Of course, now we have X-ray readily and know that the bone isn't out of place. In the modern era I am sure there are some docs that communicate to a patient the bone is out of place, but in my opinion it is moreso because it is easier to explain and the doc doesn't *actually* think that.

My question then is how widespread is someone thinking ""bone out of place""? Is it a warranted criticism, or is the prevalence really just a handful at best?","How prevalent really is ""bone out of place"" thinking?"
Chiropractic,[removed],"Injury Ruined Career, but Loans still there"
Chiropractic,"In our office, we do seated Xrays and I was wondering if anyone had any suggestions for some stools. Right now, we're using a wooden stool but sometimes patients are too short or too tall so we get some false curves in there. Any suggestions would be appreciated.",Seated Xrays Chairs or Stools??
Chiropractic,"I have been doing this work for over 25 years now and many times I have felt like giving up.  Most of what keeps me going is a stubbornness to finish what I started.  The rest of the time it is the patients, which I care deeply for.  I do know that they would find some other place in a day if they wanted or needed too... THe only other thing really is the freedom I have as a sole proprietor.  

What has kept you going/ keeps you going.?  (and yes, if you are philosophically principled that is an answer... but expand on that...)\_",What has kept you from tossing in the towel?
Chiropractic,"So I’ve had chronic back pain starting in 2019. Was given certain medications to deal with pain but nothing helped but previous narcotics I’ve had when I had pet surgeries. PT helped the first time. However, the pain went from excruciating to more mild and tolerable. A year or so later my back pain get worse than it has been so I went to the closest chiropractic clinic. 

After my first adjustment the back was very soar which is normal. I ended up going back 2 weeks later and it felt good. However, each time I would go the pain got wise to the point my trip to Vegas, the pain got so bad that I thought it would ruin the trip. 

I got back home and the pain worsened each day until it reached the point of excruciating like back in 2019. 

I am convinced that the chiropractor messed it up because of the fact that everything I do hurts horribly. I am seeing a pain specialist in a couple weeks and each day I keep wishing that day was here. 

At this point I will never go back to a chiropractor ever again.",Chiropractor Hurt My Back More
Chiropractic,,Chiropractor &amp; Pain Relief Center Denton
Chiropractic,,What Can I Do to Help with My Back Pain
Chiropractic,,5 Top Habits to Minimize Back Pain
Chiropractic,"Sup everyone. So like in august I hurt my lower back, it got better in a few months and after that just feels stiff and tight. Now the left side of my spine hurts whenever I hyperextend my back it hurts really bad on my lower left side of lower back spine. It doesn’t hurt any other time, except sometimes when I turn my whole torso to the left. Should I go to the doctor for this?",Should I get this looked at
Chiropractic,Is it ok for a person to go see a chiropractor 3 months after open heart surgery?,Post surgery adjustment
Chiropractic,Does anyone have any idea how the job outlook for new grads is in the greater Toronto area? A quick search on Indeed.ca shows many job postings showing 70k+ annual salaries. I'm not sure how reflective that is of the real job market. Any input is much appreciated!,Ontario GTA New Grad Job Outlook
