subreddit,selftext,title
Chiropractic,"Im struggling with my upper back getting exhausted when im just standing up and down or walking slowly. Seems like my upper back is carrying the weight that my ""core"" should mainly be carrying actively.  
 Im about 85 kg and 1,83 cm high and going to the gym regularly, focusing on proper controlled reps, functional excercises etc. but I seem to just even make it worse even if i try my best to get the weight down to my core.   


Ive got a spondylosis for a few years now, so its normal that the body dont want my lower back to carry any unneccesary weight in the start, I suppose. But shouldnt be this hard to be standing for 15 minutes without wanting to sit down. Im being a bit careful with rotation/anti-rotation exercises, but I do some light ones regularly.  


Any tips to activate the core (lower back/stomach mainly) and make the body use the right muscels more?",Upper back getting exhausted
Chiropractic,"I went to the chiropractor today because my neck has been bugging me due to a whiplash injury from being rear ended. Long story short - he did a full body diagnostic, and white he did pinpoint the pain in my neck, back, and should, he also found that my left knee had an “angry tibia post”. What he did was have me lay on my stomach, and bend my knees sort of back towards my bum. He noticed the left wasn’t bending as far - and he sort of, I guess pressed and felt deep in the back of my knees. My right one felt normal but my left felt extreme pain. He called this a “very angry tibia post” (which makes sense, my knee cap had been bothering me a few days prior to this but I thought nothing of it. He said he can help me fix this. But he didn’t crack or adjust it (unless that’s what all the pressing and prodding was?)

My knee was fine going in - it felt okay going out - and so I went home and ran some errands and did about two hours of walking. Now I’m stuck onto my couch - it’s very sore, sharp pain if I bend or flex the wrong way. It hurts on the backside and side alot. I’ve been icing it. 

Here’s what I wanna know: did he do an adjustment on me knee, and is this normal? Because there was no cracking or popping like he did to my back, neck, and shoulder. It was sort of like he just dug around deep in the back of my left knee. Is this what the adjustment is, or did he not do it yet and just somehow irritate the part i pain and cause inflammation? 

My next appointment isn’t until Tuesday but I’d like to know if this is normal or if I should be going back as soon as possible. Thanks for your time!",Question about knee adjustment:
Chiropractic,,Pain Relief Center &amp; Chiropractic Care Denton
Chiropractic,[removed],Ontario GTA New Grad outlook
Chiropractic,,Recover Spine Movement &amp; Pain Relief Center Denton
Chiropractic,"Chiropractic treatment is discovered by Daniel David Palmer in the year 1895 and he claimed to treat a person’s deafness by spinal manipulation. Though there’s an argument that [chiropractic treatment](https://infohubmarketing.blogspot.com/2022/01/chiropractor-near-me-georgia_02142593498.html) is even more ancient method and so, it’s not validated properly till date, says a chiropractor near me Georgia.",How Chiropractor Near Me Georgia Improves Physical Functions
Chiropractic,"Saw a few posts and comments saying that EB Chiro and EB PT are indistinguishable with that said, would it be worth it to study chiro still if you're already a licensed PT?

I do not know the difference between the two apart from the HVLA thrust that the chiro performs, but based on what I'm reading in this subreddit, modalities, exercises methods of treatment are all similar.
 
Kindly inform me if I'm wrong. I would like to be educated in this matter. Thank you!",Would a licensed Physical Therapist benefit from studying Chiropractic (4 more years)?
Chiropractic,,Does anyone know why my ribs stick out like this ? especially while laying down. ( I am not sucking in)
Chiropractic,"Hi there - I'm wondering if any DCs on here have successfully built relationships with MDs and have a pretty sizable portion of their patient base coming solely through MD referrals. If so, how did you go about making those relationships? Do you have a specific process or operations built around making it easy for the MDs to refer? And lastly, how do you continue to maintain your existing MD relationship?",Any DCs here partner with MDs?
Chiropractic,,Happy Friday!
Chiropractic,"I've reached Tier 6 with ASH. NO MORE MNR'S!!! It only took 4 years to get here but here I am. To all of those who think it's impossible... well it nearly is! Keep jumping through the hoops, the end is near.  
  
And to those wondering.... it's still F*** Cigna. All my homies hate Cigna.",I've finally done it...
Chiropractic,[removed],Are chiropractic visits reported to your medical record if you only pay out of pocket? Like if an employer asks you to release your medical history
Chiropractic,,Would someone who has recently completed the sports residency program at SCUHS recently be able to talk to me about your experience? Thanks a ton!
Chiropractic,There’s a bunch of students who do this. I’m a current chiro student who will be entering clinic next trimester. One of my main reasons is to keep my personal IG separate from business. Has anyone run into issues? Either not enough content or lack of an audience?,Creating an instagram account as a student? Pros and Cons?
Chiropractic,[removed],is there a way to find pro-vax chiropractors?
Chiropractic,"So, I have pretty bad APT and I’ve been doing exercises/stretches I saw in video by Pigmie. I keep doing them and there is NO difference. [Video](https://youtu.be/dByKRcIi160) The only thing I have trouble with is the crunches. I do each exercise 30 times once per day. Should I get fitter and be able to do proper crunches? Also should I do these more times per day?",I hope this is the right place to ask this…
Chiropractic,"I don’t have any back pain just shoulder pain. Been to physical therapy on and off for years, but it feels like my shoulder is almost out of place so exercises reduce pain but don’t fix my position. For example, if I look in the mirror with my hands on my hips one shoulder sits completely forward and I can’t physically move it back to be like my “normal” shoulder. Can I go to a chiropractor if I don’t have back pain?",Shoulder Pain / Instability
Chiropractic,"Hi all,

I went to my chiropractor a few weeks ago to get my regular adjustment. I usually go once every other week or so for maintenance and it’s really helped my SI joint pain which I was suffering from a year and a half ago. 

However, after this appointment I’ve noticed persistent cracking and grinding in my neck afterwards when my neck was adjusted which has been occurring the past several weeks. No pain, dizziness, or nausea, just cracking and grinding every time I turn my neck left, right, and sometimes up and down. Is this normal and has anyone else experienced this?",Neck crunching/grinding after appointment
Chiropractic,"I am an avid yoga doer. I especially love Yin yoga and have an excellent teacher. I get yoga highs every time. I also have a lot of trauma. I’ve recently been seeing a chiropractor who has been different than any other chiro I’ve ever seen. He does adjust me but also presses in my joints and it’s so painful but after it’s done I feel drunk or high and can’t literally function the rest of the day. I’m not sure what the technique is called. I have a lot of trauma in my past and I am pretty much in pain all the time. It’s the kind of pain that I don’t notice till some one touches me but it’s always there. I have been diagnosed with fibromyalgia (idk 🤷‍♀️) but I don’t medicate as all medications make me very sick. My question is this, Scientifically, what is happening in my body that causes this extreme exhaustion?",Extreme exhaustion after adjustment
Chiropractic,"Has anyone had any luck picking up the smaller cracks with a stethoscope microphone?

Any other recs for a microphone that can pick up internal body noises?

(This would be for personal use as a patient, I am not a chiropractor)

When I stretch/crack my back it sounds SO crunchy to me. Curious if I would be able to record this.",Mic for recording internal chiro sounds
Chiropractic,"Has anyone had any experience with the EHR/EMS Kareo, or WebPT? What has your experience with them been?",Kareo/WebPT
Chiropractic,"Just like the title says.  I was wondering if schools in the US hold an interview process like the ones in Canada.  None of the schools in the us mention this on their website.

Can anyone chime in?",Do all chiropractic schools in the US hold interviews? Or is it a basis of being accepted solely on admission requirements?
Chiropractic,"Hi 
I had a strange and painful back 'clunk' while just bending over last week. 

Since then I've had pretty significant back pain but also discomfort in my abdomen. Almost a feeling of being bloated or gassy but not having any gas. Just an odd and uncomfortable feeling. 

Is this treatable with chiro? I have appointment tomorrow.",Back movement and stomach pain?
Chiropractic,,What is this lump? It looks strange… any other details you could provide regarding the x-ray?
Chiropractic,"I'm a patient in the Dallas area, but could travel further. Does anyone know where I can find a chiro that performs this procedure? I'm having trouble finding where to go for this, as it sounds like it's not a commonly performed procedure.",Looking for internal coccyx adjustment in Texas?
Chiropractic,"I am curious to know what are your opinions on what marketing strategies seem most effective. Do you all focus on SEO, website, social media/content, local in person marketing? 

I feel like I keep spinning my wheels, jumping from one to the next and I feel that focusing my energy on one type would be more effective. 

Related question: is outsourcing marketing worth it and if so what are things you look for in that company?

Any recommendations or experiences are welcome!",What types of marketing strategies are most effective?
Chiropractic,,What payment processing company/terminal are you using and have you been happy with it so far?
Chiropractic,,Use of Chiropractic for Sciatica
Chiropractic,"Hey docs, graduated 6 months ago and am now working in an upper cervical office. We do activator as well. When I initially interviewed the position as an associate the offer was 60k-100k a year with retirement matching (3%). The  work hours were 3 full days (8 hours) and 2 half days (4 hours). My training/on-boarding was suppose to be 9am-6pm 5 days a week to get me upto speed. Once I hit ""fully"" trained I was suppose to get two half days. Well I got up to speed about 3 months in and yet I've only received 1 half day shift.

 On top of that, my bonus pay is based on collections...I charged 42k my 4th month and yet we are only collecting 50% of that. 5th month in I charged 47k and still...50%. I'm in month 6 and am now seeing 50+ patients a day, charged 55k and now collections is 33% (I run my numbers every week). So at this point I'm busting my butt, but we aren't collecting enough for me to hit bonus pay (I have 5 tiers when I hit certain thresholds). And I still haven't received my 2nd half day. On top of that, I'm training another doc that was hired into the office. At what point do I ask for #1, my 2nd half day and #2, why are the collection rates for me, so low? Because at this point my base pay is 48k before taxes and I'm barely making enough to pay rent and take care of my family. The only reason we are still afloat is because student loans got pushed till may.

Also, I have asked for both my half days and yet the main doc has said they don't have answer or date on when I'll get them. I also don't get paid to train the other doc and I have been staying an hour after work helping them which puts stress on me and family time since I'm gone from sun-up to sun down most days out of the week.

That was a lot but I don't really have a place or anyone to talk to about this because only chiropractors would understand my situation. Could really use some advice. Do I go job searching, go out on my own? At this point, I'm staying only because I got two mouths to feed.","New Doc, feeling bitter and burned out."
Chiropractic,"I started cracking my knuckles and neck during middle school around age 12, and I am now 35. The past couple of years, I was able to stop cracking my neck unconsciously, but I consciously can't stop cracking bc the tightness builds up and forces me to crack it for a temporary release. After an adjustment, I feel great for a day or two but I always end up needing to crack it. I believe the main cause might be due to repressed emotions and anxiety, but the years of cracking probably resulted in a physical cause as well. Also I have a reverse curvature, so no matter how good my posture is i feel like the unnatural curve always results in some tension in the neck. I currently see a chiropractor and he uses the Y-strap which feels great. Anybody have any suggestions for me? Thanks in advance.",My neck pain
Chiropractic,"Hi all!

I just started a new role with a start-up insole company called Fulton ([walkfulton.com](https://walkfulton.com/)), and am looking to speak with chiropractors to learn more about the industry, patient and provider needs, and. explore partnership opportunities.

A bit more about Fulton:

Fulton is a modern brand of arch support that empowers customers to live a healthier, more.  
comfortable life, starting from the ground up. Fulton creates sustainable insoles that offer  
customized arch support and superior comfort to enhance the body’s alignment and prevent  
injury.

If interested in a 15-30 minute convo, please schedule time with me at [https://calendly.com/amelia-fulton/30min](https://calendly.com/amelia-fulton/30min). And of course you'll get a free pair of insoles for your time!

&amp;#x200B;

:)",Fulton insoles
Chiropractic,,Should a chiropractor’s manner of practice reflect closely to that of a physiatrist? Obviously I know this wouldn’t include prescribing and other interventions. I have always loved the concept of physical medicine and rehabilitation and plan on attending SCUHS this September.
Chiropractic,"For context, I have spent the last four years gaining weight and destroying my posture. With the pandemic, I have noticed that I have weakened my upper body strength and developed a hump and fat around the C7 vertebrae. I am 22 and my new year's resolution is to sit straight as much as possible and fixing my back. Is the hump reversible if my family has no genetic history of it?",Can the C7 vertebrae be fixed after Dowager's formation?
Chiropractic,"Hey guys, who else has hired W2 employees as part of their biz?",Who Has W2 Employees?
Chiropractic,,What the fuck is up dennys
Chiropractic,"No. And I wish like anything y’all would STOP saying you do PT/are just like a PT. Or telling EB chiros they are PT/MD wannabe’s

Yea, I know the national board says PT and many states use the term. But that doesn’t make you a PT and you aren’t doing PT. 

You are a chiropractor. Be proud of that and stop wasting energy trying to define yourself to people as “kind of like a PT.”  Start defining the profession accurately. 

BJ Palmer did it with his exercise facility. Why can’t you?

It’s not PT, it’s exercise rehab, exercise prescription, modalities, ergonomic assessment. Physical therapists don’t have exclusive rights to that stuff. Any more than MD’s own blood pressure cuffs. 

They are an essential part of getting sick and injured people well and maintaining health for the coming years. 

I know, and have had the quarrel here “the adjustment defines chiro, everything else is not chiro.” 

This from the same guy who, ages ago on this sub, said he used to try to practice EB but it was so much effort and now that he is subluxation based, his life is so much easier and less stressful. 

Yea…no. In the immortal words of my old uncle…”don’t be a lazy dog.Do the work.”

Look, all of the modalities, the exercise, the tests and evaluation are in our scope. They are in our history. People fought hard for their inclusion in our laws. Don’t cheapen the profession by claiming to be something else. Add value to your own profession and make the effort to more accurately define yourself, your abilities, your skill and knowledge in the minds of the public. 

I can tell you right now PA’s will never claim to be a nurse practitioner and vice versa.  They are both mid level providers, with much in common. But def not the same. 

A DO I know says “My education overlaps with an MD’s, and I did the same residency, but the core is different.”

I see it on websites, signs and advertising all the time “we do physical therapy.” 

Why oh why?  Chiropractic is a profession. Not a skill set. Try “our expertise and experience in evaluation, manual treatment, exercise rehab and modalities gets you well and keeps you well.”

So, what sets us apart? 

History certainly does. Our background of having the title “Dr” isn’t a small thing. Sure, our history is full of DC’s who shirk their responsibilities and do just one thing. But when you look again you see DC’s who have  taken the term “chiropractic physician” very seriously. Study the people who built National, Lincoln and the other early “science based” schools. Study the men and women who ran BJ out of his own organization. Study the men and women, like Logan’s past president Bee Hagan, who went to jail for taking blood pressures.  

We have had a Dr mind set from the beginning. That other group has not. 

Diagnosis and referral sets us apart. Imaging certainly does. Not to mention the chiro specialties like neuro, ortho, internal med. 

I took a neuro CEU course with Dr Antonucci down in Miami, Fl. Holy moly, learn all you can. 

I think we need to start defining ourselves as patient centered. And we need to highlight that we use judgement and discretion. Not that we are one-trick ponies but that we evaluate and use exceptional judgement on how to manage each case. And our results speak for themselves

Selling ourselves as one trick ponies is selling ourselves way short. And “I’m a one trick pony who also does someone else’s job on the side,” is even worse. 

I agree with my colleague I mentioned before, it is the adjustment that sets us apart. It is starting at the joint level, the macro, that often makes us more effective. 

Chiropractic adjustment is an incredibly powerful and irreplaceable tool. And is is ours to maintain and nurture through research. 

But defining chiropractic as only adjusters isn’t accurate, any more than a hammer or saw defines a carpenter.  Carpenters build things. And we trust them to use the right tool at their discretion. 

Chiropractors get sick and injured people well and help them stay healthy. Trust us to use our skills, judgement and discretion. 

Chiropractors have demonstrated the power of starting care at the articular level.  Good Chiropractors also use all the available tools, at their discretion, to help patients get healthy and stay healthy. 

Most importantly of all, Do NOT be so ashamed of our great profession that you claim to be something else. Be proud of who and what you are. 

Words are important. Use yours carefully. Define yourself accurately. Don’t steal someone else’s thunder. 

Make your own thunder.",Is EB chiro the same as PT?
Chiropractic,"For the past 2 months I have had pain in my upper back after sneezing hard. I've been stretching for a while now and some times I put a motorcycle helmet under my back to stretch better, what could have happened? I'm going to see a chiropractor soon",back pain after sneezing
Chiropractic,"Can a chiropractor recommend me a posture brace to help with my posture?
Something like this any good?
https://www.neptuneblanket.com.au/products/posture-corrector",Posture brace
Chiropractic,"Is it true that someone can “reset” their pelvic tilt with certain exercise?
Has anyone experienced Anterior + clockwise tilt? How did you go around dealing with the lower back pain associated with it?",Pelvic Tilt
Chiropractic,,Anterior/clockwise pelvic tilt
Chiropractic,"Hi I'm looking to buy a portable chiropractic table. Was thinking about Chirolux however, some of my peers suggested that it was not sturdy enough compare to lightlite and astropod. But chirolux is the only ones that came with drop in the middle (the new model bench). Anyone recommendations for me? Thanks.",Chiropractic table
Chiropractic,"Hi all! I have hard of hearing and almost deaf patients that I can understand but I’d like to learn, at the very least, chiro-related signing to help communicate better. Any resources would be really helpful. Thanks!",Resources to learn to sign for my deaf patients
Chiropractic,"Going into my last few trimesters of school, have been getting my business plan started and have a question regarding my insurance vs cash fees. I’ve already made a rough draft of my fee schedule per what I see as my most common CPT codes. My question is, when I see Docs advertise their fees on an EMR like Janeapp, they’ll post their prices such as $120 for initial visit, $75 for a follow up, etc. Are these fees created through a combination of their CPT codes used to add up to those “cash” fees? If those cash rates for self pay were cheaper than your total in codes  for the same treatment you would bill to an insurer this would be a dual fee schedule right? Just want to cover my bases through the brain trust here. Thanks!",Cash fees vs CPT code fee question
Chiropractic,"Hello! I'm currently finishing up my studies for Physical Therapy and I'm interested in taking Chiropractic to supplement my knowledge. Does anyone know a general gist of what you learn per year level? Just so I have an idea on what to expect.

Also, i may be misinformed, but how much of chiropractic is cracking and how much is the body kinesiology?

I also don't understand schools that focus on chiropractic philosophy. Can someone enlighten me on this as well?

Any info would be great! I plan on studying in Malaysia (IMU) and then move to UK (AECC) to finish up my studies there.

Thank you have a great day!",Questions about Chiro schools (Curriculum and gist)
Chiropractic,"I am having a discussion with an individual to discuss the role of EB chiros and I don’t have a clear rebuttal to the answer of why chiros exist in the first place.

The argument of this individual is that chiropractors specialize in a minority subset of lower back pain and are indistinguishable from PTs when using an EB approach. The entire profession originates from pseudoscience and it is only recently that they decided to follow an EB approach.  “Why don’t chiropractors just admit their profession has zero validity and tell the public that their future practices mirror what physios do?”

Although there are PTs that don’t focus on EBP, that is a minority of what is a majority-EB profession, whereas chiropractors are the opposite. Only a minor group that claim EB while the majority of the profession are charlatans since it stems from one guy motivated by a ghost. That’s why the good and bad apples argument is not relevant in this context.

Furthermore, the individual explains that there is no double blinded study showing the efficacy of chiropractors, rendering them useless to mild low back pain, which resolves itself within two weeks the majority of the time. The only reason a patient would ever go see a chiropractor is when they are desperate and that is when chiropractors utilize tactics for patient retention, essentially taking advantage of the disabled to treat problems that resolve on its own without intervention. (Insinuating the fact that temporary relief of cracking bones creates a placebo ultimately promoting repeat and unnecessary visits.

The individual then argues that “if you go see someone and it works, then stick to it” idea is imprudent because anecdotes have no high quality evidence behind them. Anyone can make up why x works though it may seem egregious, but that doesn’t mean it’s useful in a clinical setting. The same goes for chiropractors and the relief that patients get from seeing them.

I will admit, there’s quite of ignorance to these arguments, and I do not have the perspective of a licensed EB chiropractor or extensive research on the efficacy of HVLA-SMT to answer these points. Those who have been defending this profession, how do you tackle this perspective?",If EB chiropractors practice similarly to PTs; why is there a need for the profession in the first place?
Chiropractic,"I’m curious if any of you have integrated with MD/DO’s and if so, how has that worked out for you?

Where did you find information on how to do so, without accidentally breaking some of the many laws that exist for such a practice ?",Have any of you integrated with medical professionals?
Chiropractic,"Hey everyone, I have my interview coming up in a few days and I'm feeling very nervous. They said it can take 30-40 minutes apparently and that seems like a long time. Any tips/advice anyone has out there would be greatly appreciated!",Chiro School Interview Questions
Chiropractic,What school do you think have the best DC Program?,DC program
Chiropractic,"I'm a student of Chiropractic in Canada, and have been entertaining the idea of practicing overseas (perhaps the UK, as the title mentions). Are there any chiropractors who are practicing/practiced in the UK before? 

If so, what has your experience been?",Job quality for chiropractors in the UK
Chiropractic,,An interesting session
