subreddit,selftext,title
Chiropractic,"See above, thank yo in advance for replies",What 5 questions do YOU think are critical to ask when choosing a chiropractor?
Chiropractic,what was your recovery and would you recommend doing it during a school break or in practice?,Chiropractors with Breast Augmentations
Chiropractic,,Sciatica Nerve Pain &amp; Low Back Pain Treatment by Hyderabad Chiropractor Dr. Rahul Gulve
Chiropractic,"Good Evening, 

I've been experiencing some significant lower back pain over the last couple weeks. I'm pretty sure it's from a work related injury where I was rushing and bending and lifting improperly.
I was referred to a chiropractor and I went in for a preliminary visit where the chiropractor took x rays and measurements and told me on my next visit that he would review the x rays and go over my treatment plan. Before even doing all this, he prefaced that my pain was likely from a misalignment of my neck that was causing strain on the rest of my body. He said I was too young (I'm 32) to have significant back pain from over extending it or bending or lifting improperly. 
I was charged $45 for this initial visit. 
I returned less then a week later to review the x rays. The doctor showed me my x rays and said my hip and spine were perfect and there was nothing wrong there. He said my neck was misaligned and it was the root cause of all my pain. I'm not an expert, but looking at the x rays, my neck looked relatively normal. 
He then started talking to me about NUCCA, which I hadn't heard of before. He explained what he would do and it would correct my lower back pain. 
He then went over the pricing. He said I would be given 13 visits and I would have to pay $3000 in advance or 3 monthly payments of $1000. The first visit would be the only time he would do any corrections. The rest would be follow up visits where he would check if I'm healing properly. 
He said there was no option to pay one visit at a time. I said I would have to think about it and he tried to pressure me into making an appointment first. He did say if I make an appointment for the initial correction, then I would have to put some money down as it is a significant block of time if I were to cancel.
After that I just said I would call them at the end of the week. 
I did further research on online after and found out a lot more about NUCCA and I don't see any justification for paying $3000 in advance for this procedure when it only includes one correction 
I was hoping some more experienced individuals could comment and give me their feedback on this. 
Thanks!",Was asked to pay $3000 in advance for NUCCA treatment plan. Thoughts?
Chiropractic,"Hey everyone,

I graduated from NYCC in 2020, and completed parts 1-4 of American Boards and did quite well on Part 4. I completed Part A &amp; B, but now i will be taking Part C soon and wondering if there were any tips on how to prepare for Part C coming from an American school since Canadian exams are structed differently. 

Thanks in advanced.",Part C Canadian Board Exams Help needed
Chiropractic,"I am looking treatment options for a cervicogenic headache problem I've had for years. Recently found out I have mild scoliosis. 

One rehab center suggested a combination of pt, acupuncture, chiro, and pettibon (wobble chair) therapy. They say my curves likely will not change but the idea is treating the muscles around the spine.

The other recommends the same but without acupuncture and the whole CBP 36 visits deal. They are very focused on correcting the curves. I have read all of the criticism of CBP and I am super skeptical here. Also, it concerns me that they don't think massage or acupuncture is necessary when my neck is tight as hell.

Just wondering what the community here feels about incorporating acupuncture or massage into treatment vs not doing so? Also any comments or criticism of the two methods above are welcome.",Chiropractic care combined with other rehab methods
Chiropractic,"Hi, I am not looking for any medical advice.

I just wonder how long the muscle pain (sprain) could last in an area that was over-adjusted. It is quite scary for me :(. Thanks in advance.",How long can over-adjustment pain last?
