subreddit,selftext,title
Chiropractic,"I'm not looking for advice. I'm just trying to find an explanation. I think chiropractic reddit can explain this better than orthopedic reddit.

A couple years ago I was at a trampoline park with my kid. I did a butt bounce and felt my middle back scream out. If you put your hand right underneath the front of you rib cage, it was the opposite side on the back.

I was really sore for a few weeks. This subsided into a general discomfort, and I felt this need to constantly stretch that area of my back , but I could never find the correct position. I also experienced a slight decrease in mobility when twisting my torso. This was not debilitating. I could still lift with no pain, just a general discomfort and need to stretch. I experienced it for almost 3 years.

I recently started jiu-jitsu.

At one of my first classes, I was drilling a back mount escape.

Here's a link to a pic for example. I would be the guy in the blue gi.

 [1.jpg (250×188) (ultimatejujitsu.com)](https://www.ultimatejujitsu.com/images/techniques/foot-lock-against-the-back-mount/1.jpg) 

I was slightly arched towards my partner, attempting to escape, when my partner pulled back on me to regain more control. His feet had my thighs immobile, and he had one arm hooked under my armpit. He basically pulled me gently and firmly into a more arched position while keeping my lower body immobile.

I finally got that stretch I've been looking for. It hurt so good is the only way I can describe it. I also had five distinct cracks in my middle back. I groaned loudly in relief. My partner thought I was hurt. I just laid there for a moment basking in relief, and then carried on with the drill.

My middle back muscles were a bit sore that night, not painful, more like DOMS. A little advil took care of the soreness that night. The next day I was no longer sore, and my back felt great for the first time in years.

Ever since, I've been discomfort free, my mobility has increased, and I don't feel the need to stretch. 

Can anyone explain what happened to my back at the trampoline park and how getting that unintended stretch at jiu-jitsu relieved my back?",Looking for explanation
Chiropractic,The title pretty sums it up. The treatment is having your one leg cross the other leg and the chiropractor pushes down on the crossed knee and the other side's shoulder.,Are there cases where treatment leads to herniated disc?
Chiropractic,"Those of you who have your own practice, did you you a office design company to help with designing the layout and interior decor? If so, what company did you use? Was it worth the money?",Office design
Chiropractic,I’ve never been to a chiropractor but I’ve always had bad posture. Recently within the last 2-3 months I’ve noticed my lower back/spine and hips can consistently crack. I don’t know if it’s always been able to and I just haven’t noticed or not but it’s started to worry me. Also whenever I sit in my car for a period of time and get out my back has to crack,"24M, lower back won’t stop cracking"
Chiropractic,"Hey guys. Just want to start off by saying that I don’t mean any disrespect to you guys and what you guys do for a living, I’m genuinely curious. I went to a chiropractor today for the first time ever and got my neck and back cracked. AFTER I got this done I came home and started to read online and a lot of people are against neck alignments because they can cause a dissection in your artery. Saw a lot of people mocking chiropractors on Reddit too. I have terrible health anxiety as it is so now reading this online has scared me even more. I don’t have any of the stroke symptoms but I read that they can come after days or weeks of getting this alignment done. If anyone could, I’d appreciate an explanation.",Why do chiropractors have bad reputations as people who don’t know what they’re doing
Chiropractic,,Thoughts?
Chiropractic,Hi! Does anyone know of any in-person CE unit seminars in souther California coming up? Preferably in the Irvine area but willing to travel.,in-person CE unit seminars in southern CA
Chiropractic,"I’ve been to a few chiropractors and they always seem to just do the same adjustments (neck, back, side twist thing). One of them actually did a leg pull. 

I honestly just want to have a full body adjustment for some reason. 

I’m looking for a new chiro as the last one I went to always wants to set you up on a long treatment plan and does the same couple adjustments. 

Maybe I’m watching too many YT chiros.",Are full body adjustments a thing?
Chiropractic,"Hello everyone, I haven't done one of these in over 2 years (https://www.reddit.com/r/Chiropractic/comments/beg2i8/state_of_the_sub_feedback/ if you want to check out the old one) so I think it's time for a new one for 2022. We received a lot of good feedback then so hopefully we can get more now. Since the last feedback we've made a categorized FAQ, changed sub descriptions, added tags to posts, and have done our best to keep out the trolls and medical advice questions.

However, there have been some comments within the past few weeks and more within the past few days about unhappiness with the sub. I know there have been heated conversations over the past few months regarding masks, techniques, vaccines (which I am guilty of), and others which brought up comments regarding professionalism. I know debate is a healthy part of things but from user feedback it was viewed that professionalism was not policed consistently. I've also heard unhappiness with mods too. So what more can we do to improve the sub? Anything else regarding the looks, feel, or structure? New rules?

Also, if you feel like you don't want your suggestion to be posted in public, feel free to PM me or whatdc.",State of the Sub - Feedback
Chiropractic,"I have always been able to twist my back and pop the lower sections of my back, both left and right with very loud, satisfying pops. And now I can't even do it anymore. I twist my back and nothing happens. I used to do it myself with such ease.  I definitely don't feel as flexible as I used to be. I started to notice my back wouldn't pop over time, and it completely wouldn't work around when I turned 19. I am 21 now. Does this have something to do with age or my body?",Why can't I pop my own back anymore?
Chiropractic,Just ordered a new chair and would like to know if it's fine to use a hard lumbar support pillow if I have a small lordosis. First two days were really uncomfortable since I never had lumbar support but i start to get into it. I'm just hoping that the support won't accentuate my lordosis.,Lumbar support and lordosis
Chiropractic,"I've been following some podiatrists on social media that advocate for low profile, minimalist, barefoot shoes. What are your thoughts on modern footwear and body mechanics? Is that something you discuss with patients?",Thoughts on minimalist/barefoot shoes?
Chiropractic,"I live in a western country and curious to know if anyone has made a move to work overseas such as in Europe or Asia?

What was it like?",Working as a chiropractor in Europe or Asia?
Chiropractic,"I've always noticed the ""Chiropractic Appliances: (Some $$ amount)"" on the insurance verifications and I'm wondering if I can stock up on some cold packs and sell them to my patients. I do recommend heat/ice to my patients after doing certain therapies so I'm not just trying to squeeze a few pennies out of ASH, I legit. Does anyone bill ASH for appliances? How do you do it? Is it worth it or does ASH make this a worthless pain in the neck like everything else it touches.",Billing ASH for Chiropractic appliances
Chiropractic,"I have a bad habit of self neck cracking for relief to where I just twist my head to the right until it pops/cracks. I recently went to the dentist and apparently my right jaw is locked, I somehow felt a release this morning while yawning and when I twisted my head I felt the tender spot in my mouth the dentist says is my muscle locked up. Should I go to a chiropractor to see if there's something more to what I'm feeling?",Locked Jaw caused by neck cracking?
Chiropractic,,Efficiency of primary spine care as compared to conventional primary care: a retrospective observational study at an Academic Medical Center
Chiropractic,"I'll try to keep this short. It started with my wife going to get checked out for her sciatica, she did the whole exam &amp; x-ray to start out. She was given a schedule of 3 times a week for 24 weeks at $60 a visit.

I also went to go checked out, and apparently my hips are slightly rotated. So he scheduled me for 3 times a week, 14 weeks. 

The sketchy part for me is when he did the lateral arm strength test to see if my spine was in balance. He would deliberately put more pressure on my right arm than the left and say I'm not in balance. After my first adjustment, he did the same test but I felt him put way less pressure on my ""weak"" right arm. So he said the adjustment is working... It's making wonder what else he is lying about?

A typical session for us is about &lt;3 minutes for an adjustmen at $60. Is normal for other Chiropractors?

But here's the thing, my wife said she hasn't had sciatica since she's been going, so it must be working right?

He's also a chriro for babies and kids. Which might add to the severity of his lying since he could be scamming whole families. I see them come in and out in less than 5-10 minutes.",Trying to figure out if my Chrio is a scammer...
Chiropractic,,Do Chiropractors Help with Knee Pain Relief?
Chiropractic,[removed],Life West or Palmer West?
Chiropractic,"Is it normal for a chiropractor to be touching, stretching, and manipulating areas of the vag\*\*a with no gloves, underneath clothing and underwear to treat lower back issues? I experienced this for several years as a teenager (well under the age of 18), with a male chiropractor and have been trying to understand if this was normal chiropractic care, or needs to be reported. Anyone have similar experiences/feedback/advice?","Skin to skin contact in ""private"" area?"
Chiropractic,"Hey guys,

Im opening my practice soon and made a google page. The problem is that my information like address and phone numbers pop up because they’re connected to my NPI. How do I hide this?",NPI database
Chiropractic,Hello I'm running into a big issue. I have a lumbosacral transitional vertebrae on my left side. And it is not supposed to move but it can in my case. And when it does get out of line I can't get it back in. When it's not sitting right I walk different. I can feel it all the time. It also causes loss of control in my left leg and feels funny and restless. My whole spine gets out of shape because of it. I tried so many practices to help me with it but no one can realign it. I was able to do it myself when I was younger but it doesn't work anymore. I'm so desperate since last time it was sitting wrong for a year and was almost put in a wheelchair. Hospital can't do anything. Do you know some techniques for me to try and do myself? I'm being treated at a chiropractor for a short time. But he also doesn't understand my issue.,lumbosacral transitional vertebrae
Chiropractic,"A colleague of mine just published this article:

[https://chiromt.biomedcentral.com/articles/10.1186/s12998-022-00412-w](https://chiromt.biomedcentral.com/articles/10.1186/s12998-022-00412-w)

What are some clinicians' thoughts here on following guidelines? Do you review/use them to guide your practice? 

Also, I'm going to be fully licensed in the new year and was wondering what were some of the best resources out there for business regarding chiropractic clinics",Do you follow Guidelines
Chiropractic,"Hi everyone,

&amp;#x200B;

I went to the following website: [http://dire](http://directory.fclb.org/LicensingBoards/US/Florida.aspx)[ctory.fclb.org/LicensingBoards/US/Florida.aspx](http://directory.fclb.org/LicensingBoards/US/Florida.aspx)

&amp;#x200B;

I tried to email and call and in both cases I get errors. I was unable also to find information simply by googling.  So anyways, I did my degree at the University of Quebec at Trois-Riveres (UQTR).  I am seriously considering moving to the USA (which I already have citizenship for).  Prior to taking the board exams again, I just want to be sure that my degree would be accepted.

&amp;#x200B;

Can anyone confirm if that is the case or provide me a link or number for me to contact?  

&amp;#x200B;

Thank you.",Confirmation for my degree
Chiropractic,"Can anyone tell me which Green Book BJ Palmer’s “The Big Idea” story comes from? I can find it on various websites, but I’m looking for the name of the specific book that it comes from",The Big Idea
Chiropractic,"With the new variant increasing in spread, I was curious what peoples' policies were on vaccination status for patients and staff. Is requiring masks ""good enough"" for public health, or do you even require masks?

Last time a question like this was asked may have been before the Delta variant had sprouted, and I am interested to see if there are new viewpoints or changing viewpoints.",Do you require your patients to be vaccinated? What about staff?
Chiropractic,,"My left shoulderblade hurts so much. Everything is closed around me atm (fysiotherapy, chiroprators) . What could I do to release a lot of stress off my shoulderblade. or even fix this???"
Chiropractic,"So I was popping my neck just to relieve some pain when I tried to do it one last time and there was something blocking the pop, so I full forced it causing a use massive loud bulky pop, but I didn't felt relieved  it felt like instead as if I broke, or damaged something because shortly after I turned my head to the left and I could hear this strange sound in my ear, it wasn't inside or anything to do with my ear, but it was right below my earlobe, and behind where my jaw bone meets my ear, it feels like a muscle either got ripped, and as if it is moving each time I turn my head.  Is this bad?  I really need help with this I don't want to die or loose hearing.","popped neck hard, causing right side of neck (left side if looking at me) to be painful when looking, and strange sound in ear"
Chiropractic,,"Just going to put this here, might help some people out. If anyone is looking for/hiring an associate, please put your company below so we can find you online. Wish this would happen more here"
Chiropractic,My team is working on a paid survey for wellness professionals that I think would apply to several members of this group. Compensation is $50. Would love to hear your voices! https://www.userinterviews.com/projects/3aMserq7vg/apply,Paid survey for wellness professionals
Chiropractic,My wife and I are taking over a 40 year practice as the new doc and manager. We were excited about the prospect of CTProbill but the current management sees it as an additional expense and not a way to reduces expenses and generate revenue. I would love to know about any experiences people have had do determine if they make sense for our office.,Thoughts on CTProbill?
Chiropractic,"I'm hoping for a somewhat esoteric discussion about what chiropractors are supposed to do, or what role we play for a patient.

Does your objective or goal as a chiropractor differentiate you from other health care professionals (for example, physical therapists, LMTs, MDs, etc.)?

How much does pain care and pain treatment play into your ""why"" as a chiropractor? As a follow-up, is/should pain treatment be the goal of a chiropractor?

Hoping to see some different perspectives, and help us think about what makes chiropractors unique. Or, maybe some perspectives will say we are not unique and are replaceable/unnecessary.",What is your objective as a chiropractor? Is your practice based on pain? What is the goal of a chiropractor?
Chiropractic,[removed],Chiropractors are frauds
Chiropractic,,"What is this bump? I noticed it after doing dips at the gym 2 months ago. I’ve stretched, swam and continued to workout but it’s still there. It only hurts when I turn my arm a certain way. I asked a physical therapist and she said it felt like bone."
Chiropractic,,Do any Chiropractors know what is going on with the circled area in the pic? The best chiro in my city said he doesn't know but that it's definitely abnormal.
Chiropractic,,Do any Chiropractors know what is wrong with that circles area? The best chiro in my city doesn't know what that is but he said it's definitely not normal.
Chiropractic,After covid I recovered and did a HIIT cardio workout but noticed I could not move as well and I was very slow but I put it off on just having covid but since after covid I have had weak heavy feeling in legs and balance issues kind of like I said before covid my legs and back were fine and during covid I have very bad back pain burning any ideas?,So I caught covid the 27th of December and for 3 days I had terrible burning back pain I have had back issues in the past but they have not bothered me at all lately.
Chiropractic,"Hey all! 

If I make a short video demonstration for patients to follow along, and I’m checking in before and after to fine tune things, can I bill for the time spent having them exercise? Do I have to be in the room with them the whole time?

Example: 
10 minute ankle stability routine. Second Show patient, quick run though, check form, turn on video, go treat another patient, come back answer questions, fine tune process, bill for 10minutes of rehab.  Patient takes video home to follow along between visits. 

Thanks!",Hypothetical Rehab Billing Question
Chiropractic,"I went to the chiropractor about 16 hours ago for the first time and she did some adjustments, including my c2 I think it was. She said I have extremely tense muscles on my left side and she massaged them a lot. I have really bad aches all down the left side of my back now. Is it normal to be sore and achy? Thanks!",Is it normal to be very sore after a chiropractor??
Chiropractic,,Would seeing a Chiropractor be appropriate for wrist pain?
Chiropractic,,Need help with the wording for an answer to the question “How do you feel you would contribute to this honors program?” I know what I can contribute but I am applying for a VA Preceptorship for 9th trimester. If anyone’s good with essay writing PLEASE put down some sentences/phrases you’d think help
Chiropractic,"Says to use it in either edible or tincture form to for migraines as the muscle testing he did revealed I the smoke is bad for me, He is also telling me to imbibe it before I come in for adjustments so he can really ""pound into my neurology"". He also did this thing where he put a glove on and did something like an inter cranial adjustment with his fingers on the roof of my mouth. 

&amp;#x200B;

Anyone else practice in this manner?",Chiropractor suggesting cannabis.
Chiropractic,"I saw a chiropractor for the first time in my life this week for SI joint pain and piriformis pain on one side as it was recommended by my ortho (since the medication my ortho suggested wasn’t breastfeeding friendly).
Some deep tissue massage and back adjustment later, my legs hurt. They feel week and there’s slight pins and needles kinda sensation in my feet. Legs (knee and below) feel very weak and the calf muscle hurts.

Anyone felt this? Is this my body adjusting to the adjustment? It’s been 4 days. Please advise.",Legs hurt after back adjustment
Chiropractic,"Hello all, I really hope I am not intruding, from the looks of it this seems to be a sub focused on the scholastic end of the chiropractic community, but I was unsure of where to go, I understand if this needs to be removed. I am in desperate need of a pillow for those who sleep on their fronts. I am 33 and 6 foot 2 and 190lbs with severe sleep paralysis when sleeping on my back, and when I successfully do fall asleep on my back, I always end up on my stomach upon waking. While I will wake with less than notable pain, I do have a couple of incidences where my back will mistreat me for a day or two if slept on wrong. 

Is there a pillow that anyone could suggest that would provide the ample support needed for a stomach sleeper with my listed parameters? There are plenty of pillows out there but I am not the best when judging these types of products",In search of stomach-sleeper pillow
Chiropractic,[removed],Had my first Chiropractic appointment today!
Chiropractic,[removed],I just had my first Chiropractor appointment ever today
Chiropractic,"Hello! I’m getting sick of mixed nuts. What were your favorite snacks in Chiro school? Something to eat between classes to keep your energy up. 

Thanks!",Snacks?
Chiropractic,[removed],"Anyone currently work in a walk in, cash only office?"
Chiropractic,"I have already been to my local chiropractor. I am 6'7"" 21 years old former athlete but did not play any collegiate levels sports, just for fun freshman year so im assuming my knees are going to wither away eventually just being tall and a former athlete from wear and tear. I went because my knees felt painful about an 8/10 at its worst, it felt like my patellar tendon was bruised and very tender to the touch. This started a couple of months ago thought it was just from heavy squats as I had knee pain in my right knee on July 26th of 2021 and asked a family friend who did heavy weightlifting and is a registered dietitian as well as a director of kinesiology at a university so he knows how to do things the right way, with the correct form with low weight, etc... He said maybe jumpers knee so I did some rehab myself, iced, stretched, laid off heavy squats, and did low impact and low weight leg days. Fast forward to now, it is in both of my knees with the same symptoms, and sitting down elevating it is the only thing that helps but it begins to hurt when my bodyweight goes over my knees, and sometimes when I walk it would feel as though my oblique popliteal ligament is very weak and my knee may hyperextend but it never does. 

PLEASE let me know if i am being guided in the right direction or being given false information, i 100% trust this guy and wouldn't know any better. He recommended to not squat for 2-3 weeks, work on my deadlift form and to try to increase some glutes and hamstrings. He said my quads are really tight and although a compliment, said my quads are solid but may be the problem. I was recommended to use the couch stretch: hold onto a chair in front on you and put one leg on the edge  of  a seat or couch, kneel on to the knee of the leg that is on the couch, bring the foot forward, use the chair to push my neck and  chest up and shift forward to stretch out my quads as he said was REALLY tight. Is he giving good advice to work on deadlifting full ROM (no rack pulls) with no squats. I need to go back to him as he never gave me any alternatives to the no squatting, as leg press also sends pain to my knee. If you were in his shoes what would you do instead?",Extreme Knee Pain| Don't want to lose ANY leg muscle/strength due to these problems!!!
Chiropractic,"I will try to keep this short but i am a VERY tall (6'7"") former athlete 21 years old with some hip discomfort. I went to the chiropractor but i had other problems so we didnt really get to touch on my hip specifically since it isnt extreme. Basically it feels as though my hip pops out, obviously it doesnt dislocate because i would know that pain and it aint pretty from what i have heard/seen. It can do this ""popping out"" anytime i walk and its like i stumble and habve to grab something because its too painful to walk on that side of my leg and then it goes away or it dramtically ""pops back in.""  I do a standing twist keeping my leg and foot stationary and  twist my body until I feel that pop and it makes it feel better. Whenever i squat/deadlift/leg press even going heavy it NEVER  happens then JUST WHEN IM WALKING and step wrong or something. But i dont want my hip to dislocate or pop out squatting or using leg press with 200+ lbs  on it that would injure me badly. I will start to use my thera gun to try and see if loosening the muscles would help because i have no idea whats going on, whether its pelvic tilt or something that is weak. I started doing adductor and abductor machines at my gym to stretch and try to build some of those muscles but those arent helping either. Butterfly stretch only helps so much but i am wondering about any type of stretching technique that could be used to strengthen/rehabilitate said problem. I am wondering what your guy's thoughts on it.",Hip Discomfort/ Realigned but still aching
Chiropractic,,3 Pain Relief Devices Worth Buying in 2021
Chiropractic,"I made this post a few weeks ago: https://www.reddit.com/r/AskDocs/comments/rk5kxb/neck_pain_after_chiropractor/?utm_source=share&amp;utm_medium=ios_app&amp;utm_name=iossmf.

I never had issues with neck pain previously, but when I started going to the chiropractor, this pain began. Now, after not going to the chiropractor for 3 weeks, the pain is mostly gone.

My question is whether this pain may have been part of a recovery process, and that the adjustments were actually helping. Please let me know if this is possible.",Neck Pain Caused By Chiropractor
Chiropractic,"https://www.bmj.com/content/374/bmj.n1511

“Although they may be effective overall or in certain subgroups, no strong, high quality evidence base shows that many commonly performed elective orthopaedic procedures are more effective than non-operative alternatives. Despite the lack of strong evidence, some of these procedures are still recommended by national guidelines in certain situations.”

Yes, we can do better, but so can plenty of other health practitioners.",Something to remember when thinking about evidence based issues in chiropractic….
