subreddit,selftext,title
Chiropractic,"This is inspired by the post the other day. It is a class I never took, but I have looked up some things online about it and have applied tape to myself to try it.

As an intervention how effective is it? In my mind it seems to be something temporary that doesn't create real change, but I am openly uninformed. Back in school (a decade ago) there was some theory about neurological affects from the tape and proprioception, but again that was theory.

Is there much technique gained in taking official classes, or is finding info and guides online sufficient? Would you have patients look up online how to apply it themselves? Again, I may just be uninformed but generally the tape is easy to apply and I was able to find different patterns for different conditions online, complete with guides and videos.

If tape is effective and produces lasting results, what brands do you prefer? Are there brands or groups to avoid?",What are your thoughts on Kinesiotape?
Chiropractic,,deliciously chiro
Chiropractic,"Associate Chiropractors, what do you look for when you are considering an employment opportunity? (Compensation, benefits, company culture, job duties, work setting/environment, etc.) What does ultimate job satisfaction look like to you? (If you could have everything that you want in a job position, what would that be?)",Associate Chiropractors
Chiropractic,"Hi  


I started NUCCA two weeks ago due to neck pain and tinnitus, it did help with my neck but my TMJ is very painful.  


Can the adjustment of your Atlas and neck, affect the TMJ? If the TMJ is going back to the position it should, it is normal to have so much pain during few weeks?   


Thank you.",NUCCA and extreme TMJ flair up and pain
Chiropractic,"My chiropractor had me do this for a while to correct my posture. I can't help but feel it's the type of method we will find out is really bad in 50 years.   


The therapy was a lot like this except both cables were weighted. The first few times they wouldn't remind me to hold on to the cable when they released and it would hurt my neck. It always left me wondering if this was actually good for me.  
[https://imgur.com/a/zDbhUVw](https://imgur.com/a/zDbhUVw)",Is this dangerous?
Chiropractic,"When looking for a Chiro, what are the certifications that you think are most valuable? I know the FAQ kind of touches on this - it mentions a couple of different technique specific certification, as well as looking for FTCA members. But in regards to technique specific, I think that's a rabbit hole and ""good"" technique is probably viewed more subjectively/depends on what you're looking for etc. With FTCA, while it's probably a good sign of their approach, it's just a membership and doesn't require anything concrete. 

CCSP/DACBSP are the only ones I've come across that seem to be well regarded and imply a good quality of overall care. Are there any others you guys think are notable or worth looking for?",Certifications to look for in a provider
Chiropractic,"Hello!  3 years ago I went to a chiropractor complaining of a tight neck.  He asked me to get x rays which i did and discovered my neck needed the curve fixed and recommended to see him 2-3 days a week for 9 months and use the denneroll each night.  Im a piano player who's had back and neck issues from poor posture so it wasn't a surprise i had issues.  After the first adjustment my neck got stiff as a robot, he claimed this was normal?  

anyway luckily it did go away after a few days.  I proceeded to see him for another two weeks and started to notice greater rotation in my neck. as well when i sat at the piano i had zero back issues all of a sudden and it felt great.  I also found myself wanting to sit taller, and not lean over the table when eating my dinner.  All good things i imagine.

However, 3 weeks later after treatments I got a bad cold and started to get a clicking sound when talking or burping near my right ear/jaw.  I called the chiropractor and he said to contact an ENT.  So i went to 3 Ent's and they could not find the problem.  I also went to two dentists, and  2 other chiropractors for opinions.  Nobody has been able to figure it out.  The other two chiropractors do not think its related to chiropractic adjustments.

Long story short... im curious what this community thinks ... could this weird clicking sound I get when talking be a result of getting my neck adjusted?  Is it possible the adjustments put something else out of line?  Strange thing is when ever i get a cold now, the clicking subsides for the duration of the cold.  

I'd hate to think the chiropractor i saw messed me up for life with this annoying issue i've been forced to accept and live with.  Luckily it is not painful, but as a musician and teacher, its unbelievably annoying and depressing as every note i Sing or word I say usual ends with this internal clicking sound  near my ear.  I've also tried the Neti pot for weeks and prescription sinus spray to not avail. 

Would appreciate any feedback!",Potential adverse reaction question
Chiropractic,,Appreciation post: my chiro made this work of art.
Chiropractic,"When my wife and I started tackling our 200k in student loan debt it felt like we were completely alone.

We were the idiots with high student loan debt. The fact that we hid it probably slowed us down years, in my estimation, because it stopped us from going all out pretending it was in a dark corner collecting dust somewhere. It just looked like everyone else had it together, you know?

Well, I've since learned that ain't true. There are plenty of us out there. And, heck, its also more fun to slay the beast together and out in the open.

Roll call! Who here got six figgy student loan debt? And what's the game plan?",Holllaaaa.... Who here got six figure debt???
Chiropractic,"I’m curious what other offices have implemented as Late Cancellation/No Show policies? We need to make some changes this year, especially in this regard. 

Do you charge a fee? If so, do you keep CC info on file? 

Do you use an online scheduling feature? 

Can your patients change/schedule appointments by text? 

When we first opened we both had full time jobs so we implemented a google voice number that forwarded to our cells so we could communicate via call and text even if the office wasn’t open. Most patients are pretty good about it but we have a lot of abusers (last minute rescheduling, canceling, late hour and weekend texts). I’m thinking it may be time to eliminate the text feature but I have hesitations. 

Thoughts? Opinions? SOS.",Late Cancellation/No Show Policies
Chiropractic,[removed],Just here to say hello
Chiropractic,[removed],Anyone else here struggling with 100k+ in Student Loan debt? Or am I alone?
Chiropractic,"Hi all! I had my first baby on 1/1 via an emergency c-section. Funny enough, I went into labor after getting an adjustment and acupuncture done to induce labor since I was almost 42 weeks. However, now that I’m 18 days postpartum I’m in desperate need of an adjustment. I’m having chronic headaches because of the back and neck pain. The problem is I’m not entirely healed yet from the surgery. I have my follow-up OB appointment in two weeks. Is it possible to have my back adjusted not laying down? I’ve gone to the chiropractor for many years now, but only ever had my back adjusted while laying down on my stomach. I can manage laying on my back, so I could have my neck adjusted, but I can’t lay on my stomach yet. Looking for any sort of feedback because I’m dying to feel some sort of relief. Thank you!!",Adjustments After C-Section
Chiropractic,"I started getting very bad sinus pain about four-five months ago, and thought I had a sinus infection. I got very dizzy as well to the point where it affected my eyesight. It almost feels like when you get heat exhaustion and you don’t see as well because you’re dizzy. Ive been to an optometrist and to an ophthalmologist twice and they both told me there’s nothing wrong with my eyesight or eye structure. I finally went to a chiro and she told me I have straight neck. She gave me the towel roll exercise to do where you lay down with a towel under your neck and right now the sinus pain is almost completely gone, but the dizziness is still here. It’s especially obvious when I look at electronic screens. How do I stop this dizziness? I can’t help but worry about my eyesight even though the doctors told me there’s nothing wrong with it. Ive just been quite desperate in getting relief from the dizziness. It does appear to get better when I’m outside, but unfortunately I work full time and am a full time student. It’s all remote so I’m in front of a computer all day. Does anyone have any exercises, physical therapy, or stretches to suggest?",Four months of dizziness now with straight neck
Chiropractic,Is there any websites or group I can reach out to find it out? Thank you.,How can I find an atlas orthogonal chiro in China or Hong Kong?
Chiropractic,"I’m curious if anyone here is taking this lab class next month. I am taking it as part of the sports rehab masters and I’m going to be flying into town for it. Looking to see if I could possibly crash on someone’s couch or something, esp if it’s anyone that is also taking the class. TIA!",Logan University Sports Emergancy Care Lab
Chiropractic,"hey Iam 18 and weight 62 kg, Iam about to start a job as a baggage handler the average bag is about 35 kg with some accessions even 45. Do you think this job will give me any long term back problems, I've been thinking a lot about it lately. Thank you",Baggage handler
Chiropractic,"Hi Fellow redditor. To get it straight the left part of my body is not the same as my right now. You'll probably say everyone has differences between both sides but the problem is that mine are pretty significant. 

First of all, the most visible thing is my muscle dysbalance ; every muscle of my left side is minimum 1.5cm(0.6 inches) less bigger (in circumference) than on my right side. The problem is not how big my muscle are but how they feel. On the left side their loose and they aren't tensing up while working out. I started the gym 1 year ago and the muscle growth on my left side is really slowing me down. It feels like my muscle on the left side aren't used at their full potential. 

Other than that I grow more hair on my right side than on my left side. It starts from my ""beard"" to my feets. 

I also can't flex my muscles on my left side. 

I checked it doesn't feel like I have a scoliosis. I really feel like the sensations are different on the two parts of my body, could it come from the Atlas? 

Sorry for my english and the lack of informations given.",Body dysbalance
Chiropractic,,Is this product worth buying for my office chair? I'm somewhat suspicious because it's lacking reviews.
Chiropractic,"This is my first time using a chiropractor. I recently injured my lower back and I tried to do as much research on my local chiropractors and went with a Gonstead chiropractor in South Florida. 

First visit was pretty standard, he consulted me and did a physical and history along with getting my Xrays while standing up. He took it multiple times (\~4) because he was a perfectionist. I was told to schedule for a 2nd visit because the DC doesn't do same day diagnosis and was charged $300 ($75 for consultation and $225 for the xray). 

I scheduled for the next morning and came in and he diagnosed what I assumed was happening to me, L5 herniated disc (although I've been told to truly diagnose herniated disc requires an MRI scan), and it matches my symptoms of not able to bend forward or back past a certain point without feeling a sharp pain. He then tells me ""great news"" how this is a mechanical problem more so than a medical one and he is confident to take on my case. He initially told me he wanted to see me for **six months** ($2800) and then dropped it down to 2 months ($990). When I asked the front desk lady if I could just do 1 month to try and see they told me the DC won't take my case unless it is 2 months or more because he requires a certain amount of time with me to get me healed. It just seems to be a lot of red flags but is this expected? I understand each DC has a treatment plan but locking me in for 2 months or more after charging me $300 left a sour taste in my mouth. 

&amp;#x200B;

Some notes:

\- His clinic made all new clients watch these old looking 80s-90s video on chiropractic. There was a 20-minute-long video of a speaker talking to viewers in a futuristic room with an AI voice lady about the benefits of chiropractic medicine. It was really cheesy. . .

\- He loves frogs. . .",Is my chiropractor scamming me?
Chiropractic,"Hi! I'm torn between several paths. I worked in fitness prior to the pandemic in the form of personal training, group exercise, and running a gym for a company. My current job is at a Physical Therapy and Chiropractic clinic which I went for because I was applying to Occupational Therapy school and I'm still waiting to hearing back on. But I've realized I really like Chiropractic. I'm looking at schools and could start at Logan in May. 

However, I've read a lot on this sub and many people talk about the debt and default rates. Which is completely different from the statistics Chiro schools have sent me. I've seen a lot of people here push for DO, PA, and NP over DC. I've looked into DO, but I know that's extremely competitive to get in. But I'd be much more networked and related to medical cannabis which I'm currently in a Masters program for. My bachelors is in Exercise Science with a 3.6 GPA, and I'll finish my Medical Cannabis Masters next year with hopefully a 4.0. I'd have to take a couple chemistry and physics courses as well as the MCAT and get some hours somewhere to give D.O. a shot. So I'm really on the fence on where to invest my time and money. 

Any advice on schools or careers is appreciated.",DC or DO or something else?
Chiropractic,"I’m 19f, 5ft10 and 120 pounds. In no way is my pain debilitating enough that I can’t crouch down or walk down the stairs

I’m just unsure whether chiropractic treatment would be too much for something not as severe as the elderly/sport injuries? I have minor yet constant dull pain in my upper back and shoulders. It’s like I’m constantly trying to stretch to hear it pop and relieve it, but it never does. Especially when I’m trying to sleep

I don’t exercise much as I work from home and I’m aware I’m underweight. 

Would I be eligible for chiropractor treatment or would it be overkill?",Going to chiropractor for posture and minor pain?
Chiropractic,"There's a chiropractic clinic for foreigners (locals can go to but it was clearly made to cater to English speaking foreigners) that I go to occasionally. I never go for chiropractic care (and I don't ever intend to) but they have other things such as rehabilitation exercise (rather than physiotherapy because you can't just go see a physiotherapist in this country. It's hard to get real physiotherapy here and you need private insurance for it or else you'll burn through your entire monthly paycheck in 2 weeks). 

I sometimes see the regular massage therapists at the chiropractic clinic but then there is the TMS massage therapist that is different. They said the TMS massage therapist can work on active injuries and regular massage therapists cannot. 

When I google this, I can only really find their clinic + a chiropractic journal from 1990 or something discussing TMS, so I know they didn't make it up but it's weird that there's barely any info on it.

Bonus question: If you know about TMS, do you think it's helpful for piriformis syndrome?",Have you ever heard of Therapeutic Muscle Stretching (TMS)?
Chiropractic,"As the title says, have any of you chiros out there worked out of a massage clinic? I'm moving to a new city and have an opportunity to get a room with a popular massage chain. I'm wondering what your experiences/ views are on the subject. Thanks in advance.",Working out of a massage clinic?
Chiropractic,"34m, no serious injuries and no strenuous work. I've had a stiff, sore, cracking neck for over a year! I woke up one day and it never went away. I'm not looking for a diagnosis rather how to proceed with health care so that I can get some relief. I've gone for cat scans and they revealed some arthritis in my neck and spine. I seen a chiro for 4 months and received minimal relief. Seen a physio therapist for 2 months (3x a wk) with no relief at all. I'm waiting on an mri and have recently been prescribed pregabalin. Again no relief. With my head being in a forward positiong I feel the most discomfort so mornings are the worst. Lifting my head up is uncomfortable. Have tried different pillows and none at all. I don't get good sleep and sleeping on my stomach has been impossible (favorite position). My upper back has also been cracking when I pull my shoulders back. What can I do? I need some relief. Should I continue to see a chiro or physical therapist? Plz ask any questions. TIA",Need help with chronic neck problem
Chiropractic,"I'm reading in the r/concussion subreddit that people say NUCCA significantly fixed their issue.

I've had severe concussion symptoms since my concussion in 2019, I think it's all my neck.

I went to a chiropractor once, and she stuck a ""metal adjustor tool"" to the side of my neck and it caused a huge amount of damage that hasn't recovered.(muscle has chronic huge knot/spasm issue)

I tried looking here: [https://nucca.org/directory/#](https://nucca.org/directory/#) but the NUCCA chiropractor here, asks for $1500 for the first two appointments apparently, kind of seems like too much.

Are there any other chiropractors you would recommend?",Is there a directory to find a qualified chiropractor on concussion/whiplash?
Chiropractic,"I had a concussion/whiplash last year, I contacted a lawyer and was recommended to go to chiro, at first I was hesitant but was reassured ill feel better than I ever have been. I've been a contractor my whole life (since 16), currently in my mid 30s, told them I'm always in mild pain even before the accident but I've always been able to work, its just part of the job. At first chiro did help, it releaved the bad headaches and spine pain. I kept going for months as recommended. After about 4 months I slipped a disk for the first time at work doing things I've always done, honestly one of the worse pains I've ever experienced in my life, way worse than pain from the crash, Got it corrected with adjustment and massages but a month later, just today, I fucked up my lower back trying to pour a bag of sand, same motion I've always done, started screaming and froze up again, my trade requires me to lift/carry/pour 50+ pounds daily. I'm not questioning that chiro works, cause I know it did to fix those issues, but I'm worried that due to how my body had formed itself over the years to adapt to what it needed to do daily, that correcting my spine may have made things worse. I'm not blaming the lawyer or any medical professional but the reality is none of them do what I've done daily  my entire life,  and I'm in more pain now and feeling weaker than I was before the crash. Im legit worried about my future, I've never had my back cracked my entire life until I started chiro. Basically asking all professionals if chiro COULD  have made things worse for me personally, again not blaming anyone, I know I'm part of a small percentage of people who were willing to sacrifice physical health and well being for a paycheck with no benifits.. Thanks.",Need a professional answer please!
Chiropractic,"Hello all. I (21F) really enjoy sleeping on my stomach and sometimes my side, but I notice a lot of lower back pain and soreness when I move off of my stomach in the middle of the night. My back will also still be sore when I wake up. Sometimes, I find it hard to sleep in positions other than the ones I just described, but I know I am probably doing something negative to my back and spine. 

My final question is, how bad is it? Am I doing horrible damage to my lower back? How badly would this develop with time and age?",What am I doing to my back?
Chiropractic,,22 and I realized I have knocked knee is it bad? Can I reverse it by doing exercises? Or would I have to do surgery.
Chiropractic,"Hello everyone, 

I am 21 and have severe low back pain. I will randomly have small aches sometimes, but normally once a year, my back “clicks” and I’m out for a week. 

It just happened again while longboarding. Started with a small click that wasn’t terrible then clicked again that night and now it’s awful. I went to the chiropractor and it is a Schmorl’s node and bulge’d disc I believe. 

It went randomly go from fine to tensing up so bad that I can’t walk or breathe for a few seconds then back to normal.

I have been active forever and weightlifted forever.

The x-rays show signs of early degeneration.

Has anyone experienced this and came back to improve it?",Severe low back pain at 21yo (Schmorl’s node)
Chiropractic,"I am entertaining a possible associate position in Scotland.

I am interested to hear if anyone has moved from the US to the UK. Also how the national testing of UK compares to Boards 1-4 as I was informed I would be required to essentially recertify. 

Any advise or info would be appreciated.",Moving overseas USA to UK
Chiropractic,"So arguably The Joint is the largest and most successful single entity in chiropractic. Currently valued at about 791M, I'm pretty sure it's worth more than all of the chiropractic colleges and professional associations. When I was in outpatient clinic, my staff doctor had bought and opened a franchise location. At the time I thought it was dumb, that they weren't charging enough for care, and why pay the franchise fee at all, just open your own practice. 

I get a lot of patients from there. People who are wanting a more focused experience and better quality care. Having never been there myself, I wonder what the experience is like for patients and patients as customers. I'm imagining it's efficient and a good value, if somewhat inconsistent depending on which chiropractor they end up seeing. 

I'm really just bullish on the company because I believe in chiropractic as a product. And I feel like long after I've closed my doors and stopped practicing, their locations will keep working and probably open new ones. So why not continue to benefit in some way by being an investor? 

The stock is now arguably overvalued on fundamentals but at least has pulled back with the rest of the market and now sits firmly below its 200 day moving average. Not that it can't go a lot lower, but, you gotta start somewhere... 

I appreciate any thoughts and discussion, thanks 🙏

https://preview.redd.it/691x01jbpvb81.png?width=3456&amp;format=png&amp;auto=webp&amp;s=1a5e6583292a2828a0dbb33ae06fbf5e8ea11e22","The Joint, $JYNT, as an investment"
Chiropractic,,sprained my ankle thru basketball 4x this year now my ankles move like this is it normal? my other one don't do this? i'm 17 btw 5'8 155 lbs if that helps i played thru a sprain once
Chiropractic,"Whenever I look up and put my shoulders forward, C1 pops, sometimes a click, sometimes a rather drastic feeling pop. I’ve been having some back problems for some time but why does the back of my head click?",C1 Clicking/Popping
Chiropractic,,are chiropractors able to do anything for scoliosis?
Chiropractic,,Seems like the right place for this
Chiropractic,I'm 2 weeks into practice and I feel like I am not good enough. I feel like my adjustments aren't successful. Patients are reporting feeling better but my confidence just isn't very high. How do I push through this? I have anxiety of not being able to help people and people not wanting to come see me.,"New grad, feeling not good enough"
Chiropractic,"Granted I’ve only had my ad out for a couple of months and have only posted it on two school classified sites, but it surprises me that I’ve only received one applicant. My colleague in town has been recruiting for several months. I just received in the mail a letter from another colleague in my former town asking for help getting the word out and sending candidates their way after close to a year with no success. We all live in beautiful places, have modern and polished web presence, and offer good pay and benefits. Could just be anecdotal, but it has me wondering where all the students are going after graduation. 

What are you looking for in a job listing?",New grads: where are you all going?
Chiropractic,"Hey guys! 
I am currently a student in Texas and was wondering if anyone is interested in 100 dollars off discount code for a chirolux table of their choice? A group of people at my campus is ordering together and they have agreed to give us a group rate 😁 

Also, 
If you already own a chirolux table, do you think the classic or plus is better? I think the plus might be to narrow but i am not sure. Thank you! 🤍🤠",ChiroLux Chiropractic Table
Chiropractic,,"Is u/copeyyy affiliated with www.forwardthinkingchiro.com? My post deletion feels scammy. Like he/she is trying to drive business, and I don't appreciate it."
