subreddit,selftext,title
Chiropractic,"Late 20s female student with interscapular pain and low back pain. Described as constant aching and stiffness. 4/10 average, 10/10 at its worst. Insidious onset. Occasional pain in arms and hips described as “tightness.” Sitting and lifting anything exacerbates pain. Muscle relaxers briefly helped. Urgent care ruled out kidney pathology. Denies headaches. History of anorexia.

Sounds pretty typical until I start the physical exam.

No positive ortho exams but the exams caused excruciating pain in areas not being tested. For example, SLR produced pain in the traps that caused her to writhe in pain, cervical compression caused pain in R low back. Light palpation around rhomboids/traps was almost unbearable, same with light palpation around the low back and hips. Muscle tests all normal. Nerve tension tests all normal. ROM pretty normal for the most part.

I tried (extremely) light ART and could barely get anything done without her being in agony. To the point where she stated she was getting lightheaded. 

Had her do simple exercises such as Cat/Cow, No Money, Scaption raise…all illicit terrible pain that caused her to have to take a break and catch her breath.

So yeah, kind of stumped on this one. Wondering if I should be looking into any auto-immune or dietary disorders? Or is this something super simple that I’m dumb for not knowing. Thanks in advance.",Got a case that has me stumped. Any ideas?
Chiropractic,"I have lost the curve in my neck. Last time I had an MRI it said I may have a slight bulge in C5-C6.
 
I got the MRI bc when I would relax, something would shift in my neck and then it would feel like my legs were in hot water, like I’d lose feeling in them. I went off of a certain med that was causing akathesia, which stopped the episodes except when I take an edible for pain and I’m over relaxed. 

Every now and then my feet will involuntarily kick out if I’m laying a certain way or reading (looking down, I already have a major neck hump).

I plan to get an update MRI because I have less feeling in my left hand and arm then I do my right, and tingling in the last two fingers since tweaking my neck while driving. What I want to know is, even with a dowagers hump and if I do wind up having a bulging disc, is it safe to have my neck adjusted despite my history? Or should I avoid it. Part of me worries I won’t be able to avoid bracing for it and possibly make everything worse.",Can you get neck adjusted with a bulging disc?
Chiropractic,"This question is for chiros that use a traction table in their office;

When it comes to decompression/flexion, what are the top diagnoses you use it for?  What patients do you know not to?

I work in a chiropractic office that does not offer decompression/traction.  We have a flexion distraction table but no table that slides or a machine that uses cables to pull a patients neck/low back.   I'm curious, based on your experience, what are the best patients suited for decompression?  And what patients are a red flag against using it?

For example, I know not to use flexion on a hot disc.  I've also heard to never use traction/decompression on an annular fissure?  When it comes to decompression/flexion, what are the top diagnoses you use it for?  What patients do you know not to?",When To Use Decompression/Traction Table
Chiropractic,"I was getting some sharp lower back pain from weightlifting and decided to visit a chiropractor recently. From their diagnoses, my disc is hitting my nerve causing me to have pain. Not sure if that is a herniated disc, or something of that nature (if anyone can help me understand more that’d be lovely). I really get sharp pains when I bend over or squat down. 

All they proceeded to do was “adjust”/crack my back and neck. They only do my neck because it doesn’t bend fully one way. After the first session, my back felt worse.

I’m supposed to have multiple session in a short time period, and I’m sure all of it’s going to be is the same two cracks in my back (the one where you lean towards them and one knee is out and they push down on your back) and two in my neck. 

Is this going to bring relief or am I wasting time?",Started seeing a chiropractor..
Chiropractic,,Can a neck hernia be cured with chiropractic adjustments?
Chiropractic,"Unsure of the difference between Cranials vs Craniosacral therapy and if there's a lot of overlap there.

Any help i appreciated thank you!",[Recommendation] Looking for a Cranials seminar
Chiropractic,"Hello,

As the title reads. My lower back feels like it is compressed. Felt this today while attempting deadlifts. I tried to do decompressions at home (hanging from bed with pillow underneath as well as hanging from a pull up bar) but it hasn’t done the trick.

Is this something a chiropractor could help me with?",Lower back/Lumbar feels compressed
Chiropractic,,"Broken coccyx about 30 years ago. Simple story, landed on a hard floor in my bum when I was about 11 years old, was in a lot of pain but never treated, just had a spinal x-ray &amp; the tailbone were smashed up underneath. Anyway, anyone seen anything like this before? Anyone heard of it being treated?"
Chiropractic,"I was late to my appointment, and was extremely apologetic but he didn’t care. He had this weird, cold look in his eyes and I knew I should’ve just left, but I was too naive. 
He did the one where you lay on your side and they twist you. He got all the cracks out and then gave it a final push that put me beyond my range of motion. 
I just got an MRI, have yet to see the diagnosis. I know I have to get treatment, and I have it all figured out as to where I’m gonna go. I’m just worried that he did something irreparable to my facet joints. Is this likely, or do you think it would just be disc(s)?",Chiropractor horror story
Chiropractic,"Im 15 and have realised after some years of strength training that my deadlift is quite good for my age. My pr is 240 kg. I want to reach about 270 kg within the next months. But I dont have a coach. Could it be harmful later on in life? I dont wanna destroy my back in my teens. Ive been reading studies that say my body isnt fully developed, therefore I shouldnt go that heavy. Could some kind of expert please respond.",Deadlifting at 15
Chiropractic,"Hi everyone, just wondering what is the biggest challenge that people here find when running their chiropractic business?",Challenges running chiropractic business?
Chiropractic,"I’m not sure if there are many animal chiropractors on here however if so, what has been your experience adjusting animals? Which animals were the most profitable or reoccurring(cats, dogs, horse, etc.)? How does animal chiro compare to human chiro in your opinion? How were the owners? Thank you in advance!",Animal chiropractics?
Chiropractic,Thoughts? How does straightening the spine work with this method? Heard lots of chiropractors say chiros that use x rays to show postural improvements are scammers but this seems like a legit method…,Chiropractic Biophysics
Chiropractic,"You can sh*t on traditional chiropractors all you want but if you have a mask sign on the door to your clinic or support mandatory vaccines you’ve sold yourself to the WHO and don’t deserve the title, chiropractic. Sorry.",Reality check
Chiropractic,I genuinely enjoy both professions and Currently am a senior in undergrad majoring in kines. Planning on taking a gap year I’ve heard they make similar amounts but I’ve been hearing chiropractor school isn’t worth it and wondering does anyone have any opinions on either. Thanks in advance.,Help PT or chiropractor school?
Chiropractic,"I'm getting adjusted again, although the first time I didn't show up regularly, and that was ten years ago. My biggest issue is my neck, which has some reverse curvature and deterioration of the disks. I've had two adjustments, thus far. Right after the adjustment, I'm good. After the last adjustment, my TMJ tension went down, and my jaw aligned slightly better (only I could probably tell the difference). My core felt better as well. But the days following, my anxiety is flaring up and I'm feeling dizzy and fatigued and will have nerve overload. How long until this phase ends?","Just getting back into chiropractic, anxiety flaring up??"
Chiropractic,"A chiro did a spine thermograph 5 times, did the atlas neck adjustment, then measured the heat of my spine about 5 more times to show the difference in ‘neurology’??? It seemed a bit out there tbh. 

Is there any science here? I felt like he could pick and choose the best readings to match the story of improvement but I could see I had some less wonky readings before and also some more wonky ones after, he very swiftly clicked away when I was trying to see them all on the PC. Not sure!",Thermography before and after adjustment?
Chiropractic,"I went to a chiropractor last week about my back and cremaster muscle pain.

He made some tests like pushing my leg and asking me to resist then made the same thing when I hold my head up and side.

He said that it is probably due to my neck and he made some adjustments very rapidly. Kind of breaking neck in movies but it didnt heart.

After leaving the session I feel like I drank a bit and I feel sore when I turn my head right. It comes and goes but it was not there before the session.

He looks he has many education about physiotherapy and neurology but I am very suspicious and feel bad about treatment.

He didnt ask my consent and I wonder if he made any permanent damage to my neck.",Stiffness on my neck after Neck adjustment
Chiropractic,"So basically the past 3 days I’ve been smoking weed, doing adderall, and playing Fortnite for 10+ hours (I really wish I was joking.)     
      
I really am not used to having this much free time and sitting in the same position for several hours has taken its toll. I get random sharp pains on my neck and no matter how much I crack it, I can always get it to make noise. There is always some sort of pain but sometimes I randomly get sharp pains. Besides the obvious “move around, find other things to do with your time” what do I do? Is there a specific condition I seem to be describing? How can I attenuate it?","Neck is super messed up, what can I do to ameliorate it"
Chiropractic,,HOW CRAZY!?!?!?!?!
Chiropractic,[removed],Man pleads guilty to murder of Chiropractor
Chiropractic,"Late last year while my chiro took x-rays, he informed me that I have an extra vertebra, and not just that, he said there was some sort of deformity involved, he put something like ""it doesn't know if it wants to be a vertebrae or part of your sacrum"" or something to this effect. I was shocked to find this out as I have never had any lower back pain, and I have always been active for as long i can remember with no issues. 

That being said I have always had an issue with flexibility, especially when touching my toes. No matter how good my form is or how long I work on it, it just doesn't work. My seated toe touch is also the same. It's almost as if my body just wasn't made to do it. Should I give up and stop trying, or is the problem something unrelated?",Is touching my toes anatomically impossible for me? (Read below)
Chiropractic,"Long story short: My PT coworker adjusted my neck while I was sitting in a chair during work for fun. Me and the guy get along pretty great but I admit he went too far with this one. I heard a lot of cracking noises, and felt fine pretty much fine  for the whole day. This happened Friday last week. The next day I’m driving and felt vertigo like symptoms while at a round about.  Immediately get concerned. 

It’s now been a week and I’m getting worried from hearing all these stories about neck adjustments causing permanent damage or vertigo symptoms. Call me crazy, ever since my neck has been adjusted, I’ve had weird visual sensations. For example, I would focus on something, then my eyes would unfocus and readjust for a split second randomly throughout the day. 

I spoke to the actual chiropractor at my job, and he said to never do any neck adjustments and especially by a physical therapist who is not licensed to do adjustments.  He tried to avoid adjusting necks actually.

So, everyone here, should I be concerned? I’m scheduled for an MRI tomorrow just to check if everything is okay.

Also, I’m about to end my friendship with this coworker of mine.","Idiot physical therapy coworker adjusted my neck, now feeling pretty weird"
Chiropractic,I was recommended to order one of these in order to work on speed. I was not however explained how exactly to go about it. Is there any videos or resources. Thanks,Nerf football
Chiropractic,"Was curious on the idea of an inversion table for home use, the kind that you lay on and hang upside down from your ankles at different angles/degrees. What might be one's opinion on it being useful or not useful for decompression? I am not a chiropractor or doctor fyi. 

What would be better if a inversion table is not useful?",Inversion Tables?
Chiropractic,"It doesn’t hurt, but every time I take a step it pops. I’m only 15 so anyone know what’s wrong with my back?",Tailbone/Sacrum cracks or pops when I walk.
Chiropractic,,Spine Adjustment &amp; Chiropractic Care Denton
Chiropractic,[removed],Is this normal Chiropractic behaviour
Chiropractic,"Hello 30F and I am not looking for a diagnosis. Havehad one adjustment since the pictures but I didn't get much info out of my chiropractor. Any specific stretches you'd recommend or light exercises I can do until things are, literally, straightened out? [images here](https://imgur.com/a/kOz50Ir) Any recommendations or insight from similar situations will be appreciated.",what would you recommend
Chiropractic,"A few months ago (March, today is June) I (21F) saw a chiropractor for the first time. I was having bad back pain, pain around my shoulder blades, shoulder, and neck pain. I also have a few other conditions (fibromyalgia, POTS, some mental illnesses) so just keep that in mind as you read. he took x-rays and diagnosed me with scoliosis and said my neck curves the wrong way. After the first adjustment I felt great until the soreness hit. I know it’s expected to have soreness the first 24-48 hours but my back never started feeling better. I ended up not going back because I was afraid something went wrong and going back would make it worse. I have horrible anxiety surrounding healthcare providers so I’ve basically just been dodging his calls but it’s gotten to the point where my lower back hurts so bad sometimes I can barely walk. I’ve been doing stretches but nothing seems to help even gabapentin and cyclobenzaprine. Problem is, I no longer have insurance and can’t afford to pay the bill without tapping into credit cards. My question is, is it adamant that I go back as soon as possible/am I causing damage by not returning? I was supposed to do 24 treatments starting with 3x a week for 2 weeks, then 2x a week for 4 weeks, then once a week. Kind of panicking and anxious but it also could just be my fibromyalgia flaring up. 

TLDR: I saw the chiro for one adjustment 3 months ago and didn’t go back. Now my back hurts so bad I can’t walk. Am I causing damage by not going back?",Should I go back to the chiropractor?
Chiropractic,I just had my first patient w/ lupus with bilateral swan-neck hand deformity. I have never seen the hand signs until now. Would you adjust a patients wrist/finger joints in this scenario?,Adjusting patient with lupus hand deformity
Chiropractic,"I got my results back and I wanted to know if this is something a chiropractor can help me with or should I go to physical therapy instead? It would be so much appreciated if something can break it down for me. Thank you! 


*   Small central disc protrusions at the C4-C6 levels minimally compressing the thecal sac.
*   Disc bulge and mild facet joint arthrosis of the C6-C7 level.",Can Chiro help me with any of the results from my MRI?
Chiropractic,Anybody deal with atlas problems? How would I know if my atlas is misaligned? Have all of the symptoms along with constant grinding/sand like sounds coming from c1-c2… Is it something I could feel by my self or does a chiropractor need to examine?,Atlas/ Neck
Chiropractic,,working with LMTs
Chiropractic,"Does anyone concealed carry or have one on the premise somewhere? When patients come in who carry, do you have a place in the adjusting room that they feel comfortable with while you work on them?",Firearms in the practice
Chiropractic,"Does anyone concealed carry or have one on the premise somewhere? When patients come in who carry, do you have a place in the adjusting room that they feel comfortable with while you work on them?",Firearms in the practice.
Chiropractic,,Chiropractor after Accident in Florida
Chiropractic,,Affordable Chiropractor &amp; Neck Pain Relief Center Denton
Chiropractic,"Long story short, went to chiro and ortho is now stating that my SI joint is now inflamed directly from the chiro manipulation. Xrays revealed some congenital deformity on low back and ortho advices that chiro should have known better than to adjust my back. Chiro did somewhat confirm that he should have not adjusted me until further xrays of lumbar region were taken but of course denied wrong doing. I will have at least 4 weeks of PT, urgent care visit, and ortho visits. What do I do?","Chiro hurt me, now what"
Chiropractic,Is the registration fee a $500 fee through paypal? It just seems weird that it uses paypal unlike other undergraduate university programs. Thanks in advance!,Question for those who get accepted into CMCC recently
Chiropractic,"Do you come here to hear the opinions of docs in practice? Looking for tidbits on how to practice? Checking out the discourse in the comment sections? Do you come here looking for some positivity and ""light at the end of the tunnel"" between classes and studying?

When you visit this forum, what are the posts that draw you in or keep you coming back?","Hey students, including those who lurk, what brings you to this board? What would you like to see?"
Chiropractic,"Hi everyone, I am posting this as I need some advice on what I should do. So I applied to chiro school and physio school and was fortunate to get offers at both in Ontario! However, I am struggling to decide what one would be the best choice for me. 

I was leaning toward physio school since there is more stability (hospital jobs) plus it fewer years in school (2 years). However, working in the hospital and seeing what the physio do makes me rethink this stability fact. To be honest, I think what they do in the hospital (getting people up and walking) is relatively boring and I am not sure if I would see myself doing that for the rest of my life. I know I could always work in a clinic but I heard the pay is significantly less (including benefits and stuff) and it takes away that stability aspect. I also see a lot of physio working in interdisciplinary teams really only teach and watch exercises solely as a treatment approach. I also don't think that I would be satisfied with doing this. 

On the other hand, I feel like chiro school would be a good opportunity since I could really develop my manual therapy techniques. I think it fits better what I am looking for out of a career compared to physio. However, as a chiro, I feel like you can only work in a clinic (hospital jobs are rare) and the population you treat is not that varied (you pretty much mostly work with back and neck pain)

I get that chiro is more tuition and more schooling (it's 4 years instead of 2 years) but I rather choose something I love for the long haul and at the end of the day the money difference doesn’t make a huge difference to me. What do you guys think? Any advice would be appreciated! 

On a side note, I have seen many people in this sub recommend physician assistants. I got in that too (I had no idea what I wanted out of a career when applying) but am shying away from that since I really don't want my scope limited by someone else and rather not be 50 years old working under a 30-year-old doctor.",chiro vs physio
Chiropractic,,"Do you play music in your treatment room? If so, what type?"
Chiropractic,"As a provider, how would you explain chiropractic to a patient or individual with no experience.",What is your definition of chiropractic?
Chiropractic,,5 Reasons Why Chiropractic Treatment is the Best Treatment Option for Your Personal Injury Claim
Chiropractic,"The title is vague, let me explain. Basically, I've been seeing a chiropractor for a few years now. I was consistent initially when it was helpful with most of my then problems (migranes, sleep, neck pain, etc). I started seeing him less over the last 2 years. Things got better it didnt make much of a difference if I went or not, so I started going as and when I felt the need. It's pricey and I don't feel like spending so much money now that things are pretty manageable for me. Not to mention it's difficult to get appointments and I have to travel a lot too. However, I still get that annoying upper back ache that doesn't go away easily. No foam roller or pillow under my back is really helping either. I know just one visit to a chiropractor and this will be done and dusted, my back will feel free again for a few months at least! But I don't want to be dependent on chiropractic help too. It's not painful, it's just uncomfortable. Is there anything someone can suggest I do to help myself at home or would you recommend still seeing a chiropractor? TIA!",Should I continue seeing a chiropractor?
Chiropractic,,Chiropractic Care &amp; Neck Pain Relief Center Denton
Chiropractic,,Chiropractic Services &amp; Neck Pain Relief Center Denton
Chiropractic,,Chiropractic Care &amp; Neck Pain Relief Center Denton
Chiropractic,"https://www.researchgate.net/publication/326129631_The_prevalence_of_the_term_subluxation_in_chiropractic_degree_program_curricula_throughout_the_world

The term subluxation was found in all but two US course catalogues. The use of subluxation in US courses rose from a mean of 5.53 in 2011 to 6.50 in 2017. US institutions use the term significantly more frequently than non-US. Possible reasons for this were discussed. Unscientific terms and concepts should have no place in modern education, except perhaps in historical context. Unless these outdated concepts are rejected, the chiropractic profession and individual chiropractors will likely continue to face difficulties integrating with established health care systems and attaining cultural authority as experts in conservative neuro-musculoskeletal health care.","Unscientific terms and concepts should have no place in modern education, except perhaps in historical context."
Chiropractic,,Help with translating technique notes
Chiropractic,"I’ve got an herniated disk from squatting. It sucks. I found that when sitting on the couch my posture is trash and definitely makes things worse. 

I’ve been sitting in the lotus position this evening and feel as though it’s not putting as much pressure on my lower back. 

Is this in my head or is this helpful? I feel as though I sit up a little straighter and don’t fold my lower back over when in lotus. Any advice is much appreciated.",Herniated Disk &amp; Lotus Position
Chiropractic,,✂️ Chew got me Over hur Dead Ce-Moan Lewis The Yella Heifer Somebody Put that inna Comment Section😂😂The Net Gone to Far Now YH huh🤦
Chiropractic,I'm buying a new mattress i see some mattress being advertised at around 1000 to 1500 bucks on the internet  but then ho to the mattress store and there all like 3 to 5 k so any advice is appreciated.,Best bed for back sleepers?
Chiropractic,,Can chiropractor help fix misalligned pubic symphysis
Chiropractic,"

[View Poll](https://www.reddit.com/poll/v20ggv)","Students/Job Seekers, what is your preferred platform for viewing open positions? Practice owners, which option have you found most successful in recruiting/hiring clinicians? Please feel free to elaborate in the comments. Thanks for your help!"
Chiropractic,"I see a few posts on here that are like, I wouldn't go to a chiropractor for such and such unless he had such and such training.

I'm sure this makes sense to you, but for common folk, how do we know?

Next question.  How do you know who treats what?  Every chiropractor website says they treat mostly everything there is.",where do I find out if a chiropractor can treat a certain thing?
Chiropractic,,A Vitalism Ethos and the Chiropractic Health Care Paradigm
Chiropractic,,Chiropractic Care &amp; Spine Adjustment Denton
Chiropractic,,Spine Adjustment &amp; Neck Pain Relief Center Denton
Chiropractic,How much impact would the approval and passing of this have on the profession and visits for the patient?,What is the Medicare bill deadline? When should we expect votes to happen?
Chiropractic,What would the reason be?,can chiropractic do anything for tmj?
