subreddit,selftext,title
Chiropractic,"I am pretty early on with my education, and am struggling to come to terms with the reasoning why we have to take some of the classes that we do. 

I understand microbiology, and the possible clinical relevance it could have, as well as small parts of biochem related to diseases. Even though most of these cases would be spotting an issue outside of the scope of practice, and referring out. 

What I don’t understand is why we have to know where bile ducts are on a cadaver, or why I need to know the Krebbs cycle and ETC. If I’m ever explaining the Krebbs cycle to a patient in the future, I would want someone to take me in for a Psych evaluation.

We don’t have the option for a true residency in our profession when compared to others, and I feel as though my time could be used in a more efficient way so that I could become as competent as possible in my short amount time in school. 

Is there an actual reason for it?",Question about the Chiropractic education
Chiropractic,"What are y’all’s thoughts on chiropractics done on kids/ babies? I’ll probably get a lot of hate for this but I don’t think they should be done on anyone under 18. I have my own thoughts on adult chiropractic, but that’s a post for another day",Thoughts on pediatric chiropractic?
Chiropractic,,Affordable Chiropractor &amp; Spine Adjustment Denton
Chiropractic,,Chiropractic Care &amp; Spine Adjustment Denton
Chiropractic,,Tinnitus after Chiropractor Visit :(
Chiropractic,"Hello, just wanting to see what mics for an iPhone are recommended for sound quality of the cavitations. Thank you!",Mic for iPhone videos
Chiropractic,For neck pain &amp; tightness,Best pillow?
Chiropractic,"Hi all,

I applied to CMCC 2 years in a row, and was invited to the interview on application 1 (I didn’t accept it), and application 2, went through with it and ended up receiving an offer of admission.

I have quite a bit going on right now in my life, and am debating on declining the offer. If I were to reapply again for a 3rd time for 2023 admissions, will my chances of getting accepted be slim to none since I had already rejected an interview and then denied my offer of admission?

Any help or insight is appreciated, thank you.",CMCC Help
Chiropractic,[removed],Anyone have recent RCT/ Journal links to cost effectiveness of chiropractic please? Especially interested in most recent stuff. TIA.
Chiropractic,"Hi, has anyone had this done? Did you have a positive or negative experience? Thanks",cranial facial release
Chiropractic,"Hello, I’m a relatively healthy 33F who over the last few months has been dealing with a painless clicking sound every time I turn my head to the right, and then back to center. Sometimes it is louder than others, I think depending on how tense I am and how aware of the clicking I am in that moment. Sometimes I don’t notice it at all but when I’m in a completely silent environment it drives me insane. Sometimes when it is worse I notice more clicking or almost like a faint sandpaper sound in my neck too. Every few weeks I’ll have a day where I notice a louder sandpapery sound that is very unsettling, but it typically goes away within a day. I’m trying to figure out if those episodes correlate to periods of higher stress.

I’ve been going to a chiropractor for a few months who doesn’t seem to have done much for the issue, nor do they seem concerned/treats it like no big deal/shrugs it off even though it’s very much affecting my mental health. Same with the osteopath I’ve seen. I also went as far as to see a spine specialist. They took multiple X-rays and ruled out stuff like instability/hyper mobility, and said my cervical spine looked totally fine and also told me not to worry about the noise.

I suppose I am just stubborn for not listening to the pros when the tell me not to worry, but it’s hard not to. I mean - it is my neck! I’ve also noticed some clicking in my jaw lately which I am worried could be related however I also suspect it could be realtors to bruxism I developed from taking a medication. 

Anyways - last week I had a consultation with a NUCCA chiro. We went through my recent X-rays and noticed some misalignments in my cervical and lumbar spine. When I described the clicking to him his explanation was that the spine obviously isn’t moving correctly. The treatment plan he offers looks like $625 up front which sees reasonable after browsing this sub. I’m not too concerned about the money. I’m really interested to see what the atlas X-ray would show. I’m hopeful that the targeted treatment would help me resolve the issue (and help me just feel better in general and I do have various other aches and pains). However, I am nervous that the treatment could somehow make the noise worse? Does anyone here think that would be possible? I’m at the point where I am willing to try anything but very nervous of making things worse. Any input would be appreciated!! Thank you for reading.",Opinions on NUCCA for noisy neck
Chiropractic,"I have had a very strange issue. If I try to lift anything with my arms, even a few pounds. 

At first I feel nothing but then I'll get a pinching sensation between my shoulders after a few minutes then the skin around my neck, jaw, shoulders will become very sensitive. This can last the rest of the day. The more effort/stress I use to lift something the longer and more sensitive it becomes.

If I avoid lifting anything for a day or two my symptoms completely go away. 

I've had bad posture for many years. 

I was thinking of visiting my local chiropractor to see if they have any insight but was curious if anyone experienced something like it.",I have a very strange issue that I wonder if people have experienced it before or tried a Chiropractor for it.
Chiropractic,[removed],"Would anyone graciously offer links to modern (or not) research on cost effectiveness of Chiropractic, or, anything related to cost vs biomedical model? Cost effectiveness in general would be well received also."
Chiropractic,Needless to say I never went back and left him a 1-star review. But is this normal? I swear this chiro tried to sell me like 3-4 different things as well as giving me a paper listing packaged deals for more visits,Is this normal? Chiro seemed really pushy on selling me stuff and offering “special deals” on recurring visits
Chiropractic,"I can confidently say I was taught more about the Krebbs cycle and bacteria then anything Chiropractic related😂

Biochem and Micro are no joke.",Just about finished with my first year of Chiropractic college
Chiropractic,"For all my fellow chiropractors
I’ve noticed when I do my side posture lumbar push adjustments that I usually have the patient on their side, torso maybe almost to 45 degrees to the table. Does this cause a lot of discomfort? Should I be angling them closer to 90 degrees(but not all the way) ?",Lumbar side posture tips?
Chiropractic,,what is a good first at home table to practice on? thanks
Chiropractic,"Hello everyone, I’ve been going to the chiropractor for my neck and headaches. It’s been a while since I last went and I’m having underarm, shoulder pain that randomly goes down to my arm and sometimes I can feel tingling sensation as well. Chiro ordered an x ray and MRI… meanwhile he’s been forcing me to come to his office to do ultrasound therapy, he first puts a wand on my neck that warms up and then he puts this massaging warming timed machine on my neck/upper back. I’ve noticed my pain has increased by a lot since these 2 sessions. It almost feels like muscle pain after a good workout. Is this normal? Any advice? Thank you",Ultrasound therapy aftermath pain?
Chiropractic,I'm visiting a gonstead chiropractic. is it normal for the first two sessions for the chiropractor to adjust one thing at a time? When I watch youtube they go cracking for hours. My chiropractor is conservative with the cracks just want to know if this is normal,Gonstead Chiropractic questions
Chiropractic,,Can someone explain this test?
Chiropractic,[removed],Can someone give an opinion on this?
Chiropractic,,How Can Chiropractic Care Relieve Shoulder Pain?
Chiropractic,,Spine Adjustment &amp; Chiropractic Services Denton
Chiropractic,,Spine Adjustment &amp; Chiropractic Care Denton
Chiropractic,"Hey, so there was this exercise I saw posted in a fitness forum, and it looked ridiculous. So, basically, you lay flat on the floor, arms and legs stretched straight, and you try to raise the middle of your back. I thought it looked silly and couldn't have been that hard, so I got on the ground and gave it a shot and oh. my. God. The noise my back made will haunt me on my dreams. EVERYTHING cracked. It was like a fistful of firecrackers. I staggered up, terrified I may have done serious, permanent damage. I still have feeling in my fingers and toes, and the only thing is my back is a little sore in that spot, but how do I know, really? The back is so fragile, and it's so easy to mess it up for good, and I'm terrified that I just did. Will my vision disappear? Will I slowly become paralyzed? Will I develop ED? Will something develop? I am FREAKING out right now about this.","Did a strange exercise, expert advice needed"
Chiropractic,"

[View Poll](https://www.reddit.com/poll/uyn5kc)",How many hours a week do you work?
Chiropractic,"I sit at a desk all day and interact with a computer by typing a lot. 

I currently don’t have any pain or issues, but was wondering if I should buy an ergonomic keyboard to prevent issues later on? 

Or are ergonomic keyboards only really meaningful to treat pain or problems that one already has? 

Hopefully my post is relevant for this subreddit. Just wanting some professional insight as I have no idea what the answer is to that question.",Are ergonomic keyboards worthwhile as a preventative measure?
Chiropractic,"My subtalar joints are compacted and I’ve been to two different chiropractors who couldn’t get it to release. I have the name of a third but I’m at the point where I’m questioning if I’m just throwing money away for something that can’t be solved. 

In my shoes, would you give a third chiro a chance or save your money and accept having super tight ankles?","If two chiropractors couldn’t do it, would you go to a third?"
Chiropractic,,"Houston Lady ""Terrified"" To Get Her 1st Adjustment &amp; Is ""Blown Away"" With Instant Relief Of Her Pain Dr. Gregory Johnson helps"
Chiropractic,I know very little about the chiropractic field however I am wondering if a chiropractor can help with neck tension. The muscles in my neck are rock hard causing limited movement and pain so bad its making my extremely nauseas. I dont know if a chiropractor can help or if this is more of a massage related item.,Can a chiropractor help neck tension?
Chiropractic,,Why does my legs look so weird and how do I fix it
Chiropractic,"Hi, I’m a 31 year old female who recent developed back pain and subsequent mri lumbar showed lumbar facet djd mild-moderate on most lumbar levels. 

I have low back pain. That started 2.5 months ago. I use to lift, also stressful work (a lot of sitting standing which I have been trying to really change but hard to do that). 

This low back pain worse with sitting for long, or standing for long. Another thing is I develop this burning back pain as well that can involved my thoracic area when I try to stretch/do any strenuous exercise. 

Will chiropractor be helpful in my case? If anyone can give me any help. I would appreciate it very much. 
:(","Lumbar facet DJD, do I have to live with this?"
Chiropractic,"For those of you who have pursued, are pursuing, or actively chose *against* pursing a diplomate (DACBN/DACBI/DACBR), could you explain how your decision has benefitted your practice and clinical reasoning? 

Things to consider: are all diplomates created equal? Are they worthwhile? How much of your practice is directly related? Cost:benefit?",Chiropractic Diplomates
Chiropractic,,"Study Links Chiropractic Care to Lower Costs, Faster Return to Work"
Chiropractic,"Can anybody recommend a good Chiro in Las Cruces, NM or El Paso, TX? It’d be much appreciated!",Suggestions
Chiropractic,Poor deadlifting form yesterday has my back feeling worse now than before. My posture is poor and I was wondering what habits and activities I should engage in to correct it and alleviate the pain. Any advice?,Deadlifts and posture
Chiropractic,I know there are lots of YouTube videos on this but I just wanted to know what's your opinion of the best way to adjust/pop my own neck without a chiropractor?,Best and Safest way to adjust/pop my own neck?
Chiropractic,"I went to my chiropractor 2 times now. The first time I told him about the pain in my upper back and he just took some medical records and just adjusted me a little bit in my back where I told him I have pain. 

&amp;#x200B;

The 2nd time he just adjusted me for like 13 mins and after asking me what activity causes pain as I told him my job work gives me pain so I showed him the motion. 

&amp;#x200B;

Am I thinking he should be asking me questions on how I stand or sit and how this problem happened initially and maybe exercise techniques or maybe x rays or anything at all?

&amp;#x200B;

thank you.",Is my Chiropractor good?
