,subreddit,selftext,title
0,physiotherapy,"Hi,

I graduated from physio at the start of this year. 

Since then I have been working in a private practice in Sydney.

I love the kind of patients I get to help in the private practice environment but have started to feel burnt out because of the demands from this kind of an environment. I have started to wonder if physio is something I want to do long-term too.

At the moment, I am considering going into aged care physio but am unsure if there's going to be a need for aged care physio's after the changes happen to ACFI in October later this year.

Just wondering if anyone has any words of wisdom, thanks!",Private Practice to Aged Care Physio - Sydney
1,physiotherapy,"Hi everyone, I am interested to migrate to Canada as a physio. I hope someone here can help me. My questions are:

1.) Would it be better to apply for express entry and simultaneously apply for credentialing? Or would it be better to take the licensure exam first and pass the written portion and then apply for express entry?

2.) My target areas are BC or Ontario, how is employment here, do employers help you with LMIA? Thank you!",Which to do first PCE or express entry?
2,physiotherapy," I'm 380 lb, not too tall, male, three years ofinactivitye took its toll on leg muscle athropia to the point I can barely walk now.

I want to recover my leg strength and try to get my life back. I cannot get out due to high covid risk.

I'm not in the US so cannot test beforehand, but I'm reaching a limit and will just purchase a seated recumbent machine and hope for the best. I'm torn within elliptical movement or lineal movement and I need advice on that. I have mild knee injury from two decades ago but usually let me do things without any problem.

I'm considering these three models:  
[https://www.hcifitness.co/collections/linear-steppers/products/physiostep-lxt-recumbent-cross-trainer-compared-to-nustep-recumbent-cross-trainers-nustep-t4r-nustep-alternative](https://www.hcifitness.co/collections/linear-steppers/products/physiostep-lxt-recumbent-cross-trainer-compared-to-nustep-recumbent-cross-trainers-nustep-t4r-nustep-alternative)

[https://www.hcifitness.co/collections/recumbent-cross-trainers/products/versastep-recumbent-ipsilateral-cross-trainer-with-swivel-seat](https://www.hcifitness.co/collections/recumbent-cross-trainers/products/versastep-recumbent-ipsilateral-cross-trainer-with-swivel-seat)

[https://teeter.com/product/freestep-lt3/](https://teeter.com/product/freestep-lt3/)

I feel this is the most important purchase I've done in my life. Please help me out, any feedback is more than welcome.",Please recommend me a muscle rehab machine.
3,physiotherapy,"I recently graduated from high school and had received offers from both HK polytechnic and Queensland university for BSc physiotherapy. 

I saw that on the CAPR site it says Australia grads have a high passing rate in the competency exams, still I would like to ask for opinions on which uni should I go for if I want to be registered in Canada.

Thank you!!",High school grad looking forward to be a physiotherapist in Canada
4,physiotherapy,"Hello All,



Just want to state before we start I have absolutely no knowledge on physiotherapy, however I am asking this question in an attempt to be able to understand my friends situation more.


My friend has exhuast 2/3 of  their PCE exam attempts, I am confident in their skill &amp; knowledge, they scored 575 in their most recent attempt, they work extremely hard, this is not only their chosen career path but also their life's passion. 


Anyways, question is, what happens after 3 attempts?
 Can they go back to school and try again? 
Are there any exceptions? 
What options are out there for people who failed all 3 attempts? 

I just want to know what the plan is in the worst case scenario (failing 3 times )


Thank you all, I appreciate any answers and feedback.",PCE exam attempts ( Canada )
5,physiotherapy,"I'm planning on applying to 3 physio schools in Ontario this fall, UofT, Western, and McMaster. I'm in a healthcare field (nutrition and dietetics) but didn't seriously consider PT until about a year ago, so I didnt get the psych prereqs for alot of other schools in Canada.

My subGPA is looking like it'll be around 3.9, which I'm pretty comfortable with. But I don't have much direct physio experience. I have experience coaching and doing nutrition counselling for martial arts, some social media stuff for private dietetics firms, and some experience working with the dietary staff at a LTC home (where I first got interested in rehab). I also have some experience developing workshop/seminars about HIV/AIDS, concussion identification for softball players, and posture tips to avoid MSK disorders when working from home.

&amp;#x200B;

I think I have good transferable skills and a good appreciation for PT scope of practice outside of just sports PT, but I'm worried that I don't have direct shadowing experience. Would this be an issue? Any thoughts from folks in Canadian PT programs?",Chances of Getting in PT School in Canada
6,physiotherapy,"I fractured my radius a few days ago. But I haven’t received any rehabilitation exercises or timescale of rehab. 

The hospital was meant to phone me about whether I’d need a screw or not, and I was going to ask them about my rehab.

However, I haven’t received that phone call, and instead have received a text with the follow up appointment date in 2 weeks.

What am I meant to be doing during those 2 weeks? 

I’ve been gradually increasing the range of motion in my elbow. Is this the correct thing to do?",Physiotherapy recommendation for radius head fracture?
7,physiotherapy," 

Do I have bicep tendonitis or Brachialis Tendinopathy ?

Sorry, not sure where to put this but I really need help:

Hi, I really need help. I have had pain under my bicep for ages now. It has been 6-7 Months. The pain has gotten better but the pain is still present but progress has officially stopped . I have stopped weight training for 6-7 months now and its causing me distress and depression (a bit over the top I know).

I have been to my local GP and they have stated it is muscle over use. I was prescribed a few stretches to do to alleviate the pain but it still has not gone (again, doing this for 6-7 months) I have been using hot water bottles on it 2-3x a day. Its getting ridiculous. I feel as though the GP is just saying its muscle overuse but they may not understand that it could be something deeper. To Note: the physotherapist states it is also muscle overuse.

I just do not want to have this for another 7 months. I do not believe it is bicep tendonitis as, correct me if i am wrong, but I do not have pain shooting from my shoulders or elbow. It only appears to be under my bicep. Looking Online, I have come across Brachialis Tendinopathy which seems to be what I am feeling? Please can someone help I am stressed and wake up disheartened everyday as although, it may not be that deep, the only thing I enjoy is the Gym. Its been a sad 7 months. To note: I am not a rock climber nor do any other sports but go to the gym. I also was working retail at the time.

I have enclosed a few pictures to show where the pain is.. Dont judge the smallness of my arms it has been 6-7 months.

Please let me know if you need any questions or more pictures.

[https://imgur.com/iGmFZR8](https://imgur.com/iGmFZR8)

[https://imgur.com/qH310di](https://imgur.com/qH310di)

Thank you",HI
8,physiotherapy,"I only wanted to do medicine and knew that studying physio for the degree is also a good path to get into medicine.  get to choose between Biochem and physio and i chose physio just because i get to talk with patients, be in the hospital surroundings, learn about the anatomy and stuff. 

Whenever people ask you why do I choose physiotherapy, my answer seem to be not persuasive enough. 

I say I like to help people, improve their quality of life for the people who just had surgery/ disability… 
Then they would ask Why didn’t you choose occupational therapy? 
OR There are tons of jobs that could help people why physio? 

I almost couldn’t answer them, especially the last one cause all i wanted to do is medicine 

I knew people could see that I don’t have that love for physio because of that answer so what should I say? and what are yours?",What got you in /like physiotherapy ? (helpp)
9,physiotherapy,"I work in Canada as an inpatient PT. Our health authority (and I'm sure others) are struggling to fill positions. This week our hospital is at 60% PT staffing. 

A lot of graduating PTs are choosing private practice over hospital. I'm curious what the reasons are.",Why so few hospital physiotherapists?
10,physiotherapy,What do you like most and what do you hate most?,"As a physio, what is the best things about your job and what are the worst things?"
11,physiotherapy,"I am seeing a new chronic pain specialist physiotherapist and I want to communicate and explain my experiences of chronic pain after car accident, back and neck injury, in the best way to be clear and efficient at the intial consultation. 

I have already been through 15 sessions of physiotherapy and have been self managing a physical therapy excersise program since that relationship ended. 

The physical therapy program has not been helpful at reducing or improving my pain levels and what I do consistenly results in flare ups of high pain levels and difficulties with being able to participate in group fitness classes or independent gym routines 

I am very devoted to my self management and recovery its just I feel something is not right with what I am doing currently and I need advice to make changes so it's more beneficial. 

I wonder how can I be most helpful as a client with the way I communicate and the information I provide to my new physiotherapist? 

I will bring a chart of what I have tried, what flares pain and what helps alleviate it, what functions and activities trigger pain levels increasing, a description of the feeling of pain as I experience it, pain levels baseline and when flared. I am trying to be very succinct here to make the most of the time.

I'm sure my new phsyio knows what she is doing! I have just felt frustrated in the past and concerned I haven't been heard, so I want to know if I can make any adjustments to my communication style or the information I present. 

I have been very much educated on the biopsychosicial model of chronic pain by last physio, and read multiple books on the nueroscience, and despite all areas of pain management being adressed I am still feeling like  am on square one of my rehabilitation. 

Trying not to give up here.",How best to explain pain as a chonic pain patient
12,physiotherapy,"There are a lot of contradictory information about what is good or bad for the knees. Some people say that squating below 90 degree's is bad, other says it's good. Some people say that jumprope is bad some say it's good. Some people hurt their knees running, some people run until  they're 85. Some people say you shouldn't be on your knees, other say it doesn't matter. I was wondering what were the physiotherapist opinion on all of this?",What is bad for the knees?
13,physiotherapy,Best wishes to those that are. Mnemonics are our friends,Anybody writing the PCE on Tuesday? Any last minute advice?
14,physiotherapy,"Hallo everyone, my orthopaedic suggested me a pair of customised orthopaedic insoles because of a knee pain and a little food pronation. He could not explain me very well how they could help with my problem. How is your experience with them? When are they useful when not? Which is the theory behind them?",opinion customised orthopaedic insoles
15,physiotherapy,,which is a better university between Coventry university and Sheffield Hallam University for MSC Physiotherapy ( Post Registration) ?
16,physiotherapy,,"Qualified UK Physiotherapist, what's needed to work in Europe? And is there any additional requirements? Any good sites etc for job postings?"
17,physiotherapy,"I'm Canadian and I've been injured. I completely believe that with *a lot* of physiotherapy, that's more akin to what a professional athlete would be provided, I could be rehabilitated. Maybe not fully, but at least to the point of being able to take on a labour intensive job if need be. The problem is that there's huge cost that goes with that amount of rehabilitation when one half an hour session, that's more like 20 minutes, costs $60 CAD. The model of physio in Canada seems to be centred around workers compensation insurance to get a patient out as fast as possible without full fledge rehabilitation. 

I've been trying to explore the idea of going to somewhere like Thailand, South America, China, or India to see if I can get the full standard of care instead of an expensive twenty minute session that might result in a few physio exercises with a band, some talk, and ultrasound. Every time I pitch this idea I get the feeling that the physiotherapists in Canada believe their standard of education is so much higher that what I'm pitching is a totally terrible idea that would result in me getting hurt. Is this true? 

I'm literally looking for a physiotherapist that can be more involved and carry me through training to the point where I recover. There's been people way more injured than me make full recoveries, but I feel like I need more help with a pricing standard that's only affordable to the upper elites. I have a remote job so I can basically go to a country and stay until I'm better.","Not asking for advice, but trying to clarify if there's a different educational standard in physiotherapy between nations?"
18,physiotherapy,,I am a researcher from Tel-Aviv university. In this short epidemiological survey we want to explore pain and chronic pain among healthcare professionals (HCPs) and also among HCPs who treat patients with pain. We would appreciate if you take the time to fill out the survey (approx 5-8 minutes).
19,physiotherapy,"A friend of mine works as a physiotherapist. She has the issue that she apparently must complete a few day long advanced training, getting nude infront of many people and let others press these spots on the butt etc, Im no expert. Sounds weird.

She starts to have serious panic attacks and wants to quit. She comes from another culture and has issues with showing skin under normal conditions too.
Her confidence is critically low. She thinks she is very ugly and unworthy.
Boss warns her she would have to pay the course (expensive and she is broke) if she doesnt do it.

Is it ok to do that? She would be ok with Underwear, but is terrified just thinking about it.

What can she do? Is that normal?
Any way I could calm her down?
Anyone from Deutschland hier?",Female Friend has to complete adv. training - getting nude in front of a dozen ppl is the issue [Germany]
20,physiotherapy,"In short, should physios need to consider the importance of nutrition when treating musculoskeletal issues in private practice, in particular when increasing strength?

My supervisor and I discussed this and we thought of the obvious example of stress fractures in dancers and marathon runners. It's well accepted that calcium intake must be screened in these people, especially since restrictive diets are common amongst them.

What about muscular weakness however? Personal trainers and exercise physiologists rightfully stress the basic need for increased (somewhat) protein intake to build significant amounts of muscle over long periods and an energy surplus is typically assumed.

Is there a point where we need to consider this in private practice? My supervisor and I had these basic points:

**Reasons in favour:**

* In older populations, addition of protein supplements (usually whey) has been shown to improve muscle gained/preserved relative to resistance training alone
* In athletic populations, the standard for strength is very high and energy needs are high. There *may* be cases wherein poor nutrition/recovery undoes or limits the effectiveness of our resistance training rehab.

**Reasons against:**

* Only a small proportion of patient problems are *purely* strength-related
* In more sedentary populations, the strength gains needed to make significant progress will be mostly or almost entirely due to *neurological* changes, not hypertrophy and thus, less dependent on energy balance and protein intake
* Nutrition is beyond our scope of practice. Referral to a dietician is easy in a hospital but may be less practical in private practice.
* Most studies looking at resistance training for common musc issues (knee/hip OA, tendinopathy) do not control for diet yet yield good results.

My general conclusion thus far is that it worth investigating diet in high-level athletes or those requiring restrictive diets - however these people likely already have nutritional oversight.

Thoughts? Specific research in this area would be appreciated.",At what point does nutrition become relevant to private practice?
21,physiotherapy,"I will be starting a physiotherapy program in a couple of weeks and am excited about the career afterward but also a bit disappointed to be entering a field where it seems that there may not be opportunities for remote work, as I have actually enjoyed working and studying from home over the last couple of years.

Does anyone have some insight about the opportunities in telerehabilitation or have any thoughts/opinions about it? I will be studying and working in Canada if that helps.",Can you work fully remotely as a physiotherapist?
22,physiotherapy,"For my last exam I have to create a sport specific plyometrics based exercise programme for a sprinter in his end stage of recovery/return to play after a grade 2 hamstring strain. These are the current exercises that I have. 

Exercise 1
Stiff leg hope
20 meter distance
2-3 sets
2-3 minutes of rest between each set


Exercise 2
Alternating leg bounds over hurdles
20 meter distance
3 sets
2-3 minutes of rest between each set

All opinions and suggestions greatly appreciated (disclaimer,  this is not asking for a diagnosis nor is this recommendations for a real patient)",Exercise recommendations
23,physiotherapy,,I have the tight hip flexors and tight hamstrings. which one should i loosen up first?
24,physiotherapy,,"Hi! I’m a physio student and currently undergoing my undergraduate level dissertation on axillary web syndrome..those who work in the oncology field, what is your experience with this condition (if ever encountered)? :) very curious - thank you!!"
25,physiotherapy,"Context: I’m in my first year out of uni as a private practice musculoskeletal physio in Australia. I’ve lived out of home since I was 18, never really had much or been able to save up. 

I started my first job several months ago. The clinic seemed amazing, the interview went well with my now boss who seemed much like the physio I would want to develop into.

The contract I am on is set up with this incredibly low day rate and then I am paid per patient. Kind of like a contractor but I was asked to work full time. I asked around and got mixed responses about this being normal. Some others said it was unfair, even predatory, for a new grad to be expected to be paid per patient. 

I ended up accepting it because the opportunity seemed worth it and my boss stated that the patient numbers would steadily increase and I would be well supported after a few months. 

Once I started working there were some preparatory strategies, but very little structured professional development. Basically just shadowing. This was for about a week and a bit then for the most part I was asked to do every odd job. Random admin, social media work, website design, marketing, doctor letters. My patient numbers increased but slowly and I was consistently told to improve my rebooking strategies. 

This went on for nearly three months, my time completely filled with nonphysio tasks. Occasional chats with my boss, mostly about improving rebooking. I worked hard to show my worth. 

It reached the end of probation and I asked my boss to increase my pay rate (the other physios mentioned they were getting more than double, and asked I be raised to that). Boss declined and offered me a different rate, that seemed better. I accepted, but realised it actually paid worse so I asked the next day to return to the previous rate. I told my boss I would have to cut my hours, would no longer complete the random assortment of tasks unless compensated to do so and that I would look for more supplementary work until the patient load supported me better. 

Boss agreed to this but then paid me the worse rate which I had to bring up at work. If your not keeping count this is the fourth chat about pay rates. The boss also docked the bonus I was normally paid since then. 

Finally, last week I did a twenty minute Google to find out if the pay rate was legal. Turns out I was paid at less than 60% of MINIMUM wage for nearly 6 months (including ‘bonuses’) and the contract was completely illegal. Also, Employees are not expected to take on financial risks, that’s the employers role. I called a government agency to check and they confirmed it and told me to make a written request for pay owed within 7 days to my boss. If my boss didn’t comply I would escalate it to the government agency where the penalties were $10,000 to 60,000 for just one of the offences. 

I tried to calmly raised the issues with my boss using the guidelines from the government agency. They felt they had supported me fairly and that based on everything so far I was not cut out for private practice and should work in government. I told my boss I strongly disagreed. They said they needed to think about my request and would make some calls. 

I didn’t mention the penalties or that I would be making a written request for the pay out of courtesy. 

I honestly don’t want to have to escalate it or report them to any physio organisations. They employs a great team of physios, have a lovely family and the clinic helps a lot of people. 

Am I overreacting? Is this pay structure common? 

I really don’t know what to do. Open to any and all suggestions. 

TLDR: new grad physio paid 60% of minimum wage, unable to negotiate, boss reduced pay repeatedly and now I’m escalating it but I’m not sure whats best to do.",Being paid well below minimum wage. Is this normal?? I’m having disputes with my boss. I don’t know what to do.
26,physiotherapy,"Hello, I live in South Africa. I have been looking through all these mats, foot spas, special sandals, etc. Was wondering if any promote better circulation in feet than others, or is there a benefit limit that they all hit the same? Just curious since I am very uneducated in such things.",Do foot spas offer better circulation promotion than reflexology mats?
27,physiotherapy,[removed],Do you engage in online networks and platforms with other health professionals?
28,physiotherapy,"Hello everyone! 

Upcoming Ontario graduate here and I've gotten a number of offers and am debating between two to start right now, and I was hoping for some input :)

1) private practice: 
- 4 minute drive from home 
- 4 day workweek (flexible hours, 4 9s probably)
- Smaller practice with few MVA and WSIB
-  50% fee split *employee* status, so CPP/taxes/EI/4% vacation will be paid
- 12-16 patients per day with a wait list into September, so relatively steady and busy 
- 37.50 to start for 3 months if I don't want a fee split immediately 
- 1000$ education fund 
- health spending account (I think $1000)
- 2 weeks vacation for year 1, up to 3 in year 2, and 4 weeks after 5 years
- 4 additional unpaid professional development days 
- I don't know if there's a ton of opportunity for formal mentorship or anything since it's a very small practice/team 
- own laptop to chart and basically my own treatment room since there aren't a bunch of clinicians bouncing around 

2) private practice but MOH funded clinic 
- 45 minute commute 
- did a placement there so I'm familiar with it 
- contracted employee 
- $44 per hour 
- $1500 education fund 
- $1500 health spending account 
- 4 day workweek, flexible with which days off I want
- unlimited unpaid vacation (CPP/EI/taxes/4% vacation not paid)
- connections to family health team in same building which could allow for development of new programs and such (which I would like to do) 
- I don't know if there is a formal mentorship program 
- occasionally I noticed on placement that treatment rooms would sometimes be unavailable because there's lots of clinicians, and they chart on paper, and there aren't formal ergonomic desks and chairs to do charting 
- wouldn't have my own computer or laptop to do work

It's my first job and really I'd like to get into some type of research and program development down the way, maybe transition to acute care at some point, so I believe that I won't be staying in private practice for more than 5-6 years (unless something really changes). My life dream is *not* to own a clinic so I'm not looking for substantial leadership and growth to get to partnership or anything.

Any thoughts? Would you commute for the second offer? Any opinions on fee splits?

The second offer has much more flexibility for vacation and life, but the first one is much closer to home and lets me be an employee and get those government perks.

I also don't have student loans of any kind so it's not like I'm drowning in debt or desperately need the highest hourly rate possible.",CANADA: comparing job offers
