,subreddit,selftext,title
710,physiotherapy,"1st year of physio in Netherlands doing international course (foreigner from different part of Europe)

Lots of my classmates have some really outdates beliefs ranging from ""bad posture causes pain"" &amp; ""You need to activate your glutes for x amount of time before x activity"". 

All the way to more debated things like whether massage is a useful treatment method and other things about manual therapy.

We are all 1st years so we're not prepared (or also willing to in our spair time) look through and critique studies. So when we discuss stuff like like ""bad posture=pain"" I can't just recommend studies from physio's I follow for the above reason.

How should one go about discussing these types of ideas with colleagues/classmates? 


I assumed the Socratic method of just questioning would be the best approach but at times I run into road blocks in terms of my knowledge as I'm on the same playing field as they are.

I also find that these beliefs are deeply rooted within them as when their physio ""fixed"" them they used x method &amp; I hear a lot of ""well my physio told me that __ does this"" *Insert ridiculous outdated idea/treatment method. 

Now I'm a pretty skeptical person in general so it's takes me by surprise when people just accept these claims to be true when the explanations are so nonsensical &amp; their isn't really much if any research to support them.",Talking to fellow students/classmates with wacky beliefs (Asking for advice)
711,physiotherapy,"For the memory to store anything, it had to be picked up. For it to give anything, it has to be given. These, by the picker and the giver, become consistent in knowing and interoception, theoretically.

The memory has stores. These stores are grouped by similarities. Rice can be grouped with noon — if rice is often served at lunch. Rice has its own store in the memory. New stores are created by the picker, but groupings often change.

If rice now gets served at dinner, the picker slowly takes it to the group of dusk. Rice could also be grouped with a cool chef, or a certain situation that happened in the time that rice was served and so on.

In a continuous process, stores are created, groups are made and changed. This, theoretically, can be described as a summary for what neuroplasticity also means.

[https://www.reddit.com/r/cognitivescience/comments/rrdskv/memories\_or\_just\_thoughts\_of\_the\_past/](https://www.reddit.com/r/cognitivescience/comments/rrdskv/memories_or_just_thoughts_of_the_past/)

The brain changes with function — true, but function become inputs that go to a memory store, then group, so that it can be given, including its sequence — mindlessly — after a while.

The base camp of neuroplasticity is the memory.

There is the concept of handedness, right hand dominance for some, left for others, with a few ambidextrous. Handedness — or by extension, laterality — can be explained as a thought function.

In the theory of the rules of neurons, there is a thought box and a memory box. The thought box has entry ports where everything is converted to thought. This includes motor functions, sensory, physical reality, internal systems operations and so on.

[https://www.reddit.com/r/RandomThoughts/comments/rgekso/youre\_not\_seeing\_youre\_thinking\_theory/](https://www.reddit.com/r/RandomThoughts/comments/rgekso/youre_not_seeing_youre_thinking_theory/)

So each eye has its own entry port, each leg, each hand, ears and so on. If it is, it has an entry port.

However, why do things convert to thought, or how?

If the memory has a store for rice, or picks up information on locations, or knows about homeostasis, the memory has a uniform unit of storage. This unit, according to this theory, is thoughts.

So the thought equivalent of anything is what goes to the memory to allow that thing to be known and give how to relate with it: walls, roads, floor, and so on, become thoughts to guide how to be cautious.

The memory stores thoughts or its form.

[https://www.reddit.com/r/neurobiology/comments/rj9lyk/low\_access\_to\_memory\_not\_just\_loss\_in\_dementia/](https://www.reddit.com/r/neurobiology/comments/rj9lyk/low_access_to_memory_not_just_loss_in_dementia/)

Naturally, one hand has precise functionality than the other. This function can be described as thought convertibility. When one hand writes, it is stable and coordinated, when the other does, it is awry and squiggly.

The entry port of that dominant hand has packed shapes, better rotation, often bigger and longer than that of the weaker hand. If their entry ports are adjacent, one is dominant, the other is inferior.

The dominant hand sends finessed thoughts. Whatever the memory knows comes out better with that hand. Writing can be done with the toes — on sand, or with other parts of the body if the way to do it is known.

[https://www.reddit.com/r/psychologyresearch/comments/rhxmvm/multisensory\_integration\_is\_predicated\_on\_thoughts/](https://www.reddit.com/r/psychologyresearch/comments/rhxmvm/multisensory_integration_is_predicated_on_thoughts/)

Knowing is the memory. Since writing was learned or picked up, it can be given to do on paper, on sand, or signing in the air.

Now, using the weaker hand or any other part of the body not adapted to a function would make the entry port begin to open and send thoughts to the memory.

The memory would pick it up, create or adjust a store, then attach it to the groups of how that thing is regularly done.

[https://www.reddit.com/r/Biophysics/comments/rumclc/perceptual\_predictions\_predictive\_coding\_by/](https://www.reddit.com/r/Biophysics/comments/rumclc/perceptual_predictions_predictive_coding_by/)

So writing a letter or figure with the weaker hand gets the store of that hand grouped with writing, as well as stores of what to write.

Theoretically, thought box entry ports, memory box stores, groups, picker-giver, explains neuroplasticity.

Entry ports change with function, so do stores and new groups.

In rehabilitation, it can be described as trying to get the entry ports to open so thoughts can be converted.

[https://www.reddit.com/r/cogsci/comments/rqtxjh/for\_mental\_health\_cognitive\_triangle\_assumptions/](https://www.reddit.com/r/cogsci/comments/rqtxjh/for_mental_health_cognitive_triangle_assumptions/)

In this model, using a hand or moving a leg is by the action of the throwers of the thought box.

The hand does as wanted and as enabled, while this becomes a thought that goes to the memory to say, this is being done.

During stroke or some forms of hemiplegia, the hand may no longer be enabled especially by the action of the throwers, and the ability to have their use converted to thought desiccates.

&amp;#x200B;

[Thoughts: Rules of its Cells](https://preview.redd.it/rczag9nlxj981.jpg?width=2000&amp;format=pjpg&amp;auto=webp&amp;s=181dd0239d107c513c86337334d427279bf3acfa)",Memory Basis of Neuroplasticity
712,physiotherapy,"I am a Physio 29(M) from the Philippines with a AHPRA limited registration. Eventually I would want to work in Australia through a VISA sponsorship. I have been sending my resume to multiple companies and I am hopeful I can eventually land a sponsor. Just to narrow it down, are there specific companies that I should specifically send them to? Appreciate the help. :)",Sponsorships for Limited Registration physios
713,physiotherapy,I am hoping to start an Undergraduate for PT in the UK and I have heard placements can be long and far. Will I be required to work weekends? And how much of the course do they typically take up? Have you ever had to stay away from home to complete them?  Thanks so much,What are placements like for a UK undergraduate studying PT?
714,physiotherapy,"Any applicants to the Master programs in Australia? How do you know if you meet the prerequisites? Do the universities pre-assess the suitability of the subject or do most dont? If they dont and you are lacking in certain subjects, do you take it before the term starts? What if you only receive the conditional offer late in the year and have insufficient time to take them? Thanks",Australia- Master of Physiotherapy
715,physiotherapy,"I've spent hundreds of dollars on what were advertised as ""ultimate comfort"" pillows. 
They just don't fit.

I have very wide shoulders, a short, thick neck, and a large head. I'm also a side sleeper which makes it VERY difficult to find a pillow with proper support. It should be said I'm 50 years old, though my neck doesn't have any major problems behind age.

I'm desperate for a pillow doesn't get soft (allowing my head to sag at an uncomfortable angle) and is high enough to accommodate the longer distance between my neck and shoulder.

I'm not asking for medical advice. I'm just looking for any brands and types of pillows often recommended for my shape of body.

Thank you all for your help.","In northern Canada. Looking for a pillow recommendation for wide shoulders, short neck, side sleeper."
716,physiotherapy,"Hi guys!

I'm nearly finished with my physio degree and registration in NZ. My dream is to work in Australia as a physiotherapist since I would like to get better pay opportunities, and I love travelling. I was wondering if it's hard to find jobs for a newly graduate abroad? Do I need to gain experience from NZ or do you think it's alright to find a job straight away abroad?",Newly Grad Physio from NZ working in australia?
717,physiotherapy,"I’ve always cracked me knees along with many other joints in my body. The easiest way to do so is to stand normally, load the leg slightly and twist my leg. I’m now starting to think about how this could be detrimental to my knee health. To be clear I’m not asking for specific medical advice but was hoping someone would be able to tell me if cracking knees is safe or should be avoided.",Is cracking knees safe?
718,physiotherapy,"I am not sure if this differs by location. Typically, for doctors and dentists, they display their titles (eg MD X University) in practices or in their descriptions. Is this compulsory or common in physiotherapy?",Physiotherapy title
719,physiotherapy,"I’m living in the UK and thinking about becoming a physiotherapist. I was looking on the NHS website for physiotherapists and it says “mix of shifts, such as nights, early starts, evenings and weekends”. Would doing night shifts be mandatory working for the NHS? Also why? Are people really coming in the middle of the night for physio appointments?",Night shifts?
720,physiotherapy,"Hello, one question, is magnetic therapy commonly used with children (2yrd old - 5yr old) for fracture healing?",Magnetic therapy in fracture healing on children
721,physiotherapy,Could anyone link on some useful resources which advocate for the use of physio intervention in patients with mental health disorders?,Physiotherapy in mental health
722,physiotherapy,"Hello,

I’m thinking of doing physiotherapy at university and would love some insight.

First off, do you enjoy your job? Are you glad you do it? 

What are your working patterns?

Maybe odd question but is it easy to find part time work?  I also play gigs and can get good money from that but want to do physio 3/4 days a week. Would it be possible to do that at say band 6/7 in the U.K.? 

Thank you, any help is really appreciated :)",Thinking of doing physiotherapy at university. Do you enjoy it? Is it stressful? Is it rewarding? What are your working hours?
723,physiotherapy,Not asking for medical advice. I don't have benefits and will need to pay out of pocket for PT for a fifth metatarsal fracture. Just looking for an estimate of how many visits I might require so I can budget.,How much PT needed for fractured metatarsal
724,physiotherapy,Hi folks! I'm from India &amp; I am currently preparing for the PCE theory exam. I wanted to know how good or reliable is PTDI for the same?,Prep for Canada's PCE
725,physiotherapy,"I am posting this on my sister behalf. 

She has been searching and exploring several topics for research in her final year project thesis. As she is searching around her keen area of interest. 

It’d be interesting for her to explore wide range of topics for search suggested by fellow physiotherapist from all over the world. 

Thanks in advance.",Research topics for final year project.
726,physiotherapy,"In my country B.S is enough to practice, but the US has DPTs. Could one pass the tests in the US without doing the whole degree again?",Can a foreign Bachelor of Physiotherapy work in the United States?
727,physiotherapy,"Title. What do you wear on a day to day basis, type of top, pants and shoes?",What do you wear?
728,physiotherapy,"Do physios tend to attract students who like sports, are very fit and like to go to the gym? What happens if I am not one of those? Would it be hard for me to fit in? Thanks",Are physios gym goers?
729,physiotherapy,"I have a buddy that I graduated with back in Lebanon who now practices in Adelaide, Australia at a clinic that seems to be a franchise whereas I practice in Canada at a locally owned clinic. 

When he told me his pay it baffled me as I make double that easily. I understand he’s getting a salary whereas I get a % but it still worries me that he is being low balled and doesnt know any better?",Is $1900 AUD biweekly a good salary for a PT in Australia?
730,physiotherapy,"Hi all, I'm not looking for free medical advice, I'm just hoping that someone can point me in the right direction of the right kind of medical professional to see. I've tried seeing soft tissue therapists and a chiropractor and so far no one has been able to successfully help me with my issue.
I'm 32 and about 2 years ago my neck started cracking / crunching when I turn my head to the left. It happens every time I do this movement so it isn't likely to be gas bubbles. I have not had a significant physical injury that could have brought it on, and given that I'm still quite young I doubt it is arthritis (?) . I get a lot of neck pain, although not specifically when I crack it, &amp; I believe it must be linked.
I have spent hundreds on the chiropractor, who seemed to help at first but after the first couple of sessions there wasn't any change. Now he does accupuncture to alleviate it a bit and has given me some neck exercises (the exercises do help to temporarily ease the pain), but it feels like he is treating the symptoms and not the root cause of the issue. I need someone who is going to be able to identify what is causing the cracking and fix it as it doesn't seem right at my age.

If anyone has any advice on what the right kind of medical practitioner would be for me to see (e.g. An osteopath, physio, or even another Chiropractor) then I would greatly appreciate it as I don't have a lot of money for 'trial and error' and the pain is really hindering my quality of life. 

Thank you in advance,

Liz",Continuous neck cracking / pain
731,physiotherapy,"I’ve been treating a patient for a few weeks now. Late twenties, male, athlete. 

He had a tibial plateau fracture a year ago and a few other subsequent and related surgeries including a recent osteotomy about 9 weeks ago. 

He has a number of issue, one of which is poor quadricep contraction. He was also complaining about pain in his VMO today so I tried to kill two birds with one stone and went with dry needling the muscle with stim.

I hit the muscle belly at a few different spots, different angles, different depths but there was no twitching at all. He can contract the muscle a little himself but it’s pretty week. He also said he owns a TENS machine and that also doesn’t cause any contraction of his VMO. Other spots like his Gastroc work just fine. 

I’m a little perplexed why this would be the case. You would think that no matter how underused a muscle was, an external stimulation would work. Does anyone have any experience with something like this or understand why this happens. 

He asked basically the same question I did here and I didn’t have a good answer for why that was the case. I’d like to understand this a bit better. 

Thanks.",No muscle contraction from IMS
732,physiotherapy,"Has anyone studied in Hungary? Are they recognised worldwide/ EU/ UK? Anyone had difficulties?

I am researching how the system in Hungary works, but am I right that Hungary doesnt look at one's high school subject or grades, but just the entrance exam? How hard is it?

Thanks",Physiotherapy in Hungary in english
733,physiotherapy,"Hi everybody, I'm currently a graphic design student in the UK (I'm 17), however I've done some thinking since my interest in design is rapidly declining. I'm really just trying to figure out which path is best for me right now since my brain is mashed.

I really enjoyed science (bio mostly) during GCSE level and I'd like to explore more options, so I'm researching different topics. I love helping people and I'm a pretty patient person, and help my gran with quite a few things, so physio was one of my ideas.

I thought that here on reddit there would be some honest answers from real physiotherapists rather than the decorated career websites, and I'd like to see a couple things from different perspectives;

* What are some pros and cons about physiotherapy in your opinion?
* Do you have any advice on courses that could help to form a career in medicine/the NHS, etc?
* What was your path to becoming a physiotherapist? (if you're comfortable to share).

Thanks all :)",UK graphics student considering other options
734,physiotherapy,,Expert Physiotherapist &amp; Chiropractic Services in Calgary NW
735,physiotherapy,"If I study for a bachelor of physiotherapy in the Netherlands, would it be very difficult for me to work anywhere in the EU, UK, Australia etc that speaks English? Anyone successfully manage to be registered/ find a job in these countries. I am non-EU btw.

Thanks","Study physiotherapy in Netherlands, but work elsewhere"
736,physiotherapy,,AMAZING AND TOUCHING VIDEO
737,physiotherapy,"First year student and trying to understand what is the primary gluteal  muscle that is involved when in dorsiflexion of the foot/ankle.

Thanks",What is the primary gluteal muscle that is active in dorsiflexion of the foot/ankle?
738,physiotherapy,"hi there! i recently graduated with a Bachelor’s of Biomedical Science (initially wanted to do medicine) and now debating on whether i should do physio or OT. i got an offer for masters of OT and bachelor of physio. i am torn between the two due to reasons i’ve listed below: 

PHYSIO
Pros:
- i have a passion for human anatomy and the way the body works
- i majored in anatomy and human biology in my bachelor’s and can apply for credit for recognised learning to reduce the number of years i have to study
- PT’s are more in demand, more stable, more ‘respected’ as a profession, work more closely with doctors and nurses and are seen as the ‘doctors’ of allied health
- i work at a hospital and i’ve noticed that there are a higher number of physios so they seem to have better work relationships with one another and they have their own designated offices and gyms
- i like how physios get to move around more in the workplace instead of being stuck in a room majority of the time
- the bachelor’s degree is around 30k and much less costly than a masters
- physio is much harder to get into and i feel like i should reach my full potential since i got into it (although i know it’s more important to be passionate about something than care about prestige) 


Cons:
- i would have to study an extra 4 years (possibly 3.5 with credit) so it would take longer for me to become a physio
- i would have to do bachelor’s again
- i don’t really like the massage aspects and i am not that passionate about musculoskeletal function/sports and exercise 
- physio seems to be quite repetitive in terms of ‘following the handbook’ for patient rehab and i’m worried that i may become bored of just walking patients down a hallway all day

OT
Pros:
- i have a passion for making meaningful connections with people especially the elderly so i think helping patients perform every day tasks will be more rewarding for me
- OTs have a wider scope in terms of the patients they work with (children, people with disabilities, injured, neurological disorders, mental health, elderly) 
- there is more creativity and problem solving when devising patient rehab plans as opposed to physio
- i like the social aspects of OT and how you have to consider the patient’s whole life not just their body/injury in order to get them back home safely, i believe they also spend more time with individual patients compared to physios so i can develop patient relationships 
- the masters degree is only 2.5 years so i can become an OT in a shorter time than a PT
- it makes more sense for me to finish my bachelor’s and pursue masters instead of doing another bachelor’s
- not as physically demanding as PT

Cons:
- the masters degree is around 80k.. more than double the bachelor’s and i would be in a lot of student debt
- job demand is not as high compared to physios so it may take longer for me to get a job especially since i want to specialise in hospital care and they work more like ‘contractors’ 
- OT doesn’t really focus on human anatomy, more on neuro and fine motor skills
- i am not very comfortable in assisting with the bathing, toileting and grooming aspects of OT

any advice which can help with my decision would be much appreciated! :))

TL;DR i can’t decide between physio or OT. i love the human anatomy aspects of physio but i love the social/patient relationship aspect of OT. physio would take longer for me to complete but less expensive, OT is shorter but far more expensive",Physio or OT? (Australia)
739,physiotherapy,"Do new employers ask for these? Do I need to keep these records from university?

Thanks",Occupational Health and DBS- UK
740,physiotherapy,"Hi, I'm from the Philippines. Does anyone know about the Agency: Grandison Management and what can you say about them?",Grandison
741,physiotherapy,"The Physio Experts has the [best physiotherapist in Gurgaon](https://thephysioexperts.in/), Our physio experts are dedicatedly working to donating outstanding service for the past many years. Various types of physiotherapy treatments are available in our clinic.

&amp;#x200B;

https://preview.redd.it/2qr51up483781.jpg?width=668&amp;format=pjpg&amp;auto=webp&amp;s=4fa2e322f73b972799e47050762a6b6208d1de63",Best Physiotherapy Clinic In Gurgaon
742,physiotherapy,,/physiotherapy Subdirect Statistics
743,physiotherapy,"Hi all,

Hopefully the last time posting, but we are so close to having enough responses for rigour, we just need to get over the line!

I am a practising Occupational Therapist and PhD researcher in assistive technology.

As you all know, there are some issues with assistive tech, and all too often, that has a significant impact on the users. With this, I am trying to see if we can use User-Centred Design, Design Thinking, and Human-Centred Design to improve assistive technologies. 

To do this, I am speaking to Users of Assistive technologies, PT's, OT’s and Allied Health, and Designers and rehabilitation engineers. If you fall into any of these groups, your time is greatly appreciated!

For OT’s and Allied Health, please complete the survey below (it takes 10-15 minutes)

[https://swinuw.au1.qualtrics.com/jfe/form/SV\_bjbnA7R0yKOGQnk](https://swinuw.au1.qualtrics.com/jfe/form/SV_bjbnA7R0yKOGQnk)

If you are or know an assistive technology user, it would be amazing to speak to you about your experiences with the scripting and use of assistive technologies. If this sounds like something you may be interested in, please flic an email to [hphillips@swin.edu.au](mailto:hphillips@swin.edu.au), this can be done online or in-person (if you live in Victoria, Australia)

For designers and rehabilitation engineers, please complete the separate survey below (it takes 10-15 minutes)

[https://swinuw.au1.qualtrics.com/jfe/form/SV\_es2QKweW2ybZRlk](https://swinuw.au1.qualtrics.com/jfe/form/SV_es2QKweW2ybZRlk)

Any questions, please email me at [hphillips@swin.edu.au](mailto:hphillips@swin.edu.au). Thank you all so so much for your time and support","Assistive technologies, can we help our clients with more rigour?"
744,physiotherapy,I am not referring to covid. I am referring to the general vaccine requirements by the state. Do I need to show my vaccinatiom records everytime I change jobs? Asking about this so I can prepare by keeping my records. Thanks,Physiotherapy Vaccination Requirements (Australia)
745,physiotherapy,"I'm in Australia and my mum sees a physiotherapist who uses Physiapp for exercise programs. I have an exercise program from my physio on paper and I'd love to put it into an app like physiapp so I can track my progress and stuff, but physiapp, and other apps like it require a professional to put the program in to the app. I've looked at general fitness tracking apps but they either just track general things like steps, times and weight loss or are like a full personal trainer and require an expensive subscription. I just want an app that lets me track the specific exercises I've been given: whether I completed them, how many reps, how difficult I found them, etc. Like a habit tracker but for exercises, does anyone know of anything like that?",Recommendations for exercise program tracking apps that don't need a physio to make the program
746,physiotherapy,"I am interested in doing physio school in the US. However, all my family is in Canada. Can I practice physio in Canada but do school in the US. Has anyone done this? Whats the process like? Any recommendations or advice related to this?",US physio school but practicing in Canada
