,subreddit,selftext,title
354,physiotherapy,"Hi, so I know this is long but I need to explain the only injury that I’ve had that could possibly contribute to this.

So when I was 15 (now23) I was playing a basketball game and I slammed directly on my pelvis from behind from a height onto a wooden court, I ended up getting an X-ray that day with the outcome of a small space that was created in between my L5 and sacrum which then caused my right sacroiliac joint to *for lack of a better word* rub and grind This lead to pain if standing for long periods of time or even bending or twisting the wrong way on my lower back/lumbar area, I could do certain stretches and physiotherapy every now and then and that helped but this pain lasted about 4 years before it sort of just stopped being an issue and now rarely ever feel pain and I am talking like 2 times a year at most.

I’ve been stretching everyday for about a year now and I’ve noticed that my right hamstring (dominant leg) is much more tighter than my left? I have very good mobility in both my left and right legs but when it comes to my right hamstring I can’t seem to get as deep in the stretch as I do on the left side without my foot pointing and my knee lifting. I don’t feel any pain as though I know I am at the end of my stretch I just cannot get my leg to stay straight. I can also feel my hamstring is very tense when I am in this position compared to my left.

Could my previous injury have caused my hips to have some kind of lateral tilt? Or maybe my body has grown into a position that were the pain is now no longer an issue and it’s caused flexibility issues on the right side? 

Any advice would be great :)",Uneven hamstrings?
355,physiotherapy,"The pt has come in with chronic LBP which has been on/off for 3 years, with his primary complaint being a pain that is ONLY reproduced during true lumbar flexion localised to the L5/S1 joint space or possibly the SIJ. Extension is not painful, lat flex nil pain, nil radiation, nil paraesthesia, traction is extremely painful and restricted. Lumbar rotation exes in supine seem to ease his pain temporarily. He can flex at every level of his lxsp except at the lowest L5/S1. It’s most easily reproduced when doing lumbopelvic dissociation exes in sitting when he is instructed to go into a posterior pelvic tilt. 

I already do a functional based treatment for my chronic LBP patients and give great pain education + graduated exes, but I really would like to know the anatomical basis behind this sharp, localised pain specific to lumbar traction and posterior pelvic tilt at the L5/S1 level. Any ideas?",Came across an unfamiliar pattern of pain in a LBP pt - explanation?
356,physiotherapy,"I would really appreciate some advice on the best course of action for me. If you take the time to read this, thank you.


I finished uni a few years ago (I am now 25). 1 year into my English-related course, I took a year out due to a bereavement. When I came back I wanted to change my course to something health/fitness/sports related, but 1. my uni wouldn’t allow me to change courses and 2. I didn’t have any relevant A-levels. 


I finished my course anyway, and ended up with a BA in a subject I’m no longer interested in. I needed a job and to get on my feet after struggling with my mental health for so long. I didn’t want to get a job related to my degree, and I was too lacking in confidence at the time to do a personal training course, so I got a job as a lifeguard as it’s a vaguely relevant qualification that I already had. 


My workplace is a military clinical facility that rehabs injured and disabled vets/athletes/complex trauma cases etc. I’ve been really inspired by what I’ve seen while working here and I’d really like to get involved, but don’t know how to start. The only xp I have that could be relevant is a few years volunteering at a disabled swimming group where I taught and supported in the water.


I feel that younger me’s career choices are going to hinder me greatly. I feel like I’d struggle to get qualified in anything without even a single relevant A-level to my name.


Today I got talking to one of the physios that works here, who said I could potentially observe or shadow them when I have free time (there’s lots of downtime in my job) and maybe even get work experience here at some point. 


In terms of getting qualified, they suggested that I could first do a biology A-level (which I didn’t know I could do) and focus on getting experience as mentioned, and at some point in the future I would need to get a degree. 

The idea that maybe there could be a way for me to do this after all has made me really excited as there isn’t much opportunity for career progression as a lifeguard. Even more so because it would seem that I could potentially do a lot of the learning etc while still working my current job due to the amount of downtime I get here.


Does this sound like the best way to go about it? Are there any other pathways?",How do I/can I get started on my way to a physiotherapy career? (UK)
357,physiotherapy,[removed],بهترین فوق تخصص مغز و اعصاب بزرگسالان
358,physiotherapy,,بهترین کلینیک فیزیوتراپی در گاندی
359,physiotherapy,"Hey guys i am in my final year Post graduate in physiotherapy and doing my first placement in an acute inpatient setting and was wondering if i could get some input

I am allocated to a designated ward and given a list of patients within that ward everyday. We are then asked to screen these patients and tell our clinical educators which ones we would see and why.

Any advice on improving my screening process. 

Another issue i have on placement is when im doing an ISBAR handover to my clincal educator before seeing my patient i feel like im spending an excessive amount of time looking through previous medical notes. any ideas on how i can optimise reading through medical/previous notes?",Reading medical notes and handover to clinical educator (syd AUS)
360,physiotherapy,"Hi, i don't know if it's the right place to ask but my personal trainer will make a workout for me according to my request, that is to avoid exercises that involves ulnar nerve or that can cause irritation as it happens to me in the past. 

I'd like also ask to you guys 
What are the exercises I need to avoid 100% to so not have in any case ulnar nerve irritation? 

One of these i already know from my experience  is bench press ..",exercises to avoid if ulnar nerve irritation
361,physiotherapy,"
So I'm currently (was) a final year physio student in Australia, with only a few (3) placements to get my degree. I have not been involved in my course for 2 years, due to various personal reasons that precluded me from taking part in placement. I.E I completely bottled it on placement.

Overall, was disappointed by the minimal support provided by my university, and looking towards a clean slate.

During this time, I have moved out of state (to Qld), found F/T work, purchased a home and am currently plodding along. However, I can't help think about what could have been, had I held things together in my final year. Anybody here transferred across physio courses very late in their degree, I have pretty much all my credits up to 2 placement subjects with a solid GPA?

I'd imagine it is probably not possible due to various reasons i.e. quality control, and have made a few calls to the universities without little success. I have the option of graduating with a health science degree, which would enable me to enter masters, albeit with additional time and financial demands.",Any experience transferring to different university in final year of degree (AUS)?
362,physiotherapy,"Aged care is moving funding models from ACFI to AN-ACC in October this year. Under the new funding model allied health will not be funded at all. My current employer has said residential aged care facilities will still require physios and allied health to come in and recommend changes etc. But this is a significant drop in labour needed and there’s nothing in this funding model that states nursing homes need to outsource their physios like they were supposed to with the previous funding model - so wouldn’t they just hire one themselves? 

I work for a large allied health company with over 600 clinical staff nation wide. There are several (at least 5 come to mind off the top of my head with 100s of smaller ones servicing aged care as well) of these in Australia. According to the Physiotherapy board there’s ~33000 physios in Australia with general registration. 

The aged care sites I’m working at have already said they’ll no longer require our services instead relying on their diversional therapists to do tai chi with their residents. In my opinion the new model will create a situation where resident deconditioning will be financially encouraged more than it already is. 

Coupled with the political rhetoric from the health ministers: https://www.smh.com.au/politics/federal/government-targets-aged-care-over-servicing-by-physiotherapists-20220318-p5a5wy.html

The APA is “fighting” for increased funding but it seems like a toothless organisation. Every time they try to advocate for something it doesn’t happen or improve the situation no matter how much they spruik their efforts 🤦‍♂️🤦‍♂️🤦‍♂️",[ Australia ] Will the new AN-ACC funding model for aged care cause an over supply of physios?
363,physiotherapy,"Money is for some reason always a taboo topic, but i think its important that we establish the market rate so that people (especially students and new grads) are aware of what their skills are worth. Please remember to list country, state (if applicable) and years of experience. Also, whether you get other benefits (healthcare etc.).","For qualified physios, how many hours a week do you ACTUALLY work, and what do you get paid for it?"
364,physiotherapy,"Hello, I am Thomas Eddie, and I am currently in my 5th Year at the University of Strathclyde. My final year project centres around the elderly with a focus on the issue of falls and other injuries when navigating the home after surgery or living with a long-term condition. I feel that the mobility aids that are currently available are not particularly suitable for independent living and do not engage well with their target demographic. Therefore, I have developed some concepts that I feel are more suitable for the elderly and will improve their quality of life.

It is important to get feedback directly from users and those who are surrounded by users as this information is crucial to the success of the product. This will help me to adapt and change the product to better suit the user. 

I have created a short survey to gather some opinions on my designs and I would be thrilled if you could take some time to fill it out. I have attached the link to this post.

Survey Link:  [https://stratheng.eu.qualtrics.com/jfe/form/SV\_6P4uVtNYLyS2HzM](https://stratheng.eu.qualtrics.com/jfe/form/SV_6P4uVtNYLyS2HzM) 

Thank you for your time and I hope you like the designs.",Improving Mobility Aid Design
365,physiotherapy,"Hi all 
I have a patient who has endocarditis which has damage arterial valve. This cause drop of blood pressure to 66/45 on exertion, like walking 10 meters with 2WW or doing 4 steps. His normal blood pressure is around 95/60.He does not complain of any sigh and symptoms during exertion. However, I make him rest in-between. He has massive muscle cut in his hip area during surgery for hip joint abcess. It's been 2 months since surgery. I was hoping to start with strengthening exercise. 

Is there any contraindication regarding strengthening exercise with low blood pressure? He is cleared for physio from physician.",physiotherapy Plan of care suggestion
366,physiotherapy,"Hi, I'm an international student from HK and just got accepted to both USyd and UQ's Bsc Physiotherapy programs. I'm wondering if anyone here can tell me which school is better based on past experiences or what friends have said abt them :) I'll be applying for Masters in Aussie as well after the initial 4 years.",USydney vs UQueensland Bsc Physio program
367,physiotherapy,[removed],Physiotherapy treatment for Wrist Pain - Dynafisio
368,physiotherapy,"So i work as a physio in a LTC and my role is mostly to increase physical activity to promote walking and a proper gait cycle. The residence doesn't already have a partnership with a company of that kind so i was wondering which software is the best one 

Things im looking for:
A good registry of exercise for rehabilitation and strengthening for geriatric in particular 

Ability to create programs for patient and save to export and such

Bonus if also has a cognitive stimulation exercise or program and calendar to shecdule patients

The last two are not really needed but neat if they are. I heard of Physiotec and Wellnesliving so dont know if there is some better alternatives or you have comments on these one. I have hexfit for personal use but its not quite not enough in depth and mostly just gym exercise.",Best website/software to have bank or list of exercise for geriatric in canada
369,physiotherapy,,How come I can't feel my core when doing leg raises or planks? I just get a burning in my hips.
370,physiotherapy,"I feel them as ""turned off"". I keep executing the wrong movements when I'm doing bodybuilding because these muscles aren't strong enough to move. Stretching and practicing mind-body training aren't helping.

I went to the neurologist and no problems were detected. I have scoliosis (just a little), which make my spine slightly inclined to the left and my torso is a bit twisted to the left too. I did several sessions of Global posture reeducation a few years ago but I didn't feel any improvement. What can I do? I can't pay for physiotherapy anymore.","Some muscles are very weak and I can't move them no matter how much I try to ""awake"" them"
371,physiotherapy,,Anyone run 2 to 1 student placements in MSK outpatients? We're looking to start but wondering about the practical side of it.
372,physiotherapy,,Foot pronation or not?
373,physiotherapy,"Hello , 19M

My trapezius on my right is well more developed than left (as well as my shoulders biceps and whole body overall which makes it way harder in the gym) and I noticed I move to the left more while walking and while standing I fell my pelvis is rotated which is annoying especially in squats and I can freely rotate my neck to the right but on my left I go to about 70% range of motion maximum should I go to a physiotherapist ?",Body asymmetry
374,physiotherapy,I've had the brace about 4 days and one side of the spring tension isn't working its like it's completely loose? Anyone experienced this or any idea of how I can fix it?,Anyone have any experience with Jack PCL brace?
375,physiotherapy,,What will the future look like for Physiotherapy? - Futuristic Physical Therapy
376,physiotherapy,"For instance commuting, insurance (do you need insurance?), uniform?

Does all these costs take a big whack out of your salary?",What are some hidden financial costs of being a physio? (UK)
377,physiotherapy,I'm mainly looking for exercises that i can do at gym or home to build muscle around the knee and to make the knee overall stronger and possibly for the arthritis to hurt &amp; develope less!,What exercises would you recommend for person with repaired ACL &amp; slight knee osteoarthritis
378,physiotherapy,Hey guys! I'm currently in my fourth year at UofT and I have 5 more classes to take until I graduate. My cGPA is honestly terrible.. but my subGPA last semester was a 3.6 and the semester before that was a 3.4. I'm hoping my GPA this semester will be a 3.7ish and the same for my last one. Would it be possible for me to apply and get considered for any schools within Canada? Experience wise I've been volunteering at a private physiotherapy clinic and I have lots of research experience.,Physiotherapy Schools in Canada
379,physiotherapy,Hi I am from the Philippines and is currently gathering requirements for my visa to work in WA. I already have a sponsorship letter and is waiting for my Limited registration. I would want to make sure my application is approved and would want an immigration lawyer's help. If you know any Immigration lawyers (preferably) or anyone you know could help on that I would appreciate it greatly.,In need of immigration lawyer from Australia for my VISA 482(TSS visa)
380,physiotherapy,[removed],The best physiotherapy clinic
381,physiotherapy,,"patient wants to be friends. a guy is always inviting me for bike rides and stuff, I don't have any more excuses to him. I wanna have quality time when off work, how do you guys deal with this?"
382,physiotherapy,"Hi all

I'm looking for advice on how to approach an interview for a Physiotherapy Apprenticeship. Current background;

2 1/2 years working as a rehab assistant in physio MSK outpatients
Previous BSc Hons in Sports and Exercise Therapy
Spent time on the wards during COVID (ICU, Resp, Acute/Medical)

I've had a Google and got some information from the student room etc, but after anything else you guys can offer

Thanks in advance!",Physiotherapy Apprenticeship Interview help
383,physiotherapy,,کلینیک فیزیوتراپی سایا - کلینیک فیزیوتراپی سایا
384,physiotherapy,"Hi guys, I know this is a long shot but I was wondering if anyone has done a post-grad in Masters program for MSK or Sports at UniSA in Adelaide?  


I was curious if anyone has done it before or anything similar so I can pick their brain on their experience with that. For abit of background I have been working as a physio for a couple of years and finished my undergrad at UniSA. Was contemplating doing the Masters course but wanted more opinions. 

Thanks guys :)",Has anyone done the Masters of Advanced Clinical Physiotherapy (MSK/Sports) in Adelaide?
385,physiotherapy,,Do physiotherapists ever provide Tapping/EFT as a line of treatment?
386,physiotherapy,"To start I have 5 years of private practice experience and worked in two different countries, average 50 - 70 patients a week.

I've been at my current job for nearly two years now and recently have been really struggling.

The husband and wife owners are very experienced but are very manual handling based.
Acupuncture, cupping and ultrasound are used very frequently. Manual therapy is the preferred treatment method and exercise is patient homework more than an in session treatment. I don't agree with this approach. 

I recently made a mistake giving strengthening exercises a sooner than the surgeon wanted. I gave the exercises at this stage by using a different surgeons guidelines as this surgeon didn't provide any. 
Since this incident I have had 4 messages through our notes system, a 30 minute review with one of the owners, watched a rotator cuff repair with the surgeon (who was super nice and was helpful) and written a reflective statement all in the span of about 3 weeks. 

I was sent the points for my performance review and this patient was brought up again. They want me to have weekly session with either of the owners cause they feel ""I might think I'm doing the right thing but the patient may not feel like I am"". Essentially they think I don't know what I'm doing. 

Over the last 2 years I can't say I've had any major issues other than the bosses expecting manual therapy be provided in every single session. Which honestly I don't do because my clinical reasoning says that's not appropriate for every session. 
One other issue is my follow up to initial patient ratio isn't good enough i.e I need to be seeing more follow up appointments. 


At this stage my confidence is shot, my motivation is at an all time low and I'm at the point where I just pack it in and change career. 

I'm pretty lost, burned out and over it. 

Has anyone else had a similar situation?

What did you do to help?",Struggling in Private practice
387,physiotherapy,Or is that soreness isolated to muscles only?,Can ligaments/joints get DOMS?
388,physiotherapy,"So I have scar tissue on my ischiocavernosus muscle (diagnosed by previous physio). I am definitely in the remodeling phase and I cannot flatten this scar with the crazy amount of force I am using with a graston tool. 

I am using 3mhz, however I am not sure if I should be using pulsed or continuous? And what intensity? Mine goes from 0-3.5. Can using it too long cause damage to the muscle? 

Thanks for the help.",Question about using an ultrasound machine
389,physiotherapy,"Hey, don't get mad at me. I fucked up my atfl 4 years ago and lo and behold even after like 20 sessions, it's still annoying. Any single girls here that want to get to know me?

Background : I'm 6'3 and work as an engineer but trying to become a programmer. I'm too lazy to take time out of my day to go to pt appointments, but I'm down to meet a girl that will massage me before sex for example. I've tried this before at my pt office but I only ended up fucking the receptionist and not the the actual pt :(

Not a troll, I'm being serious
Get to know me, don't ban this mods, please",looking for a physiotherapist gf in Toronto
390,physiotherapy,,کلینیک فیزیوتراپی سایا - کلینیک فیزیوتراپی سایا
391,physiotherapy,"I am currently a second year student in university (in Australia) and struggling to get my head around just how much content we learn. I often find myself forgetting most of what was done last week and I’m very worried about how I’ll perform on placement when I can just about remember half of the things we’ve done. So my questions are:

1) How were your marks in placements/ clinical rotations ( was it really hard to pass?) 
2) What percentage of what you learned in university do you actually use on a daily basis?

Would love to hear everyone’s thoughts on this, especially physios who are based in Australia or New Zealand.",Questions for currently practicing physios.
392,physiotherapy,"Often times, in reading about ulnar nerve entrapment, the focus is on how it can be trapped/irritated at the elbow. But does the strategies someone might use differ if the pain exists up in the posterior of the armpit, running down through to fingertips of pinky/ring finger?","Thoughts on ulnar nerve entrapment, with pain/tingling throughout the entire length of the nerve?"
393,physiotherapy,,What is everyone's experience with treating Critical Illness Polyneuropathy?
394,physiotherapy,"Hi!
I have been on this subreddit for close to 6 months and decided to try my luck on asking a question to international students or practicing physiotherapists who got the chance to study the course through scholarships if they could help me in any way on ways of acquiring said scholarships in the UK, Canada, Australia or even the USA. I'm currently in my first year of Medical School in my current school but I'm interested in leaving due to the constant strikes taken by the school.
I would really appreciate if anyone could help me with this!
I know this might send of red flags but I'm Nigerian and I live in Lagos so😪✌🏾",Scholarship Hunting for an aspiring Female Physiotherapist.
395,physiotherapy,"Hi, I am a bit confused about which country to accept an offer from and am looking for some advice from people who have experiences in either country.

I received an offer from UBC for their Kinesiology program and University of Birmingham for their MSci Physiotherapy program. I am deliberating which university to accept an offer from because I am an international student (from Hong Kong) and have to take into account immigration issues and whatnot. I want to end up in Canada and was wondering if a transfer from the UK to Canada is recommended, especially since I want to get my Masters in Canada.

Also I was wondering about the scope and future of physiotherapy in both countries. Which country is (in your opinion) better in the long run as a physiotherapist AND international student? Thank you!",Canada VS UK
396,physiotherapy,"Hi, currently in Thailand and in a cast for another 2 weeks after full ligament tear (the one that goes across the top of the ankle don’t know the name) and fracture of the fibula.

Are there any exercises I can do when the cast is taken off? I’ll also have a pool so is walking in the water a good idea?

Thanks in advance.",Grade 3 Ankle Sprain
397,physiotherapy,"Hi guys, 

Has anyone finished both McKenzie MDT &amp; Maitland concept courses? How do you make it work? MDT in itself has clinical reasoning, mobilisations, manipulations, orthopaedic tests, has ""Other"" classification. So, it is a full ortho package. One can add to it neurodynamics, more manual therapy,...

I spoke to some people who are Dip. MDT whom finished Maitland cert. and they say that only thing from Maitland they took was ""brick wall"". 

Do you have some experience with it? How do you do it? Combine it? If its not for open discussion I would really appreciate if we could chat in PM a little bit.",McKenzie &amp; Maitland integration
