,subreddit,selftext,title
1127,physiotherapy,"So, I'm an Indian 12th grade student. I'm considering taking a bpt(bachelor of physiotherapist) course. 
So what would be the average salaries for physios in countries like Canada, Germany, France or Switzerland?
And how likely it is for an Indian citizen to get a job there, Like is it supper hard to get one there?",average salary for physios in American and European countries
1128,physiotherapy,"Would I need a lot of strength/ stamina if I want to work as a physiotherapist?

Is there an area of physiotherapy where one does not lift the patient a lot, does not really give the patients exercises etc?

Thanks!

\-UK/ Australia/ New Zealand",Physiotherapist as a career - Strength required?
1129,physiotherapy,,cross post from r/RedSmileGroup :-)
1130,physiotherapy,"37 year old male with right shoulder partial thickness tear. He came with shoulder pain, weakness, less  ROM and muscle atrophy. I am a physiotherapist. I released his  muscles pectoralis, teres mineo, subscapularis, trapezius and rhomboids first to bring about change in his movements. When we saw improvements, then we began with active assisted ROM, he felt way better and that to helped in improving his flexion and abduction. After a while when we were doing AAROM , we saw that his right arm was atrophied, so I searched and came across BFR technique,, which I discussed about it to the patient and applied it. It bought significant changed in muscle hypertrophy.Sole purpose to do BFR technique was to bring about muscle strength and hypertrophy. Now that the right arm is about the same size as left I want to work on external rotation and abduction movement. So my question is can we do mobilization to achieve that movement?? I know we cannot but just hoping for it,, or anyone know any technique to increase ROM without putting lot of stress on that tear.... Thank you",Can we achieve shoulder external rotation in supraspinatus tear (partial thickness)
1131,physiotherapy,"Hey guys I was pretty keen on going to chiropractic school but finally had the realization that it isn’t for me. I really love the work Physiotherapists do and that it’s scientifically backed by evidence. I would like to go to Physiotherapy school after my undergrad (going into my 4th of Kinesiology). I wanted to ask this subreddit what I should know and for some tips before applying to Physiotherapy programs in Toronto. I’m probably going to take an extra year to retake/take any courses to meet the requirements to apply. Are there any easier Physiotherapy programs in terms of acceptance rates that I can also take a look at, since I know Toronto programs are super competitive. Thanks for the help guys!",Interested In Physiotherapy - Need Help
1132,physiotherapy,"hey guys, 

I'll be studying for Bachelor of physiotherapy soon I was wondering if anyone could recommend good beginner books? I am not sure which ones to choose because there are so many options !! I will be studying in Australia are there any specific books universities tend to refer to? 

Thanks",Book recommendations for Physiotherapy students
1133,physiotherapy,[removed],Why are chin tucks recommended to only do for 5 seconds as opposed to other stretches that are usually at least 30 seconds?
1134,physiotherapy,[removed],India's No.1 Physiotherapy Brand- The Skilled Physio | Book An Appointment Now
1135,physiotherapy,,The Skilled Physio- Physiotherapy At Home | Best Physiotherapist Near You
1136,physiotherapy,"Hi I'm looking to put together a complaint about a physio therapist so I'm looking for some insights into good/bad practices. You might see several similar posts from me here over time.

Question:

Is it ethical/legal to take a picture of a client on the professionals phone? Said client was half dressed lying face down and wasn't asked for consent, it was done to show the client his back posture supposedly but this was never asked for or initiated . The therapist also showed the client similar photos of other clients on his phone talking about there personal injury. This was not done in a professional manner and seemed like they were mocking the other clients of how bad their posture was and laughing etc. This made me extremely uncomfortable.

There are countless other more serious issues with this therapist but I'm wondering how serious this would be considered by other professionals?

Thanks for your insights",Unethical Practice?
1137,physiotherapy,"So i live in belgium and i work in a nursing home as a physiotherapist. Recently the law has changed and i am not allowed to treat the ""self sufficient"" residents, only external physiotherapists are allowed. Most of these residents dislike that because they prefer me as i am a familiar face. Could i maybe start a side buisiness as a self-employed physio and treat them after my hours at the nursing home? Anyone who knows more about this strange new law, please endulge me :)
Thanks in advance",How do i legally treat my patients? More info in text.
1138,physiotherapy,,Affordable services for Physiotherapy In Western Australia
1139,physiotherapy,"Hi everyone! 

(first of all, i hope this is the right thread)

I've just received my Bachelor's in Physiotherapy in India and I aim to complete my Masters degree (in neurologic conditions) abroad. Most preferably in Australia, NZ or in the UK/around Europe. Of course I know that being an international student will cause a HUUGE dent in my wallet- but I wanted to study and complete my masters somewhere I can settle down; and for me it's either of the two. 

I've done most of my research on a good, well-reputed college, but I am still unsure of how the course goes in each country; and for that I'd need your help!

For universities in the UK, most of them need an experience of 1-2 years and I honestly couldn't find a course that didn't need it. If you have any in mind do let me know! But for now, UK is my last option.

&amp;#x200B;

In Australia and NZ (gosh, i know it's going to be super expensive), I found UTS and AUT quite interesting.... however, I also noticed that neither offer neurology focused courses. I just need a glimpse of how the degree is carried out, so if anyone has a basic idea... please do let me know.

&amp;#x200B;

Essentially I am to become a neuro-physiotherapist... and if you'd help me move on from carrying my bpt degree to a masters in the same field... i'd be really grateful.

Any other routes are also appreciated, I'll take all the help I can get!

Note: My grades are pretty good, IELTS around 7.0/7.5, financially i'm OK... but we would take out a loan if need be.

Another note: SORRY IF THIS IS IN THE WRONG THREAD!!!",Msc Physiotherapy help!
1140,physiotherapy,"Hi, I was wondering if it is against the code of ethics to tell a client randomly a bunch of times to leave a positive review for them on their site and for the client to direct people in online forums to their site for business. If so, how bad a practice is this? Like basic common knowledge in the field?

I would talk about an online community here on Reddit for a specific injury I had and he didn’t seem to care about what I was saying but only for me to direct them to his site for business. He brought this up several times randomly over different sessions telling me to direct people to his website.

If I mentioned that I was feeling better he would also tell me to write a positive review on his site. He done this about 4 times as well.

I wouldn't respond and never done either of these.

&amp;#x200B;

Thanks!",Is this Ethical Practice?
1141,physiotherapy,"Was wondering what other job opportunities do you guys know or have experienced while being a student thats beneficial in terms of having extra experience/ learning? 

I’ve applied in hospital setting PTA and private clinic receptionists roles (hoping to also mirror physiot I can and go through case studies with them etc)

I just want extra experience outside of uni and I dnt know where else to apply..

Australia",Job opportunities as student physios
1142,physiotherapy,,"Hey, student here. I’m wondering if anyone knows any good audiobooks on audible (Australia) that may help boost my learning - hoping for some concerning musculoskeletal! Thanks!"
1143,physiotherapy,"Any recommendations? I was looking at FRC, but a couple of you guys don't like it here?",Courses/Certification for PTA
1144,physiotherapy,,Anyone have a clue what this might be?
1145,physiotherapy,,Anyone have a clue what this is or where I can find it?
1146,physiotherapy,"Hi there,

4th year undergraduate in Singapore and I'm currently in placement. There's this new school policy for allied health students in placements which says that for students who fail 2 consecutive placements, the student will be asked to drop out of the course (that is to ""maintain the standards of \[the university's\] graduates""). Unfortunately I'm stuck at this choice point now and thinking whether I should  appeal to the examiners' board to repeat my MSK placement a 3rd time or to just drop out. 

In the first MSK placement I didn't start it with the right headspace - I didn't think I had good foundations because I didn't do well at all for the past 3 years which have been a struggle. I scraped through my practical exams as I have performance anxiety, and I'm currently seeing a counsellor to manage it. Staying back till late to plan for the following day's cases also took a toll on my physical and mental health. Couple that with poor confidence and low self-esteem, when I was unable to perform during my cases I just spiralled. I cried 4 times in front of my work mentor for 4 weeks and was miserable and tardy in general.

I was more in control and could manage my mental health better in the 2nd placement, so that was where my difficulties with the clinical skills were more apparent. Because I was caught up with wanting to do things right rather than safe, I tend to zoom in on what I want to observe and I fail to widen the lens and see what's around me. For instance, I would usually stand at a distance to observe my patient's gait, but you should at least be at a standby assistance level if the patient's gait is unstable.

Another reason is that I have difficulty modifying my assessments and treatments to my patients' needs on the fly. I find that difficult to plan for or predict, and the possibilities can be endless. Many times I had to scrap my plans for my review knee patients as they would present with acute flare-ups, or find that their main concern is now their back pain.

I have been asking my closer friends for their perspectives and most of them agree that I should toughen it out and complete the degree. My fourth year is only less than 9 months. However I found that the past 3 years have been a struggle - I couldn't find anything which I really excelled in (anatomy was REALLY challenging because I coudn't memorise well), I didn't really ""enjoy"" what I learned and my GPA is less than a 3. The main reason I joined physiotherapy was because I wanted a career that could impact the lives of others meaningfully. But it is also true that I can also do the same in other professions.

I  just feel that things would only go uphill from here should I be successful in my appeal- I am behind my peers 3 months, would be juggling with 2 thesis (1 group and 1 4.5k individual)  papers, and I must not fail my remaining 3 placements (MSK is my 2nd of 5 placements). At this rate I'm not sure if I can graduate with my peers on time; I will know more once the head of programme emails me regarding the next actions to take. My friend says I should just tackle things one at a time, but it's demoralising to know that even though I have put my best foot in it wasn't enough for me to make it through and I'm just tired. If I do decide to drop out, I do have backup plans to venture into F&amp;B, which is something that excites me.

Thanks for taking the time  to read through. Any thoughts and words of wisdom would be very much appreciated.",Thinking of dropping out of physio
1147,physiotherapy,"I did my undergrad sports science degree with 2.93/4 GPA and did another master of sports medicine(but my GPA is not high for this program).

Is that still possible to enroll or get into the MPT or DPT in MQ/USYD/UTS?

Anyone can share their experience about their applications?

Thank you.",Master of Physiotherapy/ Doctor of Physiotherapy in AUS
1148,physiotherapy,,Master of Physiotherapy/Doctor of Physitherapy
1149,physiotherapy,Looking for some online resources/courses/quizzes that are well packaged as a little extra thing to dive a bit deeper on some topics. Does anyone use physioplus? What do you think of it if so?,Physiopedia's Physioplus service: What are people's thoughts on it?
1150,physiotherapy,"When you make a fist and relax it why do I see something moving in my wrist, is it muscle/tendon, what is it?",What is it
1151,physiotherapy,"Hurts to supinate arm when elbow is bent, anyone else has this problem?",No idea
1152,physiotherapy,"Hi all,

I have recently started my first rotation in msk in the UK. I was wondering if anyone had any tips for time management. We have 45min new patient and 30for follow ups, when I have 10-15 minutes after a session I am ok, but back to back patients is leading to me either being late, or my notes and exercise plans piling up and ultimately me starting to miss things and my clinical reasoning going out the window. I know I need to finish my sessions earlier, but struggling to fit everything in, usually in a back pain patient it takes me 4-45 to do a full subjective and my neuro...",Time management which in msk new grad
1153,physiotherapy,"I am a new physio grad and I am trying to gather some information on the different benefits and salaries across Canada. I am in BC so I may have different ideas compared to other provinces. If you do respond can you please give a rough idea of what kind of work you do, your hours per week, and general salary.

I also could be very wrong with some of my information so please correct me 

From what I have heard: 
Private clinic contracter - starts with 50/50 split for new grads - if busy can make 100k+ a year. Average salary in a busy clinic working 35 hours a week - 110k? - you do not get paid leave or vacation as you are not considered ""an employee"" of the clinic. I am unsure if you get benefits from the clinic as well


Private clinic hourly - Starts 35 - 40hr. Can get up to 45/hr - you get paid if you see 5 patients or 15 patients in a day. You also get paid time off, vacation and benefits as you are an employee of the clinic and not considered a contracter. 

Working in hospital - Starting 34 - 37/hr depending on province. Can get up to 44 - 48/hr depending on time and experience. Great benefits, time off, vacation, pension etc. Can take a while to get above 40+/hr compared to working in a private clinic. I also heard you have to be on call on weekends and holidays when you first start out.

Thank you for reading and I hope to get some responses back",Differing salaries in Canada
1154,physiotherapy,I'm thinking about majoring in physiotherapy but everyone told me it's too hard and too many information in short period is it that hard?,How hard is physiotherapy
1155,physiotherapy,"Currently in my final year of highschool, not seeking career advice but rather your experience as a physiotherapist? What is your lifestyle like (i.e work-life balance)? Is it what you expected it to be? What should one expect going into physio? What do and don't you like about it?

Thanks in advance.",What is it like being a physiotherapist?
1156,physiotherapy,,Best physiotherapy clinic calgary
1157,physiotherapy,"Is the shoe really the reason?
the pain persists eversince",I started feeling pain in Achilles tendon after wearing certain shoe that puts pressure on the tendon
1158,physiotherapy,"May seem like a silly question but I am early days with a pretty bad proximal hamstring tendinopathy which will take a long time healing, 3 months + I’m told. Am still training upper. But my lifts seem to be way weaker than usual. Eg shoulder press is 5kg down. Is there a correlation or am I imagining it? Have never had a bad injury before!
Thanks",Hamstring injury. Upper lifts weaker?
1159,physiotherapy,"Hi Everyone,

I am trying to help my wife find some volunteer opportunities as OTA/PTA in Toronto / GTA. She’s been out of the field for a few years and she is looking to regain her knowledge. Ideally she would like to volunteer at a rehabilitation centre. Any suggestions on how to find volunteer opportunities? Thanks!",Volunteer OTA/PTA Opportunities in Toronto/GTA
1160,physiotherapy,"Hi team, so I've recently graduated from Masters of Physiotherapy and have secured part-time work in a private practice and casual work in a hospital. I was wondering if anyone knew what to expect as a new-grad, as I'm starting to have second thoughts about whether this is a good idea or not - mainly for reasons involving appropriate support, job security and development. 

Any info or advice is greatly appreciated!",What's it like juggling private practice and hospital work as a new-grad?
1161,physiotherapy,,"Does this career preserve all these efforts ? Plz, i want someone to tell me about only advantage in this sh**?"
1162,physiotherapy,"Hi, I have a question about language learning. I posted maybe something similar, but still have some questions cause I accidentally deleted the thread.

Currently I live in Croatia. Right now going into my last year of Bachelor degree, planning to do a Master's degree after Bachelor also. 

My English is at C2 level, I have a certificate following CEFR standards. I'm also starting to learn German from A2 level this fall. Planning to get my German to B2 level. 

Now I wanna know how much does it help with job finding and employment, to have these language certificates?

Will it be a lot, lot easier to find a job or it's still gonna be a pain in the ass?

My big goal is to work in some professional sports (football club, basketball etc.) outside.

 A smaller goal first is to get a good base of knowledge, experience( already volunteering in professional football club) and I guess language while I'm still a student. 

I am of course willing to work first in some clinic or rehab center but would like to push myself and get into sports somewhere out there. How much does language help with that?

Thanks for answering my question.",Language learning
1163,physiotherapy,,cross post from r/RedSmileGroup :-)
1164,physiotherapy,,Pec tear. Or ligament tear.
1165,physiotherapy,Would be interested to hear the differences between NHS and Private PT’s,"Physios, what’s the best and worst part of your job?"
1166,physiotherapy,"I'm a 25-year-old from Canada with a liberal arts degree. On top of that, my GPA isn't very good. It's about a c+. 

I'm interested in becoming a physiotherapist.
I've been doing my Google's and found out that one can become a physiotherapist even if they don't have a science degree, but with a degree in anything. The catch is that they must take the prerequisite courses and get a certain avg in these courses. On top of that, they must have a certain sub gpa.

I want to know if I can become a physiotherapist with my credentials.

If so, how?

If not, what should I do?",How does one become a physiotherapist in Canada without a science degree?
1167,physiotherapy,"I have a kid who is starting tackle football this week. He will be playing blind side tackle on the O-Line and defensive end on the D-Line. Since these are not ""skill positions"" like running back and wide receiver, that need to do a LOT of cutting movements, I was wondering if it would be wise to do a small tape job as a preventative measure. Lineman are constantly pushing each other off balance and there is a small but reasonable expectation that you might have someone crash into your legs/ankles while you're focused elsewhere.

At the same time, my kid is 11, so he's basically made of rubber and can bounce back very quickly. 

disclaimer: I have never played american football, but was a competitive soccer player. Taping my ankles was out of the question as a midfielder who needed all the range of motion I could get. But I am familiar with taping because of multiple ankle sprains over time",Should kids tape their ankles when playing sports?
1168,physiotherapy,I'm a foreign educated DPT (Pakistan) and I'm interested in doing my postgraduate training in the UK preferably in something MSK related. From what I've researched there are a few universities that are offering degrees in advanced musculoskeletal physiotherapy like Coventry so I would like to know the quality of the masters program and if you guys can give me some other recommendations that can help me improve my clinical skills when it comes to MSK physio. I would also like to work in the NHS after completing my masters so are there any pathways and how is the job market for PT in the UK etc? Would appreciate all the guidance :),What are some good postgraduate courses in musculoskeletal physiotherapy in the UK?
1169,physiotherapy,"I'm wondering if you guys could explain something to me real quick regarding insurance as I'd like to see a physio. 

My insurance covers physio, massage, Chiro, etc.

But it also says under all of this:

$800 per benefit year for all practitioners combined

Does that mean I can only use $800 for each category? 

Thanks.",Quick question regarding insurance coverage
1170,physiotherapy,"Hey guys,

I'm 27 from the UK and am wondering if anyone can give me any tips or recommendations where to start to get into sports physiotherapy?

A bit of background about myself. I have no prior knowledge of the profession but have been athletic all of my adult life. I am a 9+ year BJJ practitioner and have also been doing CrossFit for a number of years, I have been to a number of different physio over the years for injuries or to improve movement and have always been fascinated by their knowledge, and have always wondered whether it could be an interesting career path for myself. Unfortunately all of my qualifications are related to my current career which is nothing to do with sport. 

I am fully aware I would eventually need to take a full degree, however at the moment it's still just an idea. So I was wondering if there is anything you could recommend for.me to dabble in to see if it's really for me. Any small time courses maybe, books? Whatever 🙂. As I am ofcourse reluctant to spend thousands and years to change careers if I'm not 100% sure it's right for me.

Thanks!",Where to start?
1171,physiotherapy,"I'm from Canada specifically Ontario and I'm entering my grade 11 year. I have all the classes needed for physio such as chem,bio, and even a class that introduces us to kinesiology. It is a grade 12 class and I'm worried that I may have to retake in grade 12 because I didnt do as well. What kind of marks should I be getting to get into a good program? And can someone explain to me generally how to become a physiotherapist?

My family has also recommended I volunteer at a clinic to see what they do but I'm not quite sure how to do that as someone with little volunteer experience/getting out there on my own lol. 

Any help would be appreciated thanks!",High School Kid looking To Be Physiotherapist
1172,physiotherapy,[removed],Whats the difference between muscle weakness and hypotonia in babies?
1173,physiotherapy,"I'm **recruiting UK patient facing healthcare staff** to take part in **research into values, wellbeing, and burnout.** I welcome you to take part and also to spread the word. The **survey takes 30 minutes**, but there's a **chance to win £100** for your time. Thank you in advance. 

**Please note** that the survey is easier/faster to complete on a laptop/desktop rather than mobile device. 

**Click the link** for further information and to take part!

[https://unioflincoln.eu.qualtrics.com/jfe/form/SV\_eOM9lhw0NQgYYdg](https://unioflincoln.eu.qualtrics.com/jfe/form/SV_eOM9lhw0NQgYYdg)","[Repost][Academic] UK Healthcare Staff Values, Wellbeing, and Burnout Survey. Have Your Say!"
1174,physiotherapy,"Hi, I am a biology student (and fitness instructor) in the UK and I'm considering my options after graduation. I would like to work in healthcare as it's always interested me, but I'm not sure which section of healthcare would be best for me. I'm considering doing a physiotherapy masters degree, could any physiotherapists give me advice? 

Do you enjoy the job?
Is it rewarding?
Do you feel you are paid fairly?
Is there lots of work available?

Thanks in advance for any help",Is physiotherapy a rewarding career?
1175,physiotherapy,"Hi all

I’ve just finished my bachelor of sports and exercise science from WSU and am now doing an additional unit to satisfy the prereq for the masters program at USYD/UTS. My main concern however, is my GPA - 5.571 on a 7 scale. I’ve converted this to WAM if it help, coming in at 74.15. Does anyone have experience with being selected for either masters program with a relatively ‘average’ gpa, or know someone that has? UTS has an interview process so I’ll need to be sure that I nail that. Anyone have any tips? 

Thanks!",Sydney - Masters of physiotherapy
1176,physiotherapy,"Looking for some inside knowledge about this program. How does it compare with the masters programs available in Sydney? The 3 years doesn’t deter me, just looking to weight up my options in terms of quality of program / education and overall experience!",Macquarie Uni Physio Doctorate (Sydney Australia)
